Category,Title
IAB1,Shhh: James McVey Is Planning To Pop The Question
IAB1,Josh Radnor joins series
IAB1,Synchronize with the Sound of the Universe
IAB1,On the Artist and Patience: Rilke\'s Advice
IAB1,"Vice Media CEO Nancy Dubuc Says Millennials are ""the Future""  | Fishing for Answers"
IAB1,On the Artist and Patience: Rilke's Advice
IAB1,"Claire Foy Talks 'First Man,' Ryan Gosling and 'Crown' Co-Star Matt Smith | Fishing for Answers"
IAB1,Jake Paul & Shane Dawson React To Breakup With Girlfriend Erika Costell
IAB1,Hugh Jackman partied till 2am for 50th birthday
IAB1,"Busy Philips Says ""Hey Guys,"" Talks New Late Night Show 'Busy Tonight' | Fishing for Answers"
IAB1,Das Beste von De La Ghetto
IAB1,10 Things You NEED To Know About Article 13
IAB1,De La Ghetto Wants You to Take Part of His Movement
IAB1,"Sebastião Salgado, a Reality of the World in Black and White"
IAB1,Sean Anders Explains Adoptions And How They Work In 'Instant Family'
IAB1,Mario Bautista Opens Up About De La Ghetto
IAB1,Everyone Loves De La Ghetto
IAB1,Piso 21 Gives Us Latin Vibes
IAB1,This is The Best of Luis Miguel
IAB1,Pablo Alborán's Most Intense Lyrics
IAB1,Top 5 Greatest Gravity Falls Moments!  | Toon Town
IAB1,Best Hormone Monster Moments! (Big Mouth Season 2)
IAB1,Jesse &amp; Joy's Bond Goes Beyond Family
IAB1,In The Style Of: The 2019 Golden Globe Awards
IAB1,10 Most Insane Coincidences Ever Recorded
IAB1,Why You Should Watch Narcos
IAB1,"Years & Years' Olly Alexander Talks 'Palo Santo,' Working With Judi Dench & More | Billboard"
IAB1,Robert De Niro hints at ‘The Irishman’ theatrical release
IAB1,'Roma' und 'A Star is Born' sind die großen Sieger der Critics' Choice Awards 2019
IAB1,Love Island's Jess Shears and Dom Lever secretly wed
IAB1,"Big Singers, Bigger Friends"
IAB1,De la Ghetto and J Balvin Make Our Weekend &quot;Caliente&quot;
IAB1,"Elizabeth Taylor, in Love With Love"
IAB1,10 People Who Disappeared Without A Trace
IAB1,The incredible musical mind of Taylor Swift
IAB1,10 Marvel Villains That Put DCEU To Shame!  | Comics And Anime
IAB1,Here Are Great Christmas Movies Now On Netflix
IAB1,The Favourite’ lives up to it’s name at British Independent Film Awards
IAB1,"Julieta Venegas, Composing Comes Straight from Who She Is"
IAB1,Robert De Niro breaks his silence on divorce reports
IAB1,Bianca Del Rio gives her opinions on everything British
IAB1,‘Black Panther’ Star Gifts MTV Movie Award To Real Life Hero | NW News
IAB1,Taylor Swifts 'Look What You Made Me Do' hat 1 Milliarde Klicks
IAB1,Billboard Critics wägen den besten K-Pop-Alben von 2018 ab | Billboard-Nachrichten
IAB1,Exclusive Interview - Chris Pratt says ‘Lego Movie 2’ lives up to the original
IAB1,"Elton John wettet sein Haus darauf, dass „Shallow“ den Oscar holt"
IAB1,The Power Plays Of Dick Cheney In 'Vice'
IAB1,Watchmen || Conspiracy In Film
IAB1,Avengers: Infinity Wars Viewing Record BROKEN! | NW News
IAB1,Trivia Youth
IAB1,Is Wall-E A Killer?
IAB1,Birds Of Prey Probably Wraps In April
IAB1,BIGGEST BLOCKBUSTERS of 2018 Part 2
IAB1,Natalie Portman wurde in jungen Jahren zum Objekt der Begierde gemacht
IAB1,Macaulay Culkin changing his middle name
IAB1,Simon Neil wants to inspire people through Q Award win
IAB1,"Cardi B veröffentlicht ""Money"" -Musikvideo | Billboard-Nachrichten"
IAB1,'Separation': Rupert Friend to Star in Horror Film Directed By William Brent Bell | THR News
IAB1,Biffy Clyro ready to headline Glastonbury
IAB1,Das hält Tamsin Greig von dem Film 'The Favourite'
IAB1,Christian Bale saved his director’s life while making ‘Vice’
IAB1,5 Dirtiest Jokes in 'We Bare Bears' | Ruined
IAB1,These Wedding Dances Take A Surprising Turn Into Amazing
IAB1,5 Dirty Jokes You MISSED in Xiaolin Showdown | Ruined
IAB1,"Chris Hemsworth, Tessa Thompson In 'Men in Black International' New Trailer"
IAB1,Laura Pausini\'s Unforgettable Evolution
IAB1,'Baby Shark' Places in Top 40 on Billboard Hot 100 | Billboard News
IAB1,Cartoon Network Theme Park REVEALED! | NW News
IAB1,YouTube 2018 Rewind Officially Becomes Most Disliked Video on the Platform | Billboard News
IAB1,Kenan Thompson Is Amped Up For Christmas
IAB1,Knutschkugel-Treffen in Garlenda
IAB1,Jonathan Pryce Gets Very Sweet With Glenn Close In 'The Wife'
IAB1,Kurt Russell Wants His Films To Speak For Him
IAB1,‘Zootopia’ to get two sequels
IAB1,"Robert Downey Jr’s Iron Man Suit Costing $325,000 STOLEN | NW News"
IAB1,10 Unexplained Photos... Explained
IAB1,Reality Star Jenelle Evans Hospitalized
IAB1,Voltron Season 6 in X Minutes | Nerdflix + Chill
IAB1,Classic 90's Songs That Are Still Hits
IAB1,Robert De Niro splits from Grace Hightower?
IAB1,Avengers Cast Gets Matching Tattoos | NW News
IAB1,THE WALKING DEAD | Season 1-7 Recap
IAB1,Laura Pausini's Unforgettable Evolution
IAB1,Robert De Niro confirms split from Grace Hightower
IAB1,The First Trailer For 'A Dog's Way Home'
IAB1,Joanna Lumley Set to Host BAFTA Awards For Second Time | THR News
IAB1,Rowan Atkinson Makes Fun Of Virtual Reality
IAB1,'Men in Black International' Gives A Sneak Peek At Brazil CCXP 2018
IAB1,Here's How 'The Bachelor' Plans to Evolve in the Social Media Era | THR News
IAB1,Executives of the Year Recipients Accept Award at WIM 2018 | Billboard
IAB1,Remember When Patti Mayonnaise Suffered From an Eating Disorder on ‘Doug’? | Ruined
IAB1,"Hayley Kiyokos ""Girls Like Girls"" erzielt 100 Millionen Aufrufe bei YouTube | Billboard-Nachrichten"
IAB1,"Zarcort, Cyclo and Piter G Start Pulse"
IAB1,"ExcerptPablo NerudaThe Captain’s Verses, 1952"
IAB1,Piso 21 Premieres Ubuntu
IAB1,What's Coming to Netflix in December 2018 | THR News
IAB1,Disney’s Dumbo Live Action Trailer REACTIONS! | NW News
IAB1,Teen Mom’s Ryan Edwards ARRESTED!
IAB1,10 Worst Things To Come Out of the USA
IAB1,Pro Green talks about the influence behind his new single
IAB1,George Clooney and Natalie Dormer's Coffee Quest
IAB1,Helena Bonham Carter contacting Princess Margaret
IAB1,International Talents Who Caught the World's Attention in 2018 | THR News
IAB1,chemo dance father daughter
IAB1,Fourth ‘Star Trek’ movie shelved indefinitely
IAB1,"21 Savage veröffentlicht neues Album ""I Am> I Was"" | Billboard-Nachrichten"
IAB1,"Maná Chats About Their Upcoming Tour & Being Honored as ""Person of the Year"" | Billboard Latin"
IAB1,The Dark Mysticism Of Eva Green
IAB1,Trivia: Pitch Perfect 2
IAB1,Lando’s Going Solo After Solo: A Star War Story (Lando Movie B*tchs) | NW News
IAB1,Excerpt - Poetic Art by Jorge Luis Borges
IAB1,'Marvelous Mrs. Maisel': Zachary Levi on Midge's Season 2 Finale Choice and What It Means for Benjamin
IAB1,Brigitte Nielsen on working with ex Sylvester Stallone on Creed II
IAB1,Netflix warnt vor gefährlichem 'Bird Box'-Stunt-Trend
IAB1,YouTube Explains Why Popular K-Pop Videos Were Removed From Site | Billboard News
IAB1,Colleen Ballinger a.k.a. Miranda Sings Shares Photo of BEAUTIFUL Baby Boy!
IAB1,Deadpool 2's Director Cut Promises ALL NEW JOKES! | NW News
IAB1,"Diana Ross, John Legend & More Set to Perform at 'NBC's New Year's Eve 2019' | Billboard News"
IAB1,Spotify's 2018 'Wrapped' Collection: Drake and Ariana Grande Top Most Streamed List | Billboard News
IAB1,Rick and Morty Give Kanye the Gift of Music For His B-Day
IAB1,YouTuber Todrick Hall Puts Cheating EX On Blast
IAB1,"Deborah Ann Woll, Taylor Russell On What Makes 'Escape Room' Terrifying"
IAB1,Bing Liu Talks Being a Character in His Skating Doc 'Minding the Gap' | Documentary Roundtable
IAB1,Sofia Reyes New Single Has More Than Latin Flavor
IAB1,10 Best Moments in ‘Cupcake and Dino: General Services’
IAB1,10 Tragic Stories Behind Famous Memes
IAB1,Emily Blunt And Lin-Manuel Miranda Practice Music And Dance For 'Mary Poppins Returns'
IAB1,'Night Of The Living Dead' Is Alive Again
IAB1,'Mary Poppins Returns' Producer Marc Platt Says He Wouldn't Have Made the Film Without Emily Blunt
IAB1,Trivia: The Wedding Ringer
IAB1,MIley Cyrus & Liam Hemsworth Call Off Wedding Again
IAB1,Two more ‘Mission: Impossible’ movies get release dates
IAB1,Top 3: Horror Villains
IAB1,"X Men Fans Brace For Bad News, and Captain Marvel Brings Back Agent Coulson | NW News"
IAB1,The Cultural Interaction In the Series Sense8
IAB1,10 Old Wives' Tales Proven True By Science
IAB1,Tessa Thompson Reveals News On 'Men in Black International' At Brazil CCXP
IAB1,Joanna Kulig in New 'Cold War' Trailer
IAB1,Bryce Dallas Howard Is Voice Acting For A Dog That Was A Rescue
IAB1,Lady Gaga and Bradley Cooper move Oscars ceremony with ‘Shallow’ performance
IAB1,Emily Blunt Is Asked To Sing By Lin Manuel Miranda In Mary Poppins Clip
IAB1,"Fito Paez Talks About Writing ""Tu Vida Mi Vida"" For His Girlfriend | Billboard Latin"
IAB1,Bianca Del Rio in Dear Bianca 2
IAB1,A Suicide Squad Worth Watching - Suicide Squad: Hell To Pay | NerdWire Review
IAB1,BLACKPINK Set to Perform on 'The Late Show' and 'GMA' | Billboard News
IAB1,The Best Hits of 2018
IAB1,XXXTentacions 'Skins' steht auf Platz 1 der Billboard 200 Chart | Billboard-Nachrichten
IAB1,John C. Reilly Built A Comedy Family For 'Ralph Breaks the Internet'
IAB1,Portugal. The Man - Exclusive Interview
IAB1,Director Adam McKay could take over ‘Guardians of the Galaxy 3’
IAB1,Chloe Grace Moretz In 'Greta' First Trailer
IAB1,Andres Calamaro: A Genius Behind Music
IAB1,"Natalie Portman, Jude Law In 'Vox Lux' New Trailer"
IAB1,David and Victoria Beckham's home targeted by thieves again
IAB1,"2019 Golden Globes: Who in Film Should Win, Who Will Win? | THR News"
IAB1,Director Steve McQueen On How To Direct WomenThe Right Way
IAB1,"50 Cent will, dass Cardi B die Scheiung nochmal überdenkt"
IAB1,Jalapeno Popper Dogs Full Recipe
IAB1,Bianca Del Rio on new show and RuPaul's Drag Race UK
IAB1,These People Have Never Seen 'Die Hard'
IAB1,Katherine Langford Joins Cast Of 'Knives Out'
IAB1,Movie News: First Trailer For New Avengers: Endgame Is Released
IAB1,Das Beste von De La Ghetto
IAB1,Movie Premiere Miss Bala
IAB1,Executives of the Year Share Messages of Hope at WIM 2018 | Billboard
IAB1,10 Most Bizarre Religions
IAB1,Bo Burnham & Elsie Fisher Hope to Meet Lady Gaga & Bradley Cooper at Golden Globes | Golden Globes 2019
IAB1,Director Karyn Kusama Was In Awe Of Nicole Kidman Acting Talent
IAB1,Celebrities Who Survived Near-Death Experiences
IAB1,‘Mission: Impossible’ 7 and 8 to film back to back
IAB1,Halsey Bashes 2018 Victoria's Secret Fashion Show After Performance For Lack Of Inclusivity
IAB1,De La Ghetto Wants You to Take Part of His Movement
IAB1,Tristan Thompson’s Baby Mama Sends Khloe Kardashian A Cryptic Message
IAB1,Top 3: Onscreen couples who hated each other in real life
IAB1,"Hannah Gadsby Addresses ""The Jimmys"" and More ""Good Men"" | Women In Entertainment 2018"
IAB1,Will James Buckley Do Another 'Inbetweeners' Movie
IAB1,Trivia: About Time
IAB1,Will Smith hat um seinen Sohn gekämpft
IAB1,"'Mary Poppins Returns' Composer Marc Shaiman Talks ""The Place Where Lost Things Go"" | Golden Globes 2019"
IAB1,Bring Me the Horizon Explain How They Created 'Wonderful Life' | How It Went Down | Billboard
IAB1,"Mardi Gras: Carnival, Expression and Art"
IAB1,Cameron Seely On Her Morning Routine
IAB1,Green Book und Bohemian Rhapsody räumen bei den Golden Globes 2019 ab
IAB1,Director Steve McQueen On How He Casts Women In New Movies
IAB1,Finish The Hit: Rihanna Lyrics Challenge | Billboard
IAB1,10 Deadliest Animals on Earth
IAB1,Roma’ wins big at the Critics’ Choice Awards
IAB1,Kristin Cavallari has switched roles with her husband
IAB1,Roma’s Alfonso Cuaron continues to win big with DGAs
IAB1,Aquaman 2’ already in early preparations
IAB1,"Blackpink, Hyukoh & Perfume Fans React to Artists Performing at Coachella 2019 | Billboard News"
IAB1,Schauspieler aus 'The Big Bang Theory' verdienen am meisten
IAB1,You Should Know: St. Lucia | Billboard
IAB1,Exclusive Interview: Son Lux
IAB1,Willem Dafoe Explains Art In New Clip
IAB1,Nicole Kidman And Sebastian Stan Share Intimate Kiss In 'Destroyer'
IAB1,A Look At The Music Of 'First Man'
IAB1,Meet Alex Hoyer: The Voice MX Promise
IAB1,Jake Paul Sends ALARMING Tweet To Ex Erika Costell To get Her Attention!
IAB1,"Rami Malek Wins Best Actor for 'Bohemian Rhapsody,' Film Wins Best Picture | Golden Globes 2019"
IAB1,Dakota Johnson Works On A New Dance In 'Suspiria'
IAB1,Brie Larson’s directorial debut comes to Netflix
IAB1,10 Internet Crazes That Went Too Far
IAB1,Marthe Keller Is Really Mean In This Clip From 'The Romanoffs'
IAB1,"Marthe Keller And ""The Egg"""
IAB1,The Royal Family Christmas Photos
IAB1,Kate Hudson ist dankbar für 'bedingungslose Liebe'
IAB1,Mario Bautista Has Many Surprises For Fans
IAB1,Victoria Beckham is still part of Spice Girls
IAB1,"Will Smith, Tom Holland In 'Spies in Disguise' First Trailer"
IAB1,Exclusive Interview - Amber Heard talks getting in the best shape of her life for ‘Aquaman’
IAB1,Matthew McConaughey überrascht Helfer vor Ort in Texas
IAB1,"Zane Lowe spricht über die Vielfalt in der Musikbranche, auf der WIM 2018 | Billboard"
IAB1,"""The Work That You End Up Making and Believing In Comes From the Inside Out"": Nina Jacobson | Producer Roundtable"
IAB1,Celebrity Shortlist: Top 3 Sequels We Never Expected To See
IAB1,"Pokemon Switch, Super Smash Brothers & MORE E3 Nintendo Leaks | NW News"
IAB1,Sofia Richie Will Never Be Friends With Kourtney Kardashian
IAB1,"Bruce Dern, Connie Britton In 'The Mustang' First Trailer"
IAB1,Patricia Arquette on SAG Awards Red Carpet 2019
IAB1,Das Quaderhaus
IAB1,Jenni 'JWoww' Farley's son has autism
IAB1,The 'Wonder Park' Super Bowl Ad
IAB1,Sarah Jessica Parker freut sich auf's Altwerden mit Matthew Broderick
IAB1,Deborah Ann Woll Talks Playing A Character With Serious Trauma
IAB1,Tom Schilling Tries New Kinds Of Art In 'Never Look Away'
IAB1,Aaron Eckhart Talks About Old Ways Of Thinking In A New World
IAB1,10 Internet Mysteries That Have Never Been Solved
IAB1,Katy Perry chose right with Orlando Bloom
IAB1,Ryan Reynolds hints at new direction for ‘Deadpool 3’
IAB1,Sofia Coppola and Bill Murray reunite after 16 years
IAB1,Kourtney Kardashian WON’T Stop Posting Pictures that Upset Sofia Richie!
IAB1,Nick Jonas und Priyanka Chopra feiern zweite Hochzeitsparty
IAB1,Gina Rodriguez Is Given A Dangerous Proposition In 'Miss Bala'
IAB1,Scott Disick PITTING Kourtney Kardashian & Sofia Richie AGAINST Each Other!
IAB1,5 MUST SEE Netflix Original Movies! | Nerdwire Reviews
IAB1,Anna Wintour
IAB1,Top 3: Ultimate romcoms
IAB1,"will.i.am: ""Have you ever seen a rhino eat a burger?"""
IAB1,10 Fictional Character You Didn't Know Were Based On Real People
IAB1,Victoria Beckham wishes 'so much love' on former Spice Girls band mates
IAB1,"Rupert Everett, Colin Firth Show The Life Of Oscar Wilde"
IAB1,Leonardo DiCaprio: Wird es dieses Mal ernst?
IAB1,Is Spider-Man Spin-off “Silver & Black” Canceled? | NW News
IAB1,Mel B claims Victoria Beckham WILL join the Spice Girls at Wembley
IAB1,Tom Hanks’ Mr. Rogers movie gets an official title
IAB1,"Kate Beckinsale ist froh, dass 2018 vorbei ist"
IAB1,All The Victoria Secret 2018 Fashion Show Details Revealed
IAB1,Joan Collins suggests 'little fly' might be the reincarnation of her sister
IAB1,Victoria Beckham's parenting advice
IAB1,Olivia Colman doesn’t want to talk about awards buzz
IAB1,Natalya Neidhart on Why ‘Total Divas’ Name Didn’t Change After WWE Started Calling Women ‘Superstars’
IAB1,Netflix Debuts Black Mirror Episode
IAB1,R. Kelly to Sue Lifetime If Network Airs 'Surviving R. Kelly' Doc: Report | Billboard News
IAB1,'Elf:' The Best Quotes
IAB1,Selena Gomez Gets Candid In Brand New Interview
IAB1,"Anderson .Paak spricht über die Vielfalt der Musik- und das derehen von Misserfolg zum Erfolg, auf der WIM 2018 | Billboard"
IAB1,"Taylor Swift: ""Look What You Made Me Do"" - Video erreicht 1 Milliarde Aufrufe auf YouTube | Billboard-Nachrichten"
IAB1,Piso 21 Dreams Big
IAB1,'Delta' Earns Mumford & Sons Their Third No. 1 Album on Billboard 200 Chart | Billboard News
IAB1,Salsa Cop
IAB1,Eva Ruiz Experiments With &quot;Solo&quot;
IAB1,Fire Runs Through These Singers
IAB1,Mel B slams Victoria Beckham?
IAB1,Will Smith Is Getting Heat Over Live Action 'Aladdin' Role
IAB1,Michael Ray: Exclusive Interview
IAB1,Nickelodeon’s Double Dare Gets NEW HOST With Liza Koshy | NW News
IAB1,Ryan The Selfie Kid on Life Since the Superbowl & Upcoming Single | Billboard
IAB1,Louis Ashbourne Serkis Learns About A Sword In 'The Kid Who Would Be King'
IAB1,"Alec Baldwin Punches Man Over Parking Spot, Gets Arrested in NY | THR News"
IAB1,Love Advice with Aaron Carter
IAB1,Richard E. Grant: Timothee Chalamet is a gift to the world
IAB1,Playing Cards with The Aces
IAB1,Victoria Beckham to pick up Fashion Icon Award
IAB1,Aidan Gillen Explains How Freddie Mercury Affected His Childhood
IAB1,Lucia Pittalis - Meisterin der Verwandlung
IAB1,Laura Pausini Is Back With &quot;Hazte Sentir&quot;
IAB1,"Charlie Puth Opens Up With ""Voicenotes"""
IAB1,Five Songs from Lady Gaga & Bradley Cooper's 'A Star is Born' Land on Hot 100 | Billboard News
IAB1,Elton John: Entschuldigung für Konzert-Absage
IAB1,Mumford and Sons went folk out of necessity
IAB1,Meet Bazzi and Fall In Love With &quot;Cosmic&quot;
IAB1,"Diese Woche in der Geschichte der Charts: Eminem und Rihannas ""The Monster"" haben 2013 die Top 100 erreicht | Billboard-Nachrichten"
IAB1,John Boyega Is Executive Producer For 'God Is Good'
IAB1,"Man Tries Beyoncé's Vegan Diet, Loses 15 Pounds"
IAB1,Jimmy Butler Chartered A Plane For Tyus Jones So He Could See His Brother Tre’s Duke Debut
IAB1,Benny Blanco & Calvin Harris Release 'I Found You' | Billboard News
IAB1,Oscars to feature all 5 song nominees if artists want to perform them
IAB1,Idris Elba ready to bring ‘Luther’ to the big screen
IAB1,Every Danny Phantom Ghost Ranked
IAB1,The Absolute Best Louise Belcher Moments! (Bob's Burgers)
IAB1,Brad Pitt and Angelina Jolie ask for more time with private judge
IAB1,Gwen Stefani to Join CNN New Year's Eve Broadcast | Billboard News
IAB1,Dakota Johnsons Sprecher dementiert Schwangerschaft
IAB1,Louis Walsh: I'm in a really good place
IAB1,Streetart zum Tag der Deutschen Einheit
IAB1,'Born This Way' Star Sean McElwee Is Smashing Barriers for People with Down Syndrome
IAB1,"Dennis Quaid, Josh Gad In 'A Dog's Journey' New Trailer"
IAB1,Channing Tatum fliegt für Jessis J quer durchs Land
IAB1,Mariah Careys Weihnachts-Evergreen bricht Streaming-Rekord
IAB1,All members of Little Mix thought about quitting the band
IAB1,10 Most Corrupt Countries
IAB1,Janelle Monae In New Gloria Steinem Movie
IAB1,Female Bands Have Been Rocking For Years
IAB1,Ozuna Issues Statement Saying He's a Victim of Extortion Scam | Billboard News
IAB1,Brazil CCXP Gets Surprise Guests For 'Spider-Man: Far From Home'
IAB1,25 Facts About Jigsaw
IAB1,The Secret Behind Piso 21's Success
IAB1,"David Letterman, Martin Short In 'Bathtubs Over Broadway' New Trailer"
IAB1,Sofia Richie Thinks Scott & Kourtney’s Relationship Is STRANGE!
IAB1,'Big Mouth' Refresher: Everything You Need to Know Before Season 2
IAB1,'Celebrity Big Brother' House Tour
IAB1,Dog Competition
IAB1,Chiwetel Ejiofor on Why He Focused on 'The Boy Who Harnessed The Wind' | Sundance 2019
IAB1,Tracy Morgan Is Obsessed With Health Smoothies In 'What Men Want'
IAB1,Celebrity Shortlist: Top 3 Stars Who Never Studied Acting
IAB1,10 Notorious Criminals Who Were Never Caught
IAB1,"Hailee Steinfeld, John Cena  Bring The Origins Of Transformers Back"
IAB1,New Singles To Party This Weekend
IAB1,"Halsey befasst sich mit der Performence zu ""The Voice"" Finale | Billboard-Nachrichten"
IAB1,Taraji P. Henson Defends Her Friend In 'What Men Want' Scene
IAB1,Vanesa Martín's Voice is as Epic as Her
IAB1,Drake Is Taking Heat Over Concert Video And His Interest In Young Girls
IAB1,"Elle Fanning, Rebecca Hall In 'Teen Spirit' First Trailer"
IAB1,Charlize Therons Reaktion auf Weinstein Skandal
IAB1,You Should Know: Alec Benjamin
IAB1,Scott Disick Wants Sofia Richie To Get Butt Implants
IAB1,Lady Gaga & Bradley Cooper Claim No. 1 Spot on Dance Club Songs Chart | Billboard News
IAB1,'Futurama' vs. 'The Simpsons' | Nerdfight
IAB1,Top 3: Fast and Furious Stunts
IAB1,Glenn Close: It was hard playing Cruella De Vil
IAB1,Chris Hemsworth fears boredom
IAB1,David Bowie\'s Top Billboard Hits
IAB1,Must Have Guide To 2018 Black Friday Sale | Trending Topics
IAB1,Why Vegeta Could Not Transform Into Super Saiyan 3?
IAB1,Paris Jackson sucht psychotherapeutische Hilfe auf
IAB1,There Will Be A New Today Show Host: Kathie Lee Gifford Is Leaving
IAB1,Young And The Restless Star Suddenly Found Dead At 52
IAB1,Selena Gomez: Klinik nach Nervenzusammenbruch!
IAB1,Crazy Rich Asians Bombs In China
IAB1,10 Best 'Disenchantment' Moments
IAB1,Piso 21 Premieres Ubuntu
IAB1,Jennifer Lopez Gets Sad On Her Birthday In Movie Scene
IAB1,Elizabeth Banks In First Trailer For 'BrightBurn'
IAB1,Bradley Cooper had to 'Zen out' during Lady Gaga duet
IAB1,Holiday Gift Ideas for Cartoon Lovers (2018)
IAB1,10 Most Incredible Doomsday Bunkers
IAB1,Pikachu Isn’t A MOUSE?! Pokemon Fandom SHOCKED By Creators Revelations! | NW News
IAB1,Kourtney Kardashian Sends Sofia Richie A Shady Message On Instagram
IAB1,They Are The VMA's Royalty
IAB1,Adam Driver’s CIA thriller sold to Amazon
IAB1,E3 Everything You MISSED! | NW News
IAB1,Kylie Jenner führt Forbes-Liste der Reichen Stars unter 30
IAB1,Stranger Things Season 3 Releases July 4th
IAB1,Scott Disick & Sofia Richie BREAKUP! According To Scott He Is SINGLE!
IAB1,Alexandra Shipp to star in Endless
IAB1,Sofia Richie Feeling Like A 3rd Wheel With Scott Disick & Kourtney Kardashian
IAB1,Taraji P. Henson spricht bei der Enthüllung ihres Sterns auf dem Walk of Fame über Gleichberechtigung
IAB1,Ximena Sariñana Breaks Hiatus With &quot;¿Qué Tiene?&quot;
IAB1,Anne Hathaway offered Sesame Street role
IAB1,Jason Momoa Only Did A Few Stunts In 'Aquaman'
IAB1,THE FAVOURITE: Emma Stone has brutally honest friends
IAB1,Mumford And Sons Get Top Spot On Billboard 200
IAB1, James Wan reveals plot details for ‘The Conjuring 3’
IAB1,Mark Wahlberg And Rose Byrne Are Shocked By Kids Christmas Gifts
IAB1,Exclusive Interview - John Cena says he’s still learning how to be an actor
IAB1,Kendall Jenner schürt Gerüchte: Wird es ernst mit Ben Simmons?
IAB1,Hier sind die besten K-Pop-Songs von 2018 | Billboard-Nachrichten
IAB1,The Grammys 2019 Album Of The Year Goes To Kacey Musgraves
IAB1,It Was Hailey Baldwin's Idea To Have Shotgun Wedding With Justin Bieber
IAB1,The First Trailer For 'Cold War'
IAB1,Taylor Kinney wünscht Lady Gaga das Beste
IAB1,Exclusive Interview: Peter Jackson wasn’t interested in the effects for ‘Mortal Engines’
IAB1,Das Danish String Quartet
IAB1,The Best Of Netflix Coming May 2018 | NW News
IAB1,Niall Horan is Benjamin Button of pop
IAB1,Live-Streaming boomt in China
IAB1,Kourtney Kardashian 'bonding' with Scott Disick and Sofia Richie
IAB1,"Milan Kundera and the Etymology of the Word \""Nostalgia\"""
IAB1,'Bohemian Rhapsody' and Rami Malek Win Big at 2019 Golden Globes | THR News
IAB1,'Creed II' and 'Men in Black' Star Tessa Thompson on Women of Color in Hollywood
IAB1,10 Viral Videos Debunked
IAB1,Ariana Grande: Bald ein neues Album
IAB1,10 Secrets of Organised Crime
IAB1,Jennifer Lawrence ist verlobt!
IAB1,Touring Essentials: Dumbfoundead and DJ Zo
IAB1,Der frühe Ruhm trieb Jada Pinkett Smith fast in den Selbstmord
IAB1,Jake Gyllenhaal Will Star In Remake Of The Guilty
IAB1,Victoria's Secret Lingerie CEO Jan Singer Resigns After Brand's Problematic Statements | THR News
IAB1,"Lenny Kravitz freut sich, dass Zoe mit Nicole Kidman dreht"
IAB1,Hugh Jackman feierte seinen 50. bis 2 Uhr morgens
IAB1,Musikalischer Zweikampf: Piano Battle
IAB1,Amber Heard hat täglich fünf Stunden für Aquaman trainiert
IAB1,SAG Awards 2019: Nominees Revealed | THR News
IAB1,Is 'Disenchantment' as Good as 'The Simpsons' or 'Futurama'? | Nerdflix and Chill
IAB1,"Jennifer Garner, Mila Kunis In 'Wonder Park' New Trailer"
IAB1,Monster Hunter Getting Live Action Movie Starring Milla Jovovich | NW News
IAB1,"MTV's SnowGlobe Music Festival: G-Eazy, Tyga, Diplo and More to Headline | Billboard News"
IAB1,Jennifer Lopez Releases 'Limitless' Music Video | Billboard News
IAB1,Aquaman Has Already Made More Than Quarter Billion Overseas
IAB1,"Infinity War Directors TEASE Hawkeye and Peter Dinklage, Pokemon Park Coming to Orlando! | NW News"
IAB1,Astro Releases New Music Video for 'All Night' | Billboard News
IAB1,Nickelodeon’s Invader Zim 7 Best Moments! | Toon Town
IAB1,10 Obscure Companies That Could Dominate The World In 10 Years
IAB1,Sarah’s Music - Solo für Sarah!
IAB1,Kourtney Kardashian Blocks Sofia Richie From Joining KUWTK: Kris Jenner Fighting Back
IAB1,Bryce Dallas Howard Will Star In 'Fairy Tale Ending'
IAB1,Presidential Trump And First Lady Melania Trump Host The Congressional Ball
IAB1,Katy Perry legt sich ein weiteres Haus in Los Angeles zu
IAB1,Sandra Oh and Andy Samberg Behind the Scenes on Cover Shoot | Watch
IAB1,Movie Theaters Are Back And Bigger Than Ever
IAB1,Laura Pausini Is Back With \&quot;Hazte Sentir\&quot;
IAB1,Hugh Grant und Nicole Kidman spielen Ehepaar in neuem HBO-Drama
IAB1,Danielle Bregoli Bashes Facebook As She Teams Up With Snapchat For New Show
IAB1,How is American Horror Story Connected?
IAB1,Kourtney Kardashian Has Dinner With Sofia Richie & Scott Disick
IAB1,Rose Byrne Makes Fun Of Adopting Mom In New Clip
