Category,Title
IAB1,Thom Yorke 'jealous' of bandmate's soundtrack work
IAB1,Khloe Kardashian confirms Tristan Thompson and Jordyn Woods rumours?
IAB1,Niki and Gabi || Draw My Life
IAB1,Noah Centineo Shares New Picture Of “Girlfriend”
IAB1,Ist Chrissy Metz mit Hal Rosenfeld zusammen?
IAB1,Gorillaz's The Now Now Is Here!!
IAB1,Cardi B deactivates Instagram after Grammy win backlash
IAB1,"GOT7 Talk New Album 'Present: You,'  Their Single 'Lullaby' & More | Billboard"
IAB1,Celebrity Shortlist: Top 3 Stars Who Shaved Their Heads
IAB1,Melissa McCarthy Plays A Character That Isn't Funny
IAB1,Top 10 Scariest The Haunting of Hill House Moments
IAB1,Cardi B BLASTS President Trump & The Republican Party!
IAB1,Jonah Hill's big screen best friend
IAB1,Travis Scott teilt Termine für Second Leg of Astroworld: Wish you Were Here Tour | Billboard-Nachrichten
IAB1,Perrie Edwards thinks Jesy Nelson's new flame 'seems really nice'
IAB1,IN MEMORIAM 2018
IAB1,Celebrity Of The Week: Tom Hiddleston
IAB1,David Beckham Rocks Eyeshadow For New Magazine Cover
IAB1,Brendon Urie Wants His Own Musical
IAB1,Mariah Carey: Rechtsstreit beigelegt
IAB1,"Alfonso Cuaron's 'Roma' Walking Tour of Mexico City, with Stars Yalitza Aparicio and Marina de Tavira"
IAB1,Christy Carlson Romano Recalls Working With Shia LaBeouf on 'Even Stevens' | In Studio
IAB1,Jennifer Lopez Releases 'Limitless' Music Video | Billboard News
IAB1,Melissa McCarthy wormed her way into new movie
IAB1,Sir Michael Caine: Success Has Strengthened My Faith In God
IAB1,Drake tips 100 dollars in McDonald’s
IAB1,Justin Bieber And Hailey Baldwin Delay Wedding Again
IAB1,President Obama Goes For A Special Dinner On Presidents Day
IAB1,Rob Kardashian BLASTED By Summer Bunni For LEAKING Text’s & Using Her For Clout!
IAB1,Steve Aoki Announces New Collaboration With BTS | Billboard News
IAB1,Kate Beckinsale and Pete Davidson planning romantic holiday?
IAB1,Beyonce's stylist praises her evolution
IAB1,Conspiracy In Film | Blade Runner 2049
IAB1,John Barrowman back in 'I'm a Celebrity' camp
IAB1,Bebe Rexha: An Uncrowned Queen
IAB1,Nick Jonas is his authentic self with Priyanka Chopra
IAB1,Ganz in Weiß: das Dîner en Blanc in Paris
IAB1,Hulk Hogan pays tribute to Gene Okerlund on emotional Raw return
IAB1,James McVey planning to propose to long-time girlfriend
IAB1,Ross Lynch Talks First Audition For 'Chilling Adventures of Sabrina' With Kiernan Shipka | In Studio
IAB1,Hayley Kiyoko Talks Surprise Taylor Swift Performance & Lauren Jauregui Friendship at WIM 2018 | Billboard
IAB1,"This Week in Chart History: Katy Perry Topped Pop Songs Chart With ""Hot N Cold"" | Billboard News"
IAB1,Ariana Grande arbeitet ihre Beziehungen auf
IAB1,Shawn Mendes has scars after scooter fall
IAB1,America Ferrera's son is more important than her shape
IAB1,Lady Gaga loves playing jazz in her Las Vegas residency
IAB1,Gwen Stefani: Pharrell Williams gave me confidence
IAB1,Jake Paul Cheated On GF Erika Costell! Couple Officially Over
IAB1,Jessica Biel's sweet tribute to husband Justin Timberlake
IAB1,Taylor Swift Chose Her Boyfriend Over The Grammys
IAB1,Twitter's Year-End Data: BTS Is 2018's Most Tweeted-About Celebrity | Billboard News
IAB1,Mariah Carey no longer speaks to All I Want For Christmas co-writer
IAB1,Snoop Knows How To Say Thanks To Himself
IAB1,Nicole Kidman impressed daughters by swallowing a fish
IAB1,Ariana Grande’s Friends Celebrate Breakup With Pete Davidson
IAB1,What You Probably Don't Know About 21 Savage
IAB1,Rose Byrne On Why Adoption Can Be A Funny Wholesome Comedy
IAB1,Kendall Jenner has a 'special connection' with niece Stormi
IAB1,Amy Schumer recreates Baywatch scene in pregnancy quip
IAB1,Justin and Hailey Bieber delay wedding ceremony for third time
IAB1,Bill Murray Crashes 'Green Book' Winners' Backstage Interview | Golden Globes 2019
IAB1,Will Smith turned down The Matrix
IAB1,Ariana Releases New Track 'Imagine'
IAB1,BLACKPINK Set to Perform on 'The Late Show' and 'GMA' | Billboard News
IAB1,Ce jeune homme s'est cru dans un film
IAB1,'Green Book' Wins Best Motion Picture Musical or Comedy | Golden Globes 2019
IAB1,"Patty Jenkins Talks True Crime, 'I Am the Night' | Sundance 2019"
IAB1,Nick Cannon Blasts Kylie Jenner! Would Rather His Daughter Be More like Danielle Bregoli!
IAB1,"Rihanna’s Music Used at Trump Rally: “Not For Much Longer,” She Says | Billboard News"
IAB1,Evan Rachel Wood (Westworld) publie un émouvant essai sur sa tentative de suicide
IAB1,"Lady Gaga Ties Personal Best Atop Billboard's Digital Song Sales Chart With ""Shallow"" | Billboard News"
IAB1,Scott Disick’s Kardashian Kristmas Krisis! Will Sofia Richie Be Invited To Kar-Jenner Christmas Party
IAB1,"Eminem Performs ""Venom"" Atop Empire State Building, Announces New Tour Dates | Billboard News"
IAB1,Years And Years: Best and worst things of touring together
IAB1,David Beckham stole wife's beauty products
IAB1,Lady Gaga snuck into local cinema to see A Star Is Born
IAB1,Kanye Sang Backstreet Boys in Karaoke Session With Mark Zuckerburg | Billboard News
IAB1,Kendra Wilkinson settles divorce
IAB1,Miley Cyrus opens up about her friendship with Ariana Grande
IAB1,Justin Bieber Broken After Selena Gomez Hospitalization
IAB1,Ariana Grande confirms new single
IAB1,Top Artists Get Into Christmas Spirit For 'Spotify Singles: Christmas Collection' | Billboard News
IAB1,Julia Roberts Finally Addresses That Hairy Armpit Moment
IAB1,Olivia Colman finds fame 'intimidating'
IAB1,I'm A Celebrity scores highest launch audience ever
IAB1,Jennifer Aniston doing 'incredibly well'
IAB1,KISS farewell tour to marry technology with emotion
IAB1,Katy Perry is a different person now
IAB1,Emily Blunt Talks Working with Husband John Krasinski Backstage at SAG Awards 2019
IAB1,Jessie Paege Involved In TERRIFYING Uber Accident!
IAB1,Mariah Carey Delivers Melodic Performance of 'With You' on 'GMA' | Billboard News
IAB1,Heidi Klum sets wedding date
IAB1,Henry Cavill 'absolutely not' done playing Superman
IAB1,Gerard Way teases new 'heavy' witch-themed song
IAB1,James McAvoy Is Afraid Of Disapproval At 'Glass' Premiere
IAB1,'Walking Dead' Mid-Season Finale: The Shocking Death of Jesus & More | THR News
IAB1,Margot Robbie: Neue Partner für Barbie-Film
IAB1,Saoirse Ronan and Margot Robbie at Mary Queen of Scots Premiere
IAB1,Kelly Rowland for Fabletics
IAB1,Comedian Katt Williams Arrested in Oregon Assault
IAB1,Julia Roberts will not return for Homecoming season 2
IAB1,Workaholic Kevin Hart
IAB1,Shawn Mendes | Draw My Life
IAB1, Birthday: Jeff Bridges
IAB1,Kylie Jenner & Travis Scott’s INTENSE Prenup REVEALED! Kid Buu Previously Arrested For Child Abuse!
IAB1,GLASS: M. Night Shyamalan on making cameos & James McAvoy
IAB1,Check Out The Big Oscar Winners
IAB1,Khloe Kardashian doesn't see Tristan Thompson that much
IAB1,Netflix’s Umbrella Academy: Everything you NEED to Know About The Comic?
IAB1,"Cardi B Takes a Break From Instagram, Deactivates Account | Billboard News"
IAB1,Michael Douglas receives Hollywood Walk of Fame star
IAB1,Fans FREAKING OUT Thinking Liil Xan Is ENGAGED!
IAB1,Demi Lovato’s Sister Speaks out About Her Rehab Progress
IAB1,Through The Years: Karolina Kurková
IAB1,Baby Stormi Makes Sweetest Cameo In Kylie Jenner’s New Makeup Tutorial
IAB1,Cardi B DELETES IG After Grammy Backlash! Nicki Minaj Shaded By BET For 0 Grammy Wins! | DR
IAB1,Jason Derulo || Draw My Life
IAB1,"Bad Bunny and Jennifer Lopez Release Trailer for Upcoming Collaboration ""Te Guste"" | Billboard News"
IAB1,"EXCLUSIVE: Steve Coogan, John C. Reilly, Shirley Henderson and more"
IAB1,Leonardo DiCaprio & Martin Scorsese Reunite for the Feature Adaptation 'Killers of the Flower Moon' | THR News
IAB1,Eddie Redmayne Looking For Clues From JK Rowling Social Media
IAB1,2018 Latin Grammys: Everything You Should Know About the Show | Billboard News
IAB1,Mayweather vs Pacquiao | Draw My Life
IAB1,Kylie Jenner Prepares For Second Baby
IAB1,Tyra Banks' secret love
IAB1,Amy Schumer: Being a woman sucks
IAB1,10 Humans With Superpowers
IAB1,Ozuna Music Video Evolution | Billboard
IAB1,Hailey Baldwin Officialy Changes Her IG Name To Bieber
IAB1,Axl Rose: Queen are the greatest band of all time
IAB1,"'Them That Follow' Cast Talk Working With Britt Poulton, Dan Madison Savage & the ""Olivia Colman Train"" | Sundance"
IAB1,"Gloria Trevi Teases Her Performance for New Song ""Ellas Soy Yo"" at 2018 Latin AMAs | Billboard"
IAB1,Lachlan Murdoch Reveals He Doesn't Plan to Hire Megyn Kelly for New Fox | THR News
IAB1,Awkwafina hoping to join ‘Jumanji’ sequel
IAB1,Six things you didn’t know about the Golden Globes
IAB1,Miley Cyrus reunites with Bangerz producer on new album
IAB1,Gwen Stefani and Blake Shelton expected to announce engagement
IAB1,Syfy Picks Up 'Chucky' TV Series From Original Creator | THR News
IAB1,'This Is Us' Celebrates Ensemble Win Backstage at SAG Awards 2019
IAB1,Love Life Lowdown: Jim Carrey
IAB1,Steven Spielberg ne veut pas payer pour avoir utilisé le slogan «Sauvez les dinosaures»!
IAB1,Sarah Paulson: Shooting Glass was surreal
IAB1,Kevin Hart set for Monopoly movie
IAB1,Katie Price wanted to adopt before
IAB1,BUMBLEBEE: Hailee Steinfeld & John Cena re-imagined as cars
IAB1,Kanye West pulls out of condo purchase
IAB1,"Anuel AA & Karol G Talk Touring Together, Their First Kiss On Stage & More | Billboard"
IAB1,True: Hilary Duff Got A Baby Alpaca
IAB1,Cate Blanchett On Growing Up Through 'How to Train Your Dragon: The Hidden World'
IAB1,The Game says he made Kylie Jenner 'frosted flakes'
IAB1,"LOONA Returns With ""Butterfly"" and Powerful New Music Video | Billboard News"
IAB1,"""Transparent"" Creator Jill Soloway on Their New Book and Consent"
IAB1,Here Are the Best Films of 2018 | THR News
IAB1,"Little Mix Are Back With Heartbreak Antidote ""Told You So"" | Billboard News"
IAB1,John Boyega won't get wrapped up in his own success
IAB1,Introducing Dame Emma Thompson!
IAB1,Post Malone & Swae Lee's 'Sunflower (Spider-Man: Into the Spider-Verse)' Rises to No.1 on Hot 100 | Billboard News
IAB1,"Voilà un chef qui sait ""allumer le feu"""
IAB1,"Ike Barinholtz On Writing 'The Oath:' ""I Really Have to Give Credit to the 2016 Election"" | In Studio"
IAB1,Mon Laferte Teases Her New Conceptual Album | Billboard Latin
IAB1,Stan Lee Created One Last Superhero
IAB1,Sam Bird and Georgia Steel split
IAB1,Zendaya inspired by grandpa
IAB1,"Jennie of BLACKPINK Chats About Her Song ""Solo"" | Billboard"
IAB1,"A First Look at Henry Cavill in 'The Witcher,' Netflix Bulks Up Cast | THR News"
IAB1,Singer Kelsy Karter Gets Harry Styles' Face Tattooed on Her Face | Billboard News
IAB1,Kanye West mental health talk would have been 'distracting'
IAB1,Zoe Kravitz felt an 'idiot' on green screen
IAB1,Jimmie Allen Talks New Album 'Mercury Lane' at 2018 CMA Awards | Billboard
IAB1,Kiss Hitting the Road for Their Final Tour | Billboard News
IAB1,Top 5 Celebrities Who Went Overboard With Their Pets
IAB1,'Made In Chelsea' Star Will Have A Family Christmas This Year
IAB1,Blue Ivy Carter is queen bee
IAB1,Justin Bieber Gets A Makeover: Cuts His Hair
IAB1,Camila Cabello has never felt more alive
IAB1,"Why Rey Should Have Died in Last Jedi, Beast Boy in Live Action Teen Titans Isn’t Green? | NW News"
IAB1,Finish The Hit: Panic! at the Disco Lyrics Challenge | Billboard
IAB1,"‘Bohemian Rhapsody’ Star Rami Malek on the Most Fun Scene to Shoot – And No, It Wasn’t Live Aid"
IAB1,Rihanna verklagt ihren Vater!
IAB1,Sam Smith used to 'hide away' Oscar
IAB1,"Prince Royce Talks Premio Lo Nuestro Performance, Daddy Yankee & More | Billboard"
IAB1,Kardashian sisters win $10M in legal battle against cosmetic company
IAB1,Ariana Grande: Holzkohlegrill-Tattoo
IAB1,Billboard Live Music Summit 2018 Highlights
IAB1,Ariana Grande Talks Being Hit by a Hockey Puck Twice At Age 5 | Billboard News
IAB1,Dwayne Johnson Is The 'Oprah Of Wrestling'
IAB1,Daniel Kaluuya and Lakeith Stanfield for Black Panthers biopic
IAB1,Top 10 Signs You're at a British University
IAB1,Kim Kardashian West donates $25k to photographer's medical bills
IAB1,Tiffany Haddish to star in 21 Jump Street reboot?
IAB1,Eddie Redmayne trying to keep his kids alive
IAB1,Chloe X Halle Talk Touring With Beyonce & JAY-Z & More at 2018 AMAs | Billboard
IAB1,Jihae Saves Robert Sheehan At The Last Minute In 'Mortal Engines'
IAB1,Jason Momoa May Have Been Typecasts In Game Of Thrones
IAB1,Taron Egerton thinks he's a better archer than Jennifer Lawrence
IAB1,America Ferrera on Making Your Voice and Vote Matter
IAB1,In The Style Of: Margot Robbie
IAB1,Bradley Cooper wanted Jack White for A Star is Born
IAB1,R. Kelly's Daughter Calls Him A Monster
IAB1,Robert Duvall Initially Said No To 'Widows'
IAB1,Priyanka Chopra and Nick Jonas get marriage license
IAB1,Michael B. Jordan Urges Black Voter Turnout by Going Door-to-Door in Atlanta | THR News
IAB1,Celebrity Shortlist : Top 3 Stars Who Don’t Mind Getting Older
IAB1,Ariana Grande Kicked Pete Davidson Out
IAB1,Hailee Steinfeld Debuts New Track 'Back To Life' From 'Bumblebee' Soundtrack | Billboard News
IAB1,'A Star Is Born': The Real Reason Why the Soundtrack Won't Be in the Running at 2019 Grammys | THR News
IAB1,Bow Girl
IAB1,Simon Pegg Thinks Star Wars Needs George Lucas Back
IAB1,"Storm Reid, David Oyelowo Star in 'Relive' | Sundance 2019"
IAB1,"Gastronomia: Ferran Adrià annuncia la riapertura del ristorante ""El Bulli"""
IAB1,Lindsay Lohan Promoting Her Beach Club Reality Show
IAB1,James Arthur vows to keep growing
IAB1,Cardi B Wants To QUIT Music! The Weeknd DISSES Drake In New Song! | DR
IAB1,Charlize Theron's kids tell her to dress like a mermaid on the red carpet
IAB1,Lady Gaga's Judy Garland tribute wasn't intentional
IAB1,Kylie Jenner Sparks PREGNANCY Rumors Again With A Tweet!
IAB1,Three Days of the Condor | Conspiracy In Film
IAB1,Un artiste transforme les panneaux signalétiques en art
IAB1,Kylie Jenner heizt Verlobungsgerüchte an
IAB1,Kylie and Tyga || Draw My Love
IAB1,Will Smith et Jada Pinkett-Smith ne célèbrent plus leur anniversaire de mariage!
IAB1,Kourtney Kardashian CLAIMS Recent Dating Rumors With David Duron Was A Paparazzi PRANK!
IAB1,Kar-Jenners SPEAK OUT about Tristan Thompson and Jordyn Woods Cheating Scandal | DR
IAB1,Exclusive Interview - Tilda Swinton and her daughter Honor dish on their new movie
IAB1,"TOP 10 schlechtester Filme, die eine Neuverfilmung verdienen"
IAB1,Awkwafina Takes on Dramatic Role in Family Dramedy 'The Farewell' | Sundance 2019
IAB1,Lupita Nyong'o Needed Meditation After Black Panther Movie
IAB1,PRETTYMUCH on Tour Highlights & Cool Fan Moments | Billboard
IAB1,Dua Lipa Doesn't Like How Women Are Treated In The Music Industry
IAB1,Noah Centineo Lands First Star Vehicle in 'Valet' | THR News
IAB1,Pete Davidson Sheds Light on Mental Health Struggles on Instagram | THR News
IAB1,Kate Hudson gives birth
IAB1,Susan Kelechi Watson Talks 'This is Us' Future | Women in Entertainment 2018
IAB1,Sam Smith's eye quip
IAB1,Fans REACTS As Ariana Grande TEASES ANOTHER Single ‘Imagine’!
IAB1,Pink to bring Beautiful Trauma tour to the UK
IAB1,RuPaul || Draw My Life
IAB1,Mariah Carey Reveals New Album 'Caution' & Release Date | Billboard News
IAB1,Matthew McConaughey Raves About Working With Celebrity Crush Diane Lane
IAB1,Mel B still in pain from fall
IAB1,Kerry Katona to have boob job?
IAB1,Top 10 Funniest Big Mouth Moments (Season 1)
IAB1,"BTS' New Movie 'Burn the Stage' Tops 940,000 Sales Worldwide | Billboard News"
IAB1,Everything We Want to See From Mariah Carey's 'Caution' | Billboard News
IAB1,Dinah Jane Releases Music Video for Her Debut Single 'Bottled Up' | Billboard News
IAB1,First Look At Cardi B’s HILARIOUS Pepsi ‘OKURRR’ Superbowl Commercial With Steve Carrel!
IAB1,"Ariana Grande Stumbles During Performance Of ‘Thank You, Next’"
IAB1,Eyal Booker says no movement with Love Island's Kendall Rae Knight
IAB1,Liam Neeson's Box Office Has Taken A Dive After Controversy
IAB1,Wes Nelson misses Dancing on Ice rehearsals to go on holiday
IAB1,Kylie Jenner uses three hotel rooms on tour
IAB1,Jennifer Lawrence: Märchen-Romanze
IAB1,Cheryl Would Reunite With Group For A Bunch Of Cash
IAB1,EXO's 'Don't Mess Up My Tempo' Earns First Top 40 Entry on Billboard 200 | Billboard News
IAB1,Jennifer Lopez's journey of self-discovery
IAB1,Top 10 des FILMS les PLUS ATTENDUS de 2018 !
IAB1,Michael Buble had fun making record
IAB1,Alex Rodriguez war von Jennifer Lopez' 'Second Act' zutiefst berührt
IAB1,Gillian Anderson admits she 'could be a therapist'
IAB1,Fünf unglaubliche Häuser in Europa
IAB1,Cardi B hits back at accusations of publicity seeking
IAB1,Joe Sugg says people are more easily offended than ever
IAB1,Cardi B to Release New Album This Year | Billboard News
IAB1,James McAvoy Says Being An Actor Prevents An Ego
IAB1,Sarah Paulson Won't Watch Bird Box
IAB1,Summer Looks That'll Make A Splash
IAB1,Olivia Colman: I'm not thick-skinned
IAB1,Avril Lavigne's new man
IAB1,Dwayne Johnson Claims He Rejected Oscars Job
IAB1,The Internet’s THIRST For Venom Is Real! | NW News
IAB1,XXX Tentacion On New Spider-Man Soundtrack
IAB1,Brooklyn Beckham has own wing of family's mansion
IAB1,Here's How the Oscar Nominees Reacted to Their Nods | THR News
IAB1,Leslie Mann praises her co-star Steve Carell
IAB1,Cardi B: Wieder auf Instagram
IAB1,"Ariana Grande Wrote THREE Versions Of ‘Thank U, Next’!"
IAB1,David Walliams May Quit Britains Got Talent
IAB1,Candace Cameron Bure Injured In Go-Kart Accident
IAB1,Colin Firth Says He's Older Than The original 'Mary Poppins' Movie
IAB1,Kelly Clarkson wants 'tone deaf' kids
IAB1,Holly Willoughby won't quit This Morning
IAB1,Mike Posner stays silent to preserve voice
IAB1,Sair Khan leaves I'm A Celebrity... Get Me Out of Here!
IAB1,Jennifer Lawrence Loves Normal Life With Fiancé
IAB1,Gigi Hadid and Zayn Malik reportedly taking a break
IAB1,Ariana Grande's 2018
IAB1,Deputy Juju
IAB1,Will Smith tried to convince daughter to continue pop career
IAB1,Michelle Obama
IAB1,Ariana Grande Getting REAL CLOSE With Ex Ricky Alvarez As They Prepare To Go On Tour TOGETHER!
IAB1,Hailee Steinfeld Debuts New Track 'Back To Life' From 'Bumblebee' Soundtrack | Billboard News
IAB1,Kylie Jenner SLAMS Blac Chyna In EMAILS! Selena Gomez Makes SOcial Media COMEBACK! | MOTW
IAB1,3 International Ladies Killing It
IAB1,"Dinah Jane Talks New Music, Love of Teyana Taylor & SZA  | Billboard Power 100"
IAB1,Chrissy Teigen reveals her least favorite body part
IAB1,Trend: Flying With The Stars
IAB1,Rob Kardashian asks to reduce child support
IAB1,Cameron Monaghan Opens Up About Why He Left and Returned to 'Shameless' | THR News
IAB1,American Crime Story - The Assassination of Gianni Versace || Behind the Screen
IAB1,Leonardo DiCaprio's birthday bash attracts A-list stars
IAB1,"Hollywood Trailblazer For Women, Penny Marshall Dead At 75"
IAB1,"Ike Barinholtz On How 'The Oath' ""Shines a Light"" On Current Political Climate | In Studio"
IAB1,Willem Dafoe compares DC and Marvel
IAB1,Kelvin Harrison Jr on How Privilege Plays a Huge Part in ‘Luce’
IAB1,"TV Art Critic Sister Wendy Beckett, Dead At 88"
IAB1,Michael Buble's festive dance party
IAB1,Mel B wants to prove herself
IAB1,Gigi Hadid and Zayn Malik split?
IAB1,"'SNL' Rewind: Halsey Hosts and Performs, 'Empire'-esque 'Them Trumps' Sketch Returns | THR News"
IAB1,Lindsay Lohan will Miley Cyrus
IAB1,Ellie Goulding: I was addicted to the gym
IAB1,Will Simon Cowell enter a talent show with son and dogs?
IAB1,Le groupe de K-pop BTS va sortir un livre!
IAB1,Kim Kardashian Posts UNEDITED Picture Of Khloe And Fans Spot MAJOR Difference!
IAB1,Ariana Grande BLASTS Trolls Accusing Her Of Cultural Appropriation For Japanese ‘7 Rings’ Tattoo!
IAB1,Kim Kardashian West is feeling 'calm' about fourth child
IAB1,Birthday: Diane Lane
IAB1,VH1 Announces Holiday-Themed Special 'RuPaul's Drag Race Holi-Slay Spectacular' | Billboard News
IAB1,Richard E. Grant shocked by reach of personal Barbra Streisand tweet
IAB1,La suite du téléfilm sur le prince Harry et Meghan est en préparation!
IAB1,Cardi B understands Khloe Kardashian's plight
IAB1,Ariana Grande's '7 Rings' Dominates Hot 100 for Fifth Week | Billboard News
IAB1,Offset Wants Cardi B Back: Hailey Baldwin Bullied By Miley Cyrus | DR
IAB1,Ariana Grande Announced Additional Sweetener World Tour Dates | Billboard News
IAB1,Martha Stewart slams Uber after first ever trip
IAB1,Kim Kardashian: Drogenbeichte
IAB1,"Patrick Wilson Talks Training with Jason Momoa on 'Aquaman,' Upcoming 'Conjuring 3'"
IAB1,"Tiffany Young Talks New Single 'Teach You,' Sings Mariah Carey & More at 2018 AMAs | Billboard"
IAB1,Through The Years: Araya A. Hargate
IAB1,Mariah Carey's New 'Caution' Album Has Arrived | Billboard News
IAB1,"Chris Stapleton Reacts to Winning Male Vocalist, Song & Single of the Year at 2018 CMA Awards | Billboard"
IAB1,Schatten-Kunst von Vincent Bal
IAB1,How To Draw Chibi Harry Potter
IAB1,Weihnachtsdeko-Trends 2018
IAB1,Priyanka Chopra und Nick Jonas lassen sich Zeit mit Nachwuchs
IAB1,Adele's top fancy dress outfits!
IAB1,Taylor Swift & Her Celebrity Friends Dress Up For Her NYE Bash
IAB1,Maroon 5's 'Girls Like You' Feat. Cardi B Tallies a 5th Week at No. 1 on Hot 100 | Billboard News
IAB1,Les bébés de stars les plus attendus de 2019!
IAB1,Jamie Lee Curtis admits opiate addiction
IAB1,"Ed Helms Calls Out Michael Scott of 'The Office' With ""Terrible Boss"" Story | Sundance 2019"
IAB1,These People Have Never Seen ‘Forrest Gump’
IAB1,10 Mind Bending Paradoxes
IAB1,Meghan Markle reviendra-t-elle dans la dernière saison de Suits?
IAB1,Sabrina Carpenter on Finding Her Voice & Working With Brooklyn Beckham | Billboard
IAB1,Pete Davidson doing fine
IAB1,Beyonce pays tribute to Kim Porter
IAB1,Learn Wolfine\'s Guilty Pleasures
IAB1,Janelle Monáe Accepts Trailblazer Award at WIM 2018 | Billboard
IAB1,Brie Bella 'working on' second child
IAB1,Alaya Always Belonged on Stage
IAB1,Kacey Musgraves Reacts to Winning Album of the Year at 2018 CMA Awards | Billboard
IAB1,Kendall Jenner Was Warned About Controversial Vogue Afro Shoot
IAB1,It Girl: Vanessa Hudgens
IAB1,First Look at Britney Spear's Las Vegas Domination Residency | Billboard News
IAB1,Die Kardashians machen Schluss!
IAB1,Man Married a Hologram
IAB1,Backstage Access: The Script
IAB1,BTS Surpasses One Direction to Break Global Event Cinema Record | Billboard News
IAB1,"Emily Blunt: 'Mary Poppins Returns,' 'Edge of Tomorrow,' 'The Devil Wears Prada' | Career Highlights"
IAB1,Demi Lovato backs sobriety meme
IAB1,JoJo Rerecorded New Versions of First Two Albums | Billboard News
IAB1,Brad Pitt Is Still 'Very Single'
IAB1,Jennifer Lopez Headed on 'It's My Party: The Live Celebration' Tour | Billboard News
IAB1,Nikki Bella || Draw My Life
IAB1,THE GRAMMYS! || Draw My Scandal E32
IAB1,Dame Helen Mirren And What The Queen Thought Of Her Playing The Queen
IAB1,Chris Pratt et Katherine Schwarzenegger: on connaît la date de leur mariage!
IAB1,The Kardashians Win $10 MILLION In Lawsuit!
IAB1,Michelle Obama makes surprise Grammy Awards appearance
IAB1,Barack Obama Has Some Strong Personal Advice For Men
IAB1,Robbie Williams is new face of Weight Watchers
IAB1,Lady Gaga Wins Best Original Song Oscar
IAB1,"Spike Lee On 'Green Book's' Best Picture Win, Trump Takes Aim at Acceptance Speech | THR News"
IAB1,Ariana Grande Removes Another Pete Davidson Tattoo & Tweets “Love Doesn’t Exist”
IAB1,"Best-of Horn Challenge, Teil 2"
IAB1,Big Hit Entertainment Reveals TOMORROW X TOGETHER Members | Billboard News
IAB1,Blac Chyna Shades Rob Kardashian With New IG Post
IAB1,Nicholas Hoult played Favourite games
IAB1,Cardi B & Nicki Minaj Call TruceAfter Insane Drama
IAB1,Chris Pratt Wants A Winter Wedding
IAB1,Offset still 'trying to convince' Cardi B to take him back
IAB1,Jennifer Lawrence Has 'Fairy Tale' Romance
IAB1,Octavia Spencer Credits Lebron James For Her Equal Pay At Netflix
IAB1,Emma Watson Spotted With New Boyfriend
IAB1,Andy Cohen Welcomes Baby Boy
IAB1, Birthday: Ed Helms
IAB1,50 Cent and Iggy Azalea Side With Nicki Minaj In Steven Madden Feud | Billboard News
IAB1,Michael Shannon Gets Hit On By A Mom In New Clip
IAB1,Scott Disick felt pushed away
IAB1,Darren Criss hopes his work can inspire other Filipinos
IAB1,P Diddy Can’t Help Himself And STALKS Ex Jennifer Lopez On Social Media!
IAB1,"Nicki Minaj and Ariana Grande Shut Down Feud Rumors: ""Love You. For Life."" | Billboard News"
IAB1,TOP 10 ATEMBERAUBENDE Videospielmomente
IAB1,Normani and Calvin Harris Collaboration Dropping October 22nd | Billboard News
IAB1,Cardi B Deactivates Instagram
IAB1,"Quavo Discusses Why He's Releasing a Solo Album, Being an Uncle to Kulture & More at 2018 AMAs | Billboard"
IAB1,Ellen DeGeneres craved a 'challenge' prior to stand-up return
IAB1,Pete Davidson AVOIDING Ariana Grande AT ALL COST!
IAB1,Trevor Noah Responds to Jussie Smollett Case | THR News
IAB1,"Chris Pratt's Engagement Ring To Katherine Schwarzenegger Worth At Least $350,000"
IAB1,Fergie Decides Not To Do New Album With Black Eyed Peas
IAB1,Top 10 Siblings in Sports (Quickie)
IAB1,Jason Bateman to direct John Cena in Netflix movie
IAB1,Janelle Monáe is a Symbol of Empowerment
IAB1,"Thomas Rhett Talks Bruno Mars, Being a Dad, New Music & More at 2018 AMAs | Billboard"
IAB1,Birthday: Chris Rock
IAB1,You Should Know: Conan Gray | Billboard
IAB1,Ruth Langsford Tea Debate caught her by 'Surprise'
IAB1,Stormzy reveals Paul McCartney's 'incredible' piano lesson
IAB1,Queen and Adam Lambert to perform at Oscars
