Category,Title
IAB1,Ben Hardy 'turns to dating app to find love'
IAB1,Cover'd With Bad Bunny | Billboard
IAB1,Bad Bunny Looks Back at His Fashion Highlights | Billboard
IAB1,Céline Dion: Eine Möglichkeit für Eltern
IAB1,Miles Brown
IAB1,Olivia Munn Is Getting Cozy With New Boyfriend
IAB1,TOP 5 MYTHEN rund um WEIHNACHTEN
IAB1,"Lena Dunham to Adapt Refugee Survival Tale for Steven Spielberg, J.J. Abrams Film | THR News"
IAB1,Dance Your PhD
IAB1,Birthday: Regina King
IAB1,Sophie Turner had hair wash ban
IAB1,Sandra Oh Talks 'Killing Eve' Win Backstage at SAG Awards 2019
IAB1,Ariana Grande sued over ‘God is a Woman’ video
IAB1,Elle Macpherson walks in seawater to reduce bloating
IAB1,The Evolution of Stephen King
IAB1,Monsta X and Gallant Team Up for 'When You Call My Name' Mini-Doc | Billboard News
IAB1,Brie Larson was 'overwhelmed' by Emma Stone's Oscars success
IAB1,Matt Smith en négociations pour rejoindre Jared Leto au casting de Morbius
IAB1,10 Smartest Criminals Ever
IAB1,We Love Ed Sheeran!
IAB1,Billie Eilish Explains How She Created 'You Should See Me In A Crown' | How It Went Down | Billboard
IAB1,What Is A-Rod Getting J-Lo For Christmas
IAB1,Nicki Minaj Blocks Meek Mill On Instagram
IAB1,10 Biggest Cover Ups Of The 21st Century
IAB1,"Ryan Gosling, Corey Stoll In New 'First Man' Clip"
IAB1,Ben Affleck abandonne le rôle de Batman
IAB1,Brie Larson Knew She Wanted To Be An Actress At Six
IAB1,Boots Riley Made Two Full Soundtracks for 'Sorry to Bother You' | Songwriter Roundtable
IAB1,"Backstreet Boys Announce New 'DNA' Album, Tour Dates and Release ""Chances"" Music Video | Billboard News"
IAB1,Khloé Kardashian antwortet auf Gerüchte über möglichen Seitensprung von Tristan Thompson
IAB1,Congressman-Elect Dan Crenshaw And Pete Davidson Are Now Friends
IAB1,"Marc Anthony, Bad Bunny & Will Smith Perform 'Esta Rico' for the First Time at the 2018 Latin Grammys | Billboard News"
IAB1,'Queer Eye': Fab Five Named Entertainers of the Year by Out Magazine | THR News
IAB1,Netflix July 2018: What’s New? | NW News
IAB1,Blake Griffin Gets Into HEATED Exchange With Fan During OT
IAB1,Guardians Of the Galaxy 2: Easter Eggs! Star Lord & Mantis Siblings?! | NW News
IAB1,Rich the Kid Explains How He Created 'Splashin' | How It Went Down | Billboard
IAB1,Barack Obama Reveals 2018 Favorites in Year-End List | THR News
IAB1,James Jordan's 'weird' Dancing On Ice training
IAB1,Rami Malek In Latest Trailer For 'Bohemian Rhapsody'
IAB1,Aaron Taylor-Johnson's luxury work
IAB1,"Kim Kardashian: Es hilft, dass Kanye Pro-Trump ist"
IAB1,El secreto de Jesse y Joy está en su sangre
IAB1,Backstreet Boys Land First No. 1 Album in Nearly 20 Years | Billboard News
IAB1,Kim Kardashian West 'cried hysterically' after discovering Caitlyn Jenner dressed as a woman
IAB1,Woody Allen will keep working
IAB1,Peter Andre's daughters have close bond
IAB1,Ariana Grande’s Tattoo Is Still Spelled WRONG Even After Fix!
IAB1,Spider-Man vs. Batman: Battle of the Animated Series | NerdFight
IAB1,Jamie Dornan Links 'Robin Hood' To Today's Climate
IAB1,C. Tangana & Becky G Explain How They Created 'Booty' | How It Went Down | Billboard
IAB1,How to Prepare for a Hiking Trip
IAB1,Chester Bennington
IAB1,Cardi B Pregnant Again?
IAB1,Tom Hardy Kisses Michelle Williams In 'Venom'
IAB1,"Deathstroke Solo Film “Still In Works”, Could The Next Indiana Jones Be A WOMAN! | NW News"
IAB1,CELEBRITY OF THE WEEK - Dwayne Johnson
IAB1,Jimmie Allen Talks New Album 'Mercury Lane' at 2018 CMA Awards | Billboard
IAB1,Emily Ratajkowski spends $800 on skincare routine
IAB1,Michael J Fox gets tattoo
IAB1,George Clooney versteigert Motorrad
IAB1,Netflix Cancels 'Daredevil' After Three Seasons | THR News
IAB1,CNCO On Their Performance At Latin Power Players and Their Upcoming World Tour | Billboard
IAB1,Inside J Balvin's Big Night at the 2018 Latin Grammys | Billboard News
IAB1,Finish The Hit: Ariana Grande Lyrics Challenge | Billboard
IAB1,Ariana Grande Cuts Iconic Ponytail
IAB1,Ronnie Wood won't allow hair to go grey
IAB1,Willow Smith shaved head because she was 'over it'
IAB1,Tierra Whack Talks Getting Past Failures & Musical Inspirations at WIM 2018 | Billboard
IAB1,Geht Lindsay Lohan mit Schwester Aliana ins Studio?
IAB1,Big Hit Entertainment Reveals Upcoming Launch of Boy Band TXT | Billboard News
IAB1,Dinah Jane Releases Music Video for Her Debut Single 'Bottled Up' | Billboard News
IAB1,"Terry Crews on Upcoming Season 6 of 'Brooklyn Nine-Nine': 'Bigger, Faster & Stronger' | 2018 People's Choice Awards"
IAB1,Ronnie Wood opens up on Confessin' The Blues
IAB1,Kany Garcia Talks Covering Maná Songs During Her Shows | Billboard Latin
IAB1,Kourtney Kardashian SPOTTED With NEW Mystery Man!
IAB1,Celebrity Closeup: Amandla Stenberg
IAB1,Glenn Close Tells Academy Members She Wants No Pity Oscar
IAB1,Megan Barton Hanson 'too unwell' to support boyfriend Wes on Dancing On Ice
IAB1,Kanye West Is A Affectionate Father To Daughter Chicago
IAB1,Ariana Grande Vying for First No. 1 on Next Week's Billboard Hot 100 | Billboard News
IAB1,"'SNL' Rewind: Rachel Brosnahan Hosts, Government Shutdown Satirized | THR News"
IAB1,Cardi B Clarifies Baby #2 Tweet
IAB1,Michelle Rodriguez: Liam Neeson Isn't Racist
IAB1,Will Smith And Martin Lawrence Filming Bad Boys For Life In Atlanta
IAB1,Elvis Presley to be honoured by president
IAB1,Spider-Man: Into the Spider Verse Trailer REACTIONS! | NW News
IAB1,Cheryl Tweedy: Coconut oil is everything
IAB1,Sandra Bullock donates $400k to Red Cross for wildfire relief
IAB1,"Excerpt Khalil Gibran The Garden of the Prophet, (1939)"
IAB1,Jaden Smith Confirms Again That Tyler The Creator Is His Boyfriend
IAB1,Olivia Colman Wins Best Actress for 'The Favourite' | Golden Globes 2019
IAB1,Herzogin Meghan feiert Baby-Party in New York
IAB1,Jeff Bridges Gets The Cecil B. Demille Award At The Golden Globes
IAB1,Christian Bale Accepts Golden Globe Award And Thanks Satan
IAB1,4 New Songs to Make Your Weekend Lit
IAB1,This is Us
IAB1,Zoella’s BOOK Scam Revealed
IAB1,Star File: Peter Jackson
IAB1,The Challenges and Possibilities Facing the Oscars In Its Host Search | THR News
IAB1,Netflix Makes Biggest Subscription Price Increase Ever | THR News
IAB1,The Grinch Gets Yelled At By A Strange Little Goat
IAB1,Kim Kardashian West and Kanye West are 'closer' with a baby on the way
IAB1,Sandra Bullock is 'neurotic' when it comes to kids
IAB1,Leila George Talks About Playing The Role Of Daddy's Girl
IAB1,"'Won’t You Be My Neighbor?' Is Not a Mr. Rogers Nostalgia Piece, Says Director Morgan Neville | Documentary Roundtable"
IAB1,The World Emerges In Urban Music
IAB1,Chloe Grace Moretz Lived in Summer Camp While Filming ‘Miseducation of Cameron Post': ‘It Was Method’
IAB1,Paris Hilton can't shake off her ditsy image
IAB1,Michiko &amp; Hatchin and the Prince Charming Myth
IAB1,Cardi B REACTS To Offset CRASHING Her Concert & Trying To Win Her Back!
IAB1,Celebrity Shortlist (42): Top 3 Actors Who Also Play In A Band
IAB1,Kim Kardashian Goes Over The Top Sexy For John Legend Birthday Bash
IAB1,"Artists and Events Offer Tickets, Meals and Jobs to Furloughed Government Workers | Billboard News"
IAB1,Ryan Gosling Has Something To Say About Space In New 'First Man' Scene
IAB1,Jada Pinkett Smith: I had to pull a knife on aggressive boyfriend
IAB1,Charlotte Crosby's chosen her engagement ring!
IAB1,"Pedro Capo & Farruko Open Up About ""Calma"" Going Top Ten Hot Latin Songs | Billboard"
IAB1,Travis Scott loves Stormi time
IAB1,Harry Styles working on new film projects
IAB1,Regina King won't get 'caught up' in awards season
IAB1,"Sam Smith and Normani's ""Dancing With a Stranger"" Music Video Premieres on Apple Music | Billboard News"
IAB1,Die Singende Säge
IAB1,Rosamund Pike And Richard Madden And Rising Star Awards
IAB1,Sarah Silverman: Failure is an opportunity
IAB1,Carrie Underwood gives birth to a baby boy
IAB1,Sabrina Carpenter on Finding Her Voice & Working With Brooklyn Beckham | Billboard
IAB1,Celebrity Shortlist: Top 3 Actresses Who Honor Their Heritage With Their Clothes
IAB1,Bradley Cooper relishes the challenge of balancing acting and directing
IAB1,Elton John announces UK tour for 2020
IAB1,Another Police Visit For Blac Chyna!
IAB1,'Boy Erased' Tells the Emotional True Story of Garrard Conley and Conversion Therapy
IAB1,Bruno Mars drops $500k on watches for his band
IAB1,Colombians Are Ready For The World Cup
IAB1,Celebrities Who Have Been Married Several Times
IAB1,Gwen Stefani's perfect Christmas present
IAB1,Hailey Bieber Getting Plastic Surgery To Look Like Selena Gomez?! | MOTW
IAB1,Ed Sheeran Leads The Billboard Awards
IAB1,Michael Myers Meets His Next Target In 'Halloween'
IAB1,Will Chris Christie Be Named Chief of Staff?
IAB1,Sarah Huckabee Sanders Criticizes CNN's Response to Bomb Scare | THR News
IAB1,"Hugh Jackman, Ryan Reynolds und Co. erweisen Stan Lee die letzte Ehre"
IAB1,Studio Wrap: Jeff Bridges
IAB1,Gordon Ramsay expecting fifth child
IAB1,True Thompson starts crawling
IAB1,Gwyneth Paltrow’s Goop to become Netflix documentary series
IAB1,"Early Release! Billboard Hot 100 Top 10 November 3rd, 2018 Countdown | Official "
IAB1,Channing Tatum And Chris Evans Were Nearly In Avatar!
IAB1,Love Life Lowdown: Nick Jonas
IAB1,Celebrity Shortlist (31): Top 3 Best First Photos Posted By Celebs
IAB1,Paris Jackson BREAKS SILENCE On Entering Mental Health Center!
IAB1,Cindy Crawford’s Son Arrested For DUI
IAB1,Miley and Liam secretly married?
IAB1,Sophie Turner revealed Game of Thrones ending
IAB1,Hailey Bieber Finds It Scary To Be Young And Married
IAB1,John C. Reilly And Joaquin Phoenix Make A First Impression In New Clip
IAB1,Lindsay Lohan to Hit Big Screen For First Time in 6 Years | Billboard News
IAB1,Chrissy Metz DENIES Calling Alison Brie The B Word During Golden Globes 2019!
IAB1,Monsta X Announces Latest LP 'Take.2 We Are Here' Is Coming February 18 | Billboard News
IAB1,Kylie Jenner named top fashion influencer of 2018
IAB1,Birthday: Marisa Tomei
IAB1,Bruce Springsteen plans new album and UK tour
IAB1,10 Terrible Inventions By Great Inventors
IAB1,Drake gassed over Adele
IAB1,Chrissy Teigen: Ihre Tochter ist ein Makeup-Pro!
IAB1,Matthew McConaughey won't speak before seeing work
IAB1,AMC and BBC America to Air Season 2 of 'Killing Eve' | THR News
IAB1,"Ariana Grande Delivers Video For Latest Track ""7 Rings"" | Billboard News"
IAB1,Celine Dion slams critics of her weight
IAB1,Kendall Jenner & Gigi Hadid Back On For Victoria's Secret Fashion Show
IAB1,"Wolfine: The Man Behind \""Bella\"""
IAB1,Garth Brooks Talks New Song 'Stronger Than Me' at 2018 CMA Awards | Billboard
IAB1,Chris Rock Isn't Taking Oscars Hosting Job Either
IAB1,You Should Know: Rosalía | Billboard
IAB1,Glenn Close doesn't want to win a 'pity Oscar'
IAB1,Lily James And Dominic Cooper To Star In Romantic Movie
IAB1,Police Say Jussie Smollett Staged Hate Attack to Advance Career | Billboard News
IAB1,'New Year's Rockin' Eve' 2019: Must See Moments and Performances | Billboard News
IAB1,Ariana Grande to headline Coachella 2019
IAB1,Monsta X Return With New Album 'Take.2 We Are Here' | Billboard News
IAB1,Los Angeles Rams' Male Cheerleaders Make History At Super Bowl LIII | THR News
IAB1,Otis Redding: The King Of Soul
IAB1,Richard E. Grant Talks Atypical Love Story in 'Can You Ever Forgive Me?' | Actor Roundtable
IAB1,Priyanka Chopra And Nick Jonas Are One Wealthy Power Couple
IAB1,Liebesgerüchte bei Kate Beckinsale und Pete Davidson
IAB1,2018 Victoria's Secret Fashion Show: A Full Recap | Billboard News
IAB1,Rachel Weisz: My daughter looks just like her dad
IAB1,Why Do We Hate CGI?
IAB1,Sofia Reyes\' Best Hits
IAB1,2019 Grammy Awards: The Most Memorable Moments | Billboard News
IAB1,The Complete ROMANTIC HISTORY of Bubbline (Princess Bubble Gum + Marceline of Adventure Time)
IAB1,Michiko  Hatchin and the Prince Charming Myth
IAB1,"Mariah Carey's ""All I Want For Christmas"" Shatters Records"
IAB1,Offset Cheated On Cardi B With MULTIPLE Women
IAB1,Taylor Swift Sparks Plastic Surgery Rumours After Golden Globes 2019 Appearance!
IAB1,Chris Hughes' brother has cancer
IAB1,Anne Hathaway Will Do Anything To Leave Her Husband In 'Serenity'
IAB1,"Jeff Goldblum, Tye Sheridan Star in 'The Mountain' | Sundance 2019"
IAB1,Djimon Hounsou Talks About Being One With The Ocean
IAB1,Jamie Lee Curtis criticises Kevin Hart for old homophobic tweets
IAB1,Songs To Survive Valentine's Day
IAB1,Soulja Boy Is Giving Kanye West Grief Over Trump
IAB1,"Awkwafina Wins Ring Toss: ""I'm Like a Boyfriend at the Fair,"" See All the Winners | Sundance 2019"
IAB1,Brian May 'disappointed' by Bohemian Rhapsody Special Effects snub
IAB1,Emmy Rossum Talks About Crime In A Small Town
IAB1,Duchess Meghan to return to 'Suits'?
IAB1,New Green Day Music
IAB1,"Maren Morris & Ryan Hurd Talk New Music, Their Wedding & More at 2018 CMA Awards | Billboard"
IAB1,Awkwafina to star in Jumanji 2?
IAB1,Andy Serkis defends Scarlett Johansson
IAB1,Octavia Spencer and Bryce Dallas Howard reunite for ensemble comedy
IAB1,Rob Kardashian Caused FIGHT Between Blac Chyna & Alexis Skyy! Justin Bieber Plans MAJOR Surprise | DR
IAB1,"'SNL' Rewind: Jason Momoa Hosts, Plays Khal Drogo and Santa Claus | THR News"
IAB1,Spider-Man vs Batman: Battle of The Animated Series | NerdFight!
IAB1,David Beckham says fashion should be for everyone
IAB1,Hailey Bieber Allegedly Getting Plastic Surgery To Look More Like Selena Gomez
IAB1,"Rosalia Talks Favorite Dance Moves, Spanish Street Foods & More | Growing Up Latino"
IAB1,Drake teases Las Vegas residency
IAB1,Cardi B announces she’s splitting from Offset
IAB1,Selena Gomez regresa a Instagram tras 4 meses de silencio
IAB1,Jake Paul Tries The Bird Box Challenge For 24 HOURS! Bella Thorne PROPOSES To Tana Mangeau!
IAB1,Big Freedia Opens Up About Beyonce on 'Backseat Heat with Wendy Williams' | Billboard News
IAB1,Rob Kardashian Doesn't Want Blac Chyna 'Cut Out' Of Dream's Life
IAB1,The Evolution of Nicki Minaj
IAB1,Gerard Butler Is Impressive As A Naval Submarine Commander
IAB1,Katie Price's website taken offline after not paying bills
IAB1,Adam Levine pays $32m for Ben Affleck and Jennifer Garner's home
IAB1,Melissa McCarthy Struggled to Comprehend Her Oscars Nomination
IAB1,Love Life Lowdown: Kate Mara
IAB1,Jamie Dornan Becomes An Insane Photographer In 'A Private War'
IAB1,Bachata or Trap? We Got New Music for You
IAB1,Nicki Minaj flew to China to attend 'unauthorised' festival
IAB1,Rebecca Ferguson dishes on the casual dress code for her wedding
IAB1,John Cena And Hailee Steinfeld Light Hearts and The Empire State Building
IAB1,"Brian May Wants To Get Really, Really Spaced Out"
IAB1,"Def Leppard, Janet Jackson and More Nominated for Rock & Roll Hall of Fame | Billboard News"
IAB1,Kelly Clarkson Is Planning A Real Christmas
IAB1,"Lupita Nyong'o, Chadwick Boseman, Danai Gurira Announce 'Black Panther' Scholarship | Women in Entertainment 2018"
IAB1,Amber Heard: Nach Jahren voller Dating Desaster auf der Suche nach einer funktionierenden Beziehung
IAB1,Stella Abrera - Capezio
IAB1,Kevin Feige Believes In James Gunn For 'Suicide Squad 2'
IAB1,Farruko Opens Up About His Canceled Concert in Puerto Rico | Billboard
IAB1,"Taraji P. Henson Goes Through A Whirlwind Of ""Whoa"" On Walk Of Fame"
IAB1,James Corden: Sitzt Taylor bald bei ihm im Auto?
IAB1,"Sunny Suljic, Lucas Hedges In 'Mid90s' New Trailer"
IAB1,Orange Fiber: Mode aus Orangen
IAB1,Disney Earnings Preview: What to Watch For
IAB1,SNTV - Chris Evans confirms Avengers 4 has wrapped filming
IAB1,Dua Lipa Explains Why 'Alita: Battle Angel' Is Needed For The Women Of Today
IAB1,TOP 10 Kenny-Tode in South Park
IAB1,"Taraji P. Henson Goes Through A Whirlwind Of ""Woah"" On Walk Of Fame"
IAB1,Style Stories: Fashion Stylist Omari Francis
IAB1,Halle Berry reveals the seven steps to her perfect abs
IAB1,Mel B claims ex took her money
IAB1,Hailey Baldwin Rides Shirtless Justin Bieber In Steamy Photoshoot
IAB1,Jessica Simpson asks Instagram for swollen feet remedies
IAB1,Gwen Stefani to Join CNN New Year's Eve Broadcast | Billboard News
IAB1,Leila George Witnesses The Horrors Of War In 'Mortal Engines'
IAB1,Amazon Buys Rights to Adam Driver Political Drama 'The Report' | THR News
IAB1,Women of Action: Meet a Hollywood Female Stunt Coordinator Zoe Bell
IAB1,Kanye West entschuldigt sich bei Cher
IAB1,Earth Rules These Singers
IAB1,Katie Price Plans To Adopt A Nigerian Girl
IAB1,Leslie Mann gets real about aging in Hollywood
IAB1,Celebrity Shortlist: Top 3 Actors Who Get Creative In Their Spare Time
IAB1,Billboard Critics Pick 2018's 100 Best Songs | Billboard News
IAB1,Taylor Swift Gets Political Once Again on Instagram | Billboard News
IAB1,R. Kelly Released From Contract With Sony | Billboard News
IAB1,You Should Know: Gunna | Billboard
IAB1,Lenny Kravitzhat es nicht leicht in der Liebe
IAB1,Avengers: Infinity War führt die Liste der Nominierten der Kids' Choice Awards 2019 an
IAB1,Kim Kardashian West's make-up mad daughter
IAB1,Viola Davis Is Giving Praise To Steve McQueen
IAB1,Jorge Drexler: From Doctor to Musician
IAB1,Has Lindsay Lohan Finally Straightened Her Life Out
IAB1,Jonas Blue praises Louisa Johnson
IAB1,Wolfline Brings The Versatility of The Streets
IAB1,"Brasilia, Modernism and Utopia"
IAB1,Drake | Draw My Life
IAB1,Dolly Parton Performed Part Of Her Own Grammy Tribute
IAB1,Quavo Disses Nicki Minaj: Show Loyalty To Cardi B
IAB1,Birthday: Denzel Washington
IAB1,MarvelvDCcomicsDANCEoff
IAB1,Kyle Chandler Shares Movie Set Relationships For 'First Man'
IAB1,Emma Stone's corset struggle
IAB1,The Nightmare Before Christmas Isn't Perfect But We Still Love It | Ruined
IAB1,John Legend says Kanye West sees himself in Donald Trump
IAB1,Prince Estate Announces Weekly Release of Music Videos From 1995-2010 | Billboard News
IAB1,Taylor Swift Gets Political Once Again on Instagram | Billboard News
IAB1,Halsey Clarifies She's Not Pregnant on Twitter | Billboard News
IAB1,"With His Family In The Courtroom, Michael Cohen Is Sentenced To 3 Years In Jail"
IAB1,Anne Hathaway changed after dying hair blonde
IAB1,Alex Rodriguez: Jennifer Lopez destroyed the word no
IAB1,Exclusive Interview - Willem Dafoe explains how the themes in ‘Aquaman’ are very relevant
IAB1,Frida Kahlo
IAB1,Kevin Hart || Draw My Life
IAB1,Michael Bay Reboots Teenage Mutant Ninja Turtles...AGAIN! | NW News
IAB1,Tituss Burgess Reveals the Best Advice He's Received at WIM 2018 | Billboard
IAB1,Aquaman Hits The Billion Dollar Mark
IAB1,Randy Jackson's divorce confirmed
IAB1,'Rent': Meet the Cast of Fox's Upcoming Live Production | THR News
IAB1,Paul Weller wants to work with Robert Plant
IAB1,Cardi B threatens to sue Nicki Minaj
IAB1,Ice Cube Helping Celebrity Deathmatch Return To Mtv
IAB1,Top 10 der witzigsten Zeitlupen - Quicky
IAB1,George H.W Bush: Love And Praise Lights Up Social Media
IAB1,'Patriot Act': Netflix Removes Critical Episode in Saudi Arabia | THR News
IAB1,Herzogin Meghan verleiht Modeauszeichnung an ihre Hochzeitskleid-Designerin
IAB1,Kendall Jenner Caught Booing Tristan Thompson
IAB1,Katie Price declares herself bankrupt
IAB1,10 Weirdest Broadcasts Of All Time
IAB1,A City Governed by Young People and Children?
IAB1,Channing Tatum's number one priority
IAB1,Kevin Costner and Diane Lane to star in thriller ‘Let Him Go’
IAB1,Chris Brown ARRESTED In Paris! Ariana Grande RUINING Valentines Day With New Album! | DR
IAB1,Yahya Abdul-Mateen II on Fighting Jason Momoa in 'Aquaman'
IAB1,Analyst Rich Greenfield Talks Disney Earnings and Streaming Plans
IAB1,Madonna Turned Down Pink Hit
IAB1,"Fragment: Niebla, Miguel de Unamuno, 1914"
IAB1,Dec Donnelly: BGT will be back to normal
IAB1,Adam Driver won't take selfies for charity
IAB1,Here's What to Expect from The Try Guys at the 2018 Streamy Awards
IAB1,Gemma Chan Is In 'Captain Marvel'
IAB1,Ariana Grande Reveals What Advice She Would Give to Her Younger Self | Billboard
IAB1,The Day John Lennon Was Shot
IAB1,"Dennis Quaid, Meagan Good In 'The Intruder' First Trailer"
IAB1,Disney Working on Live Action 'Hunchback' Movie | THR News
IAB1,Sophie Ellis-Bextor And Richard Jones Have Baby Number 5
IAB1,Kevin Hart renuncia a presentar la gala de los Óscar por la polémica de sus mensajes homófobos
IAB1,Nothing Can Stop Zion &amp; Lennox
IAB1,Lady Gaga Collected Memorabilia From  'A Star Is Born'
IAB1,‘Shazam!’ Star Zachary Levi on Whether Black Adam or Shazam Would Win in a Fight
IAB1,Aerodrums - Schlagzeug spielen in der Luft
IAB1,Sandra Bullock trauert um Vater und Hunde
IAB1,"Bryan Cranston On 'The Upside': ""It's A Love Story Between Two Straight Men"""
IAB1,Anthony Scaramucci Opens Up About Time On Celebrity Big Brother
IAB1,Lady Gaga Gives Behind-the-Scenes Glimpse of 'Enigma' Rehearsals | Billboard News
IAB1,Katy Perry 'Gave Up On Love' Before Orlando Bloom Romance
IAB1,'The Bachelor': Will Colton Underwood Propose After All? | THR News
IAB1,Cardi B Shuts Down Ariana Grande Feud Rumors
IAB1,The Legacy of Spanish Rock
IAB1,"Michael Shannon, Hilary Swank And The Meaning Of Family In ""What They Had"""
IAB1,Kevin Smith takes blame for Ben Affleck fallout
IAB1,Preppy ‘Clueless’ Inspired Looks & Ugly Halloween Sweaters Are Falls Sexiest Looks | Trending Topics
IAB1,Shania Twain wants Celine Dion collaboration
IAB1,Josh Singer And James Hansen On Writing 'First Man'
IAB1,Eddie Murphy's 10th Child Is In New Christmas Photos
IAB1,JanuHairy Goes NEXT LEVEL By Rainbow Dying Armpit Hair! | Trending Topics!
IAB1,"Jerry Seinfeld Weighs in on Louis C.K., Roseanne and Cosby | THR News"
IAB1,Eddie Redmayne says J. K. Rowling is 'extraordinary'
IAB1,Ellen Degeneres | Draw My Life
IAB1,Tommy Torres and Wolfine Make Our Weekend Romantic
IAB1,Russell Brand's New Year's resolution revealed
IAB1,10 Ways Future Technology Will Ruin Our Lives
IAB1,'Glass' Star Samuel L. Jackson on His Favorite Curse Word and Trump
IAB1,Ariana Grande Plans To RUIN EVERYONE'S Valentines Day With NEW ALBUM!
IAB1,Piers Morgan hospitalised over man flu
IAB1,Oldtimer im Schwarzwald
IAB1,Dance.com Sizzle Reel
IAB1,Jason Momoa struggled finding work after Game of Thrones
IAB1,"Top 10 Deadpool EASTER-EGGS, die du vielleicht VERPASST hast!"
IAB1,Gorillaz's The Now Now Is Here!!
IAB1,Love Life Lowdown: Mandy Moore
IAB1,Michael Gandolfini to star as Tony Soprano in The Many Saints of Newark
IAB1,Style Stories: Hannah Kim Creative Director Ozlana
IAB1,Russell Brand struggles to 'let go' of other people's opinions
IAB1,Miley Cyrus: Schlüpfrige Details
IAB1,Emily Blunt thanks Julie Andrews for Mary Poppins freedom
IAB1,"Lichtinstallationen von ""3hund"""
IAB1,The Complete Romantic History of Bubbline (Princess Bubblegum and Marceline) on 'Adventure Time'
IAB1,Fleur East is a stronger woman
IAB1,Julia Roberts Hides Something In 'Homecoming'
IAB1,Fleur East felt 'really low' after Syco Records split
IAB1,Dr. Ruth K. Westheimer Talks 'Ask Dr. Ruth' Documentary | Sundance 2019
IAB1,Michael Moore Releases Footage of Bomb Suspect at Trump Rally | THR News
IAB1,"Before the Flood, the Portrait of a Crisis Announced"
IAB1,Serena Williams fronts campaign for Bumble dating app
IAB1,Celebs Turning 30 In 2019
IAB1,Kanye West Previews New Music From Uganda During Live Stream | Billboard News
IAB1,Brad Pitt | Draw My Life
IAB1,Universal Developing 'Dear Evan Hansen' Movie | THR News
IAB1,Victoria Beckham launching own beauty brand
IAB1,Jack P Shepherd undergoes hair transplant
IAB1,"Carey Mulligan On Why She Felt a ""Responsibility"" With 'Wildlife' Role | In Studio"
IAB1,Willem Dafoe As 'Van Gogh' Defends His Art
IAB1,Travis Scott will marry Kylie Jenner soon
IAB1,Kevin Spacey: Zu schnell am Steuer
IAB1,Jake Paul's “Bird Box Challenge” Video REMOVED From Youtube After He Drives Car BLINDFOLDED!
IAB1,Ariana Grande: Für Song entschuldigt
IAB1,Logan Paul QUITTING Youtube!
IAB1,Quentin Tarantino verscheucht Einbrecher im eigenen Haus
IAB1,KUWT Ratings DROP To All Time LOW! Kourtney & Scott Getting Their Own Spin Off Series!
IAB1,Noel Gallagher to play show at Manchester's Heaton Park
IAB1,Axel Says He'll Celebrate a Latin Grammy Win By Visiting Vegas Attractions | Billboard Latin
IAB1,Chris Pratt Moves In With New Fiancé Katherine Schwarzenegger
IAB1,Kendall Jenner Opens Up In Emotional Post About Her Debilitating Struggle With Acne
IAB1,"'SNL' Rewind: James McAvoy's Hosting Debut, Steve Martin Makes Political Cameo | THR News"
IAB1,Will Smith avait peur de prendre la suite de Robin Williams dans Aladdin!
IAB1,Pete Davidson: Beim Date erwischt
IAB1,Dancing Zombies Are Giving Us Life!
IAB1,NBA Reactions To Nets Caris Levert Gruesome Leg Injury
IAB1,Nikki Bella Annoyed By Family Dating Intervention
IAB1,Nikki Bella wants to continue dating Peter Kraus
IAB1,"Drake: 'Scorpion' Was 2018's Top Album in U.S., Says Nielsen Music | Billboard News"
IAB1,Channing Tatum's Number One Priority
IAB1,Jada Pinkett Smith & Leah Remini Clear Up Scientology Feud | THR News
IAB1,Cardi B Named Entertainment Weekly’s Entertainer of the Year
IAB1,Georgia Toff won't return to I'm A Celeb to crown the next winner
IAB1,Amy Schumer's tough pregnancy
IAB1,Milan Kundera on Coincidence and Love
IAB1,TOP 10 LUSTIGE TODE in VIDEOSPIELEN
IAB1,Ryan Reynolds delays surgery
IAB1,Taylor Swift 'Prevails In $1m Lawsuit'
IAB1,"‘Extremely Wicked’ Director Joe Berlinger on Making Ted Bundy Film, Doc Series Simultaneously"
IAB1,Kendall Jenner shares handwritten love letter from mega fan
IAB1,"Reid Scott Says Final Season of 'Veep' is ""So Satisfying"" | In Studio"
