Category,Title
IAB1,Kylie Jenner CONFIRMS Baby #2! Blac Chyna CAUGHT Dating Soulja Boy! | DR
IAB1,John Cena Is A Good Guy Who Is Helping Kids
IAB1,Jake Paul CLICKBAITES Fans With A FAKE Erika Costell Breakup Video!
IAB1,Selena Gomez has big plans for 2019
IAB1,Rihanna in discussions to launch luxury fashion house?
IAB1,James Argent compares Gemma Collins' fall to Tyson Fury
IAB1,Stacey Solomon and Joe Swash keep cash separate for kids
IAB1,Brianna Hildebrand's Role in 'Deadpool' Originated From Ryan Reynolds | THR News
IAB1,Tintin l'aventurier souffle ses 90 bougies
IAB1,How To Draw: SpongeBob SquarePants
IAB1,Top 10 Things to Know About Netflix’s The Innocent Man
IAB1,"Gemma Collins burns extra 1,000 calories a day on Dancing On Ice"
IAB1,Top 10 des PIRES TRAHISONS de GAME OF THRONES !
IAB1,Stormzy || Draw My Life
IAB1,If Celebs Could Dress Like Their Favorite Princess or Superhero
IAB1,Justin Bieber unveils Drew House fashion line
IAB1,"Ariana Grande s'est fait plaisir sur le tournage de sa nouvelle chanson, 7 Rings!"
IAB1,Peter Jackson s'attaque à un documentaire sur les Beatles
IAB1,Mit Plastikfolie ans Meisterwerk
IAB1,Kit Harrington's wife didn't react well to Game of Thrones' ending
IAB1,Cardi B won't change her style
IAB1,Birthday: Jaeden Lieberher
IAB1,Top 10 Movie Comeback Lines (Quickie)
IAB1,Chris Pratt relates to Lego Movie character in a 'major way'
IAB1,"Ariana Grande Teases New Single ""Imagine"" on Social Media | Billboard News"
IAB1,"Chloe x Halle to Perform ""America the Beautiful"" at 2019 Super Bowl | Billboard News"
IAB1,Lily James has directing dream
IAB1,Rapper YNW Melly Is Charged With Murder
IAB1,Prince: Quote Of The Day
IAB1,"Ariana Grande Drops Music Video For ""Break Up With Your Girlfriend, I'm Bored"" | Billboard News"
IAB1,5 Time Oscars Nominee Albert Finney Has Died
IAB1,Benedict Cumberbatch lands devilish role in 'Good Omens'
IAB1,Juliette Binoche pense qu'il faut arrêter de s'en prendre à Harvey Weinstein
IAB1,Aaron Paul To be Honored At Sun Valley Film Festival
IAB1,"'Umbrella Academy': Mary J. Blige, Ellen Page and Gerard Way on Their Superhero Journeys | Heat Vision Breakdown"
IAB1,Simon Cowell drops £30k on party for Eric
IAB1,Adriana Lima splits from boyfriend
IAB1,Lady Gaga Defends Cardi B Over Grammy Win
IAB1,You Should Know: Rosalía | Billboard
IAB1,"'Leave No Trace' Director Debra Granik Talks the ""Very Supportive"" Community of Female Filmmakers | Spirit Awards 2019"
IAB1,Lindsay Lohan bittet Oprah Winfrey um Rat
IAB1,"Happy Birthday, Rashida Jones"
IAB1,Grosse chute en pole dance
IAB1,Emily Atack talks boys and One-Woman show!
IAB1,Maná Discusses Song Selection and Sends a Message of Hope for Venezuela | Billboard
IAB1,The islands and the whales
IAB1,Emma Stone et Paul McCartney s'associent pour lutter contre le harcèlement!
IAB1,Natalie Dormer Tapped to Star in Showtime's 'Penny Dreadful' Revival | THR News
IAB1,James McAvoy narrowly dodged holiday scam
IAB1,"Imagine Dragons Pay Tribute to Video Game Culture In ""Zero"" Video | Billboard News"
IAB1,Fox's Mystery Singing Competition Starts January 2
IAB1,Top 10 des MEILLEURS personnages de DRAGON BALL Z !
IAB1,Meryl Streep praises Bradley Cooper's director skills
IAB1,Grammys 2018: BTS Nominated for First Award | Billboard News
IAB1,Truth Revealed About Grayson Dolan And James Charles After A Lie Detector Tes
IAB1,Ellie Goulding's engagement ring is over 100 years old
IAB1,Olivia Colman crowned Best Actress at the 2019 Academy Awards
IAB1,Katy Perry and Orlando Bloom Are Engaged
IAB1,J.R. Smith To Be Fined Every Game By NBA for Supreme Tattoo!
IAB1,Justin und Hailey auf Haus-Suche
IAB1,Nick Jonas évoque son combat contre le diabète
IAB1,Cardi B 'depressed' over losing baby weight so fast
IAB1,L’histoire incroyable de la bague de fiançailles de ce jeune couple
IAB1,Stunning Diane Kruger Talks About The Luck She Has Had In Hollywood
IAB1,Dossier Spécial : les plus grands artistes musicaux de 2018
IAB1,Camila Cabello denies she's playing Maria in West Side Story
IAB1,Jenna Dewan 'having fun' with new beau
IAB1,Michelle Yeoh Tapped by CBS All Access for 'Star Trek' Spinoff | THR News
IAB1,Justin Bieber Has Trust Issues
IAB1,Jada Pinkett Smith: Ihre Mutter wollte die Scheidung
IAB1,Découvrez l’hydroptère personnel de Waydoo
IAB1,Dolly Parton stopped meetings so men could stare at her boobs
IAB1,Ariana Grande's Grammy fury over Mac Miller snub
IAB1,Jennifer Lawrence: Deshalb könnte Cooke Maroney der Richtige sein
IAB1,"Cardi B and Bruno Mars Release New Collab ""Please Me"" | Billboard News"
IAB1,Rachel Brosnahan on women finding their voices
IAB1,Carey Hart sends out 'looter' warning
IAB1,Ruby Rose Is The ‘Most Dangerous’ Celeb To Search Online
IAB1,Troye Sivan || Draw My Life
IAB1,Bradley Cooper Took A Special Date To SAG Awards
IAB1,Sobrevive al lunes con Mario Bautista
IAB1,Cardi B: obligée de sortir son nouveau single plus tôt que prévu!
IAB1,Taylor Swift Urges People to Vote in New Instagram Story | Billboard News
IAB1,Twenty One Pilots: New Bandito Tour Dates Announced | Billboard News
IAB1,"Teddy Geiger Talks New Music,  Working With Shawn Mendes & Coming Out as Transgender  | Billboard"
IAB1,Didi Conn to skate to Mary Poppins on Dancing On Ice
IAB1,ABBA: 10 anos de hits e mudanças
IAB1,Zac Efron Stepped Up Game After Seeing Lily Collins Act
IAB1,Chien policier: mort d’un héros
IAB1,"Les pulls moches de Noël, un vrai business pour cette mère célibataire!"
IAB1,Blac Chyna’s 2 Part Tell AllInterview About The Kardashians
IAB1,Idris Elba is People's Sexiest Man Alive
IAB1,Ryan Reynolds 'Steals' Blake Lively's Moisturizer
IAB1,Gal Gadot Was Excited About Singing For 'Ralph Breaks The Internet'
IAB1,Blake Lively prépare son retour à la télévision!
IAB1,Cardi B: le sexe avec Offset lui manque!
IAB1,Aquaman world premiere: Stars talk FISH!
IAB1,Adam Levine: Super Bowl noch nicht bestätigt
IAB1,Dua Lipa & BLACKPINK Drop Collab 'Kiss and Make Up' | Billboard News
IAB1,Logan Paul Finally Responds To Shane Dawson’s Documentary “The Mind Of Jake Paul”
IAB1,Cardi B Worried Nicki Minaj Will STILL Come After Her: Hires More Security
IAB1,Ariana Grande: Weg mit dem Markenzeichen
IAB1,Amy Winehouse biopic confirmed
IAB1,"Laura Anderson CONFIRMS new boyfriend, Max Morley"
IAB1,Charlize Theron Weighs In On Movies And Parenthood At The Golden Globes
IAB1,Jamie Lee Curtis is taking a break
IAB1,Alec Baldwin Imagines Interviewing Donald Trump on His Talk Show
IAB1,Simon Cowell wants more kids
IAB1,Prinz Harry: Keine Extra-Würste
IAB1,Biffy Clyro: Nick Knowles has been 'fast and loose' with the truth
IAB1,Kevin Spacey pulled over by police after court day
IAB1,Dossier Spécial: les stars les plus inspirantes de 2018
IAB1,Gloria Trevi
IAB1,Meghan Trainor trying to set Chloe Grace Moretz up with Harry Styles
IAB1,"Skrillex Remixes Travis Scott's ""Sicko Mode"" | Billboard News"
IAB1,'Project Runway' Taps Karlie Kloss as Its Host | THR News
IAB1,Lana Del Rey Ready To Fight Azealia Banks: Twitter Feud Explained
IAB1,Emily Blunt: Meryl Streep stalkt mich!
IAB1,10 Bizarre Things That Washed Up On Land
IAB1,10 Real Vigilantes Who Thought They Were Above The Law
IAB1,Justin Bieber Torn ApartAfter Marriage With Hailey Baldwin & Selena Gomez Breakdown
IAB1,Justin and Hailey Bieber delay wedding
IAB1,Avril Lavigne has no marriage regret
IAB1,Channing Tatum Dating a Pop Star?
IAB1,Wolfine Comes Back With &quot;Bella&quot;
IAB1,Emily Blunt 'completely shocked' to be first choice for Mary Poppins
IAB1,"Ariana Grande Performs 'Thank You, Next', Premieres New Music Video for 'Breathin' | Billboard News"
IAB1,ROBIN HOOD: Taron Egerton’s love triangle with Jamie Dornan
IAB1,Ariana Grande readies new album
IAB1,Nick Jonas and Priyanka Chopra kick off another honeymoon
IAB1,Gigi Hadid und Zayn Malik: Alles aus!
IAB1,5 Great Christmas Movies on Netflix Right Now
IAB1,Gwen Stefani Credits Pharrell Williams For Her Confidence
IAB1,CRY BABY Chris Pratt Feels ATTACKED By Star-Lord Hate After Avengers: Infinity War
IAB1,Meek Mill Tops Billboard 200 as 'Championships' Debuts at No. 1 | Billboard News
IAB1,Miley Cyrus 'hit on' Ariana Grande with emojis after Pete Davidson split
IAB1,Venom Cashes In 100 Mill Over The Weekend In China Alone
IAB1,Kim Kardashian West and Khloe Kardashian get psychic reading
IAB1,Khloe Kardashian | Draw My Life
IAB1,AirBnB für Musiker
IAB1,"Ross Lynch: 'Chilling Adventures of Sabrina' Cast Has ""A Lot of Admiration"" For Star Kiernan Shipka | In Studio"
IAB1,Top 10 Harry Potter Movie Moments REDUX
IAB1,"Lagerfeld, el gran ausente del desfile de Chanel"
IAB1,Zendaya | Draw My Life
IAB1,Ariana Grande Accuses Grammy Producers Of 'Stifling' Creativity
IAB1,Lil Xan Recording Mac Miller Tribute Album 'Be Safe' | Billboard News
IAB1,Katy Perry: Party zur Verlobung
IAB1,Dakota Johnson: Nicht schwanger
IAB1,Reykon Is Back With \&quot;Mala\&quot;
IAB1,TOP 10 des morts les plus DÉCHIRANTES dans DC Comics !
IAB1,"Alec Baldwin: ""I Could Have Been a Great Barbra Streisand Ex-Husband"""
IAB1,Nina Nesbitt talks about body positivity
IAB1,Reese Witherspoon is 'passionate' about successful women
IAB1,21 Savage Makes First Public Appearance Since Detainment by ICE on 'Good Morning America' | Billboard News
IAB1,John Mayer Headed on North American Tour | Billboard News
IAB1,Lori Loughlin Explains Why She Doesn’t Think 'Fuller House' Should End | In Studio
IAB1,"Cory Asbury Talks Touching Fan Stories Following ""Reckless Love"" at 2019 Grammy Awards | Billboard"
IAB1,Les films Roma et A Star is Born sont les grands gagnants des Critics' Choice Awards 2019
IAB1,Jennifer Aniston: le film Dumplin' a réveillé de mauvais souvenirs
IAB1,Fans SHOCKED After Selena Gomez Posts Picture Covered In BLOOD In New Post With Julia Michaels!
IAB1,Demi Lovato has 'turned her life around'
IAB1,Conor McGregor Looks For Comeback Fight
IAB1,Ariana Grande's engagement tip: Don't
IAB1,"Joel Dawson describes Emily Blunt as ""so lovely"""
IAB1,Courtney Act talks new E! show The Bi Life
IAB1,Melissa McCarthy: Richard E. Grant will never get rid of me
IAB1,Dakota Johnson's rep denies pregnancy
IAB1,"TOP 10 Leute, die UNGEWOLLT LIVE AUF TWITCH waren"
IAB1,Khloe Kardashian WILL NOT Marry Tristan Thompson Anytime Soon!
IAB1,"Patty Jenkins Talks 'Wonder Woman 3': ""It's Definitely a Contemporary Story""  | Sundance 2019"
IAB1,Harry Potter Star Cares More About Love Than Money
IAB1,Halsey Denies John Mayer Speculation
IAB1,New report claims Ed Sheeran may have secretly married
IAB1,Top 10 des MÉCHANTS d'ANIMÉS qui se sont fait DÉFONCER !
IAB1,"The Irwin Family Play ""Animal Yearbook"" | In Studio"
IAB1,Speedy Celeb Engagements
IAB1,Ariana Grande and Taylor Swift won’t attend the Grammy’s
IAB1,Sir Michael Caine: Success has strengthened my faith in God
IAB1,The Sun Military Awards: Red Carpet New Years Resolutions
IAB1,"Kacey Musgraves Recalls Childhood Camping Trips, Performing at a President's Inaugural Ball & More | Billboard"
IAB1,AMC to Hold Free Screenings of 'Black Panther' In Honor of Black History Month | Billboard News
IAB1,Miley Cyrus: Sorge um ihren Schatz Liam
IAB1,BTS' V Shows His Love for Cardi B at 2019 Grammys | Billboard News
IAB1,Jennifer Aniston and Courteney Cox's flight drama (ENGLISH)
IAB1,"Bye Skinny Jeans, Hello New Denim Trend"
IAB1,Ariana Grande Celebrates Top Three Spots On Billboard Hot 100
IAB1,Chris Pratt défend sa foi
IAB1,Shane Dawson & Jeffree Star REVEAL Secret New Project & The Internet LOSES It!
IAB1,Jordyn Woods Now Living With Her Mom As Kylie Jenner REACTS To Tristan Thompson Cheating Scandal! | DR
IAB1,A Bad Romance? Gaga Was ‘Gloomy’ Before Split!
IAB1,Lori Loughlin On Her 'Full House' Audition and the First Time She Met John Stamos | In Studio
IAB1,CBS All Access Hands Out Third-Season Renewal For 'Star Trek: Discovery' | THR News
IAB1,Fog city
IAB1,Demi Lovato Quitting Music
IAB1,"Jon Platt Talks Diversity in Music Industry, Importance of Music Modernization Act & More | Billboard"
IAB1,"A Florence, Cai Guo-Qiang célèbre à sa façon la Renaissance italienne"
IAB1,BTS' V Teases Clip of Self-Composed Song | Billboard News
IAB1,Gemma Whelan: Time is right for Game of Thrones to end
IAB1,Octavia Spencer Explains Why Adoption Stories Matter
IAB1,Klettern im größten Outdoorpark Europas
IAB1,Cara Delevingne: Jetzt auch Musik
IAB1,Las canciones de los 90’s que siguen siendo éxitos
IAB1,Zu Besuch beim Weihnachtsmann
IAB1,John Krasinski had best time with Blunt on set
IAB1,Jade Thirlwall reveals her favourite LMX product
IAB1,Madonna
IAB1,Keira Knightley: Mothers deserve more credit
IAB1,George Lucas praises Gloria Katz for her strong writing for female characters
IAB1,Zoey Deutch joins Zombieland 2
IAB1,Emma Watson
IAB1,"Taylor Swift Continues to Support Tennessee Democrats, Encourages Early Voting | Billboard News"
IAB1,Chris Hemsworth: Sohn im Krankenhaus
IAB1,Kim Kardashian ist nicht mehr unabhängig
IAB1,Taylor Swift Announces New Record Deal With Universal Music Group | Billboard News
IAB1,Box Office: 'Venom' and 'A Star Is Born' Shatter Columbus Day Records | THR News
IAB1,Saoirse Ronan to be in the 'Barbie' movie?
IAB1,"Ed Helms Calls Out Michael Scott of 'The Office' With ""Terrible Boss Story | Sundance 2019"
IAB1,"BTS Earn Third Pop Songs Chart Entry As Steve Aoki Collab ""Waste It On Me"" Debuts At No. 39 | Billboard News"
IAB1,Michael B Jordan is 'pretty sure' Sylvester Stallone will return to Rocky
IAB1,Conspiracy In Film | Captain America: The Winter Soldier
IAB1,Mike Myers: Austin Powers 4 is looking good
IAB1,Hugh Jackman always knew his wife was 'the one'
IAB1,"iKON Discuss Popularity of 'Goodbye Road,' New Music, Future Tour Plans & More | Billboard"
IAB1,Disney dévoile les premières images du film Le Roi Lion
IAB1,Judi Dench set for Cats movie
IAB1,You Should Know: Flora Cash | Billboard
IAB1,"Meek Mill Drops 'Championships,' First Album Since Jail Release | Billboard News"
IAB1,"Behind The Scenes Of The Hit ""Surrender"" With Cash Cash"
IAB1,Claire Foy to take acting break to focus on daughter
IAB1,Pippa Middleton has given birth!
IAB1,Calvin Harris Will Join Other Top Performers At Brit Awards
IAB1,First Photos From the Final Season of 'Game of Thrones' Are Here | THR News
IAB1,Zayn's Sophomore Album 'Icarus Falls' Will Arrive in Two Weeks | Billboard News
IAB1,"Mac Miller's Family to Host Benefit Concert Featuring Travis Scott, SZA & More | Billboard News"
IAB1,Les chevaux aussi se déguisent!
IAB1,Adam Levine répond aux rumeurs sur le Super Bowl
IAB1,Lady Gaga: Rede vergessen
IAB1,Liam Hemsworth et Miley Cyrus se sont mariés sur un coup de tête!
IAB1,La maison de Gerard Butler a entièrement brûlé dans les incendies de Californie
IAB1,"Thalía Talks Christmas Traditions, Favorite Foods, Mexican Phrases & More | Growing Up Latino"
IAB1,Paul McCartney forgets lyrics to biggest hits
IAB1,Lori Loughlin Talks Dedicated 'When Calls the Heart' Fanbase | In Studio
IAB1,Which Film Is Likely to Win Best Picture at the  2019 Oscars? | THR News
IAB1,Blac Chyna never asked Rob Kardashian and Tyga for child support
IAB1,Kylie Jenner’s Makeup Collab With Baby Stormi COMING SOON!
IAB1,Grosse chute en essayant... d'ouvrir une canette!
IAB1,Cardi B: Anzeige wegen Körperverletzung und rücksichtsloser Gefährdung
IAB1,BTS fanart tutorial
IAB1,Cardi B announces shock split from husband Offset
IAB1,Justin Bieber y Hailey Baldwin visitan la casa de Demi Lovato
IAB1,Kylie Jenner & Travis Scott MAKING Baby #2 Confirmed
IAB1,Chris Hemsworth Doesn't Want Jeff Bridges To Break His Heart
IAB1,Os melhores looks dos anos anteriores do Grammy Latino
IAB1,Garth Brooks Talks New Song 'Stronger Than Me' at 2018 CMA Awards | Billboard
IAB1,"Merry Christmas, Mr Lawrence: The True History"
IAB1,Gerard Butler's submarine prep
IAB1,"Cardi B Takes a Break From Instagram, Deactivates Account | Billboard News"
IAB1,Stephen A.Smith Says Rajon Rondo Called Him “ A Punk A** Reporter”
IAB1,Karlie Kloss replaces Heidi Klum on Project Runway
IAB1,Dwayne Johnson claims he rejected Oscars job
IAB1,Justin Timberlake faced expulsion
IAB1,Rockettes Free Performance: Christmas in August
IAB1,Idris Elba est l'homme le plus sexy de 2018!
IAB1,Kanye West Will Head to White House For Meeting With Trump and Jared Kushner | Billboard News
IAB1,"Fito Paez Talks Favorite Childhood Memories, Argentinian Foods & More | Growing Up Latino"
IAB1,Smooth Hound Smith
IAB1,Lil Uzi Vert: ENGLISH
IAB1,Britney Spears repousse la sortie de son prochain album
IAB1,Miley Cyrus and Shawn Mendes tease Dolly Parton Grammys tribute
IAB1,El playlist para acabar con las supersticiones del viernes 13
IAB1,2018 Billboard Live Music Awards: The Full List of Nominees | Billboard News
IAB1,How To Draw Ariana Grande (Stool Challenge)
IAB1,TOP 10 des personnages d’animés SUPER RICHES !
IAB1,Shawn Mendes | Draw My Life
IAB1,"Filmmakers Pen Open Letter Against Oscar Presentation Plan, Academy Defends Decision | THR News"
IAB1,Bradley Cooper Earns His First Entry on the Hot 100 With 'Shallow' | Billboard News
IAB1,Learn Wolfine\'s Guilty Pleasures
IAB1,John Cena joined Bumblebee to show off acting ability
IAB1,"Jamie Dornan: les sagas comme Cinquante Nuances de Grey, ce sera sans lui!"
IAB1,Olga Ortiz
IAB1,Hugo Weaving And His Personal Friendship With Peter Jackson
IAB1,Joe Jonas et Sophie Turner sont en Inde pour le mariage de Nick Jonas et Priyanka Chopra!
IAB1,Khloe Kardashian 'will stick by Tristan Thompson'
IAB1,Skye P. Marshall Has A Breakdown After Reading A Kids Story In 'Indivisible'
IAB1,Quote Of The Day: Solange Knowles
IAB1,The Evolution of Lady Gaga
IAB1,Aretha Franklin
IAB1,Noel Edmonds ate worms from his garden before I'm a Celeb.
IAB1,LeBron James and Vertigo Entertainment Team Up For 'Friday the 13th' Reboot | THR News
IAB1,Kanye West Makes Speech at Apple Store in Georgetown | Billboard News
IAB1,"Early Release! Billboard Hot 100 Top 10 October 27th, 2018 Countdown | Official "
IAB1,Katy Perry: Fan ausgestochen
IAB1,Liam Gallagher Belts It Out In New Gig
IAB1,Rosamund Pike felt 'inspired' by A Private War
IAB1,Old Dominion React to Winning Vocal Group of the Year at 2018 CMA Awards | Billboard
IAB1,Justin Quiles Captivates The World
IAB1,Ariana Grande Loves The Positive Feedback She Gets From Fans
IAB1,Ewan McGregor Set to Play Villain in Warner Bros.'s 'Birds of Prey' | THR News
IAB1,Die Blumenköchin
IAB1,Deutscher Orgelbau ist Weltkulturerbe
IAB1, Best Actress Oscar nominations set up hot competition
IAB1,Jaden Smith Gets The Robert Redford Award
IAB1,Beyonce 'dreams of winning an Academy Award'
IAB1,Serena Sends The Duchess Of Sussex Some Clothes
IAB1,Ballet Hispanico Keeps Flamenco Traditions Thriving
IAB1,Netflix to Produce Four Special Episodes of 'Queer Eye' in Japan | THR News
IAB1,Kim Kardashian West: Evakuierung nach Brand
IAB1,Adriana Lima And Boyfriend Call It Quits
IAB1,Congratulations To Chris Pratt And Katherine Schwarzenegger
IAB1,Golden Globes 2019: les plus beaux looks du tapis rouge
IAB1,Travis Scott ADMITS He Wants To MARRY Kylie Jenner In Latest Rolling Stones Interview!
IAB1,Cardi B READY To Reconcile With Offset According To Her Friends!
IAB1,CARDI B || Draw My Life
IAB1,Ariana Grande dévoile la tracklist de son nouvel album
IAB1,Reykon's &quot;Mala&quot; Is A Global Sensation
IAB1,Ariana Grande Announced Additional Sweetener World Tour Dates | Billboard News
IAB1,Lady Gaga calls for 'bold action' to help people suffering with mental health
IAB1,Ed Sheeran isn't married yet
IAB1,Kris Jenner: Enkel Nummer 10
IAB1,Celine Dion se produira lors du British Summer Time festival à Londres!
IAB1,"Martin Starr on ""Unique"" Experience of Growing Up in Hollywood in 'Honey Boy' | Sundance 2019"
IAB1,Madonna aurait pu être une Working Girl!
IAB1,"Justin Bieber Unveils 'Drew,' New Street Style Clothing Line | Billboard News"
IAB1,Cardi B UPSET With Offset For Not Helping With Baby Kulture!
IAB1,Bjorn Ulvaeus teases new ABBA album
IAB1,Geiger ohne Grenzen: Iskandar Widjaja
IAB1,Celebrity Shortlist: Top 3 Actors Who’ve Spoiled Their Own Movies
IAB1,Ariana Grande's Imagine single to focus on her 'failed relationships'
IAB1,Jamie Dornan Is A Very Attentive Husband
IAB1,Niall Horan | Draw My Life
IAB1,ABC Boss Karey Burke Reveals Why This Year's Oscars Will Be Different | THR News
IAB1,Serena Williams to present at the Oscars
IAB1,Justin Bieber was involved in 'every step' of his fashion line
IAB1,Blac Chyna Fuming At Soulja Boy After He Claimed They Never Dated
IAB1,Gigi Hadid's natural Reebok designs
IAB1,Emily Ratajkowski Has An 800 Dollar Skin Care Routine And It's Worth Every Penny
IAB1,Matthew Morrison Says Bickering Is Essential For Dancers
IAB1,2019 SAG Awards: The Most Memorable Moments | THR News
IAB1,Oscar Isaac In Talks For Dune Reboot
IAB1,James ‘Arg’ Argent wants to have a baby with Gemma Collins
IAB1,Selena Gomez TEARING Justin Bieber & Hailey Baldwin APART! Offset Fighting To Win Cardi B Back! | DR
IAB1,"Le football, ça n'est vraiment pas pour lui"
IAB1,'Roma' Breakout Star Yalitza Aparicio Wants to Meet Will Smith at the Oscars | Oscar Nominees Night 2019
IAB1,Katy Perry and Orlando Bloom get engaged
IAB1,Gisele Bundchen left Victoria's Secret to cover up
IAB1,Pink slashed husband's tyres
IAB1,Jada Pinkett Smith promotes self love
IAB1,Meerjungfrauen im Mittelmeer!
IAB1,Kim Kardashian klagt!
IAB1,Jung's Theory On What Alchemical Work Really Is About
IAB1,"Sterling K. Brown with Stand-In Miriam Grant: ""It's Family"" | Behind the Scenes"
IAB1,Penélope Cruz: Muttersein ändert alles
IAB1,Ellie Goulding Was Completely Addicted To Working Out
IAB1,Rita Ora 'understands' Girls controversy
IAB1,Top 10 Nicolas Cage Moments (Quickie)
IAB1,The Golden Globes Kick Off Awards Season in Confusing Fashion
IAB1,Vous prendrez bien un verre?
IAB1,Rebel Wilson joins Cats movie
IAB1,Alicia Keys
IAB1,Diddy devastated by Kim Porter's death
IAB1,Jennifer Lawrence gave Brie Larson Oscars advice
IAB1,"Little Mix and Nicki Minaj Collaborate on ""Woman Like Me"" | Billboard News"
IAB1,Ariana Grande Pregnant: Demi Lovato & Wilmer Valderrama’s Relationship Heats Up | DR
IAB1,"TOP 10 GELÖSCHTE SZENEN, die den GANZEN FILM verändert hätten"
IAB1,Saoirse Ronan hails 'exceptional' Reese Witherspoon
IAB1,"Maroon 5 & Cardi B's 'Girls Like You' Holds No. 1 Spot, Lil Wayne Makes History | Billboard News"
IAB1,"Cardi B, Nicki Minaj Booked for 7th Annual BET Experience Concerts | Billboard News"
IAB1,Ariana Grande
IAB1,Kim Kardashian and Kanye West expecting 4th child
IAB1,Netzwerkerin Tabassom Latifi: Hausmannskost per App
IAB1,Mary Mary on Honoring Aretha Franklin at 2018 AMAs | Billboard
IAB1,"Jim Carrey se sent prêt à faire de nouvelles rencontres, trois ans après le décès de son ex-compagne"
IAB1,Zoë Kravitz : pas facile de grandir dans l'ombre des petites amies de papa!
IAB1,Rob Lowe Opens Up About Attending Gwyneth Paltrow’s Wedding
IAB1,Justin Bieber podría llevar meses trabajando en un nuevo álbum
IAB1,Kendall Jenner stalks exes on Instagram
IAB1,10 Deadliest Dictators In History
IAB1,"Chris Hemsworth: Schauspielkarriere, Adé?"
IAB1,Juan Pablo Vega busca conquistar el mundo
IAB1,Liam Neeson 'cried' at Normal People script
IAB1,Khloe Kardashian 'hasn't decided' whether to leave Tristan Thompson
IAB1,Savez-vous faire sauter les crêpes?
IAB1,Jamie Lee Curtis says women have 'suffered forever'
IAB1,"Luke Combs Gives Emotional ""She Got the Best Of Me"" Performance at 2018 CMA Awards | Billboard News"
IAB1,Hommages innombrables à Stan Lee
IAB1,Disney Remaking 'Lilo & Stitch' as Live-Action Movie | THR News
IAB1,Why Actress Zoe Kazan Keeps Her Beauty Routine Low Maintenance
IAB1,Kris Jenner Forbids Rob Kardashian From Getting Back With Blac Chyna!
IAB1,Marvel's Avengers S.T.A.T.I.O.N experience is coming to London
IAB1,Christina Aguilera a perdu la voix!
IAB1,Chrissy Teigen Teases Kim Kardashian Over 'Bird Box' Watching
IAB1,Disney gaben Fans 'Der König der Löwen'-Vorgeschmack
IAB1,"Michael Chiklis: '1985' ""Brilliantly"" Showcases the Difficult Process of Coming Out | In Studio"
IAB1,Kunst aus der Vogelperspektive
IAB1,Mariah Carey se niega a escuchar villancicos antes del mes de diciembre
IAB1,Selena Gomez’s New Man REVEALED! Khloe Kardashian ADDICTED To Plastic Surgery! | MOTW
IAB1,Macaulay Culkin dishes on his 'normal' friendship with Michael Jackson
IAB1,Kim Kardashians Versicherung verklagt Pariser Bodyguard
IAB1,Kehlani Announces Pregnancy In the Most Adorable Way | Billboard News
IAB1,Khloe Kardashian 'undecided' about future with Tristan Thompson
IAB1,Zack Snyder Hails Ben Affleck 'Best Batman Ever'
IAB1,"Tamara Mellon on Meghan Markle Hysteria, Maintaining the Perfect the Closet  | Red Carpet Designers"
IAB1,Through The Years: Julia Roberts
IAB1,Nicole Kidman praises older actresses for 'paving the way'
IAB1,Le prince Harry a aidé Meghan à choisir la tiare de son mariage!
IAB1,Ben Affleck bricht sein Schweigen
IAB1,Nick Cannon's friends doubted he'd date Mariah Carey
IAB1,Top 10 des STARS SURPRISES par la VOIX de leurs FANS !
IAB1,Simon Cowell: Mehr Nachwuchs
IAB1,Top 10 des SCÈNES les plus FLIPPANTES de ÇA (2017) !
IAB1,Chris Pine's Wonder Woman return makes 'perfect sense'
IAB1,Hailey Baldwin 'watches movies and naps' to pamper herself
IAB1,Jake Gyllenhaal confirms Spider-Man role
IAB1,It Girl: Margot Robbie
IAB1,Benedict Cumberbatch is drawn to geniuses
IAB1,Katherine Langford joins Knives Out
