Category,Title
IAB3,Davos culmina con varios interrogantes a la globalización
IAB3,May Doesn't See Majority in Parliament for Second Referendum
IAB3,China Slaps Down Dolce & Gabbana in Fight Over Offensive Videos
IAB3,Making Sense of Global Equity Markets
IAB3,DJ Steve Aoki Debuts 'Neon Future' Comic Book
IAB3,Instagram May Have Been Key Tool in Russia's Manipulation of U.S. Voters
IAB3,Goldman's Currie Likes Long Gold as Favorite Commodity Play Right Now
IAB3,Wall Street Backs Paul Rabil's Lacrosse League
IAB3,Citi's Morse Says Bias Is to the Upside for Oil Prices
IAB3,How Could the Midterms Change Cannabis Laws?
IAB3,Amazon's HQ2 Is Still Wide Open?
IAB3,Wall Street Opens Lower Amid U.S. China Trade Deal Concerns
IAB3,How Tribeca Trade Group's CEO Is Trading the EEM
IAB3,EBay Set to Launch A 25% Off Sale
IAB3,"Phillips , Wiener on John Bogle's Legacy"
IAB3,Chinese Company Dalian Wanda Group Files For IPO In The US
IAB3,Tesla's VP Of Manufacturing Is Gone
IAB3,"'Game of Thrones' Final Season Secrets: Kit Harington's Tears, the Final Battle Scene"
IAB3,Don't Ignore Credit Cards With Annual Fees
IAB3,"Davos, Tria: ""Rispetteremo deficit anche con una crescita inferiore"""
IAB3,Cheddar Crystal Ball:  A Blockbuster Year for Tech IPOs Ahead in 2019
IAB3,"ECB Normalization Isn't Plausible, Panmure Gordon Says"
IAB3,Abu Dhabi Three-Way Merger to Create Gulf's Fifth-Biggest Lender
IAB3,"Markets to Get 'All Clear' After Retesting Lows, Wilson Says"
IAB3,Amazon's Future Is In Question After Jeff Bezos Announces Divorce
IAB3,Valerie Plame and Doug Liman Say Iraq War Lies Led to Trump-Era ‘Deception’ and ‘Gaslighting’
IAB3,PG&E's Fire Crisis Erases $12 Billion in Market Value
IAB3,Former Ambassador Fujisaki Weighs In on Japan-U.S. Trade Relations
IAB3,The Factors That Drove WTI Crude Into a Bear Market
IAB3,"U.S.-Canada Relations in 'Temporary Remission' But Will Come Back, Ex-PM Mulroney Says"
IAB3,Leveraged Loan Issuance Expected to Drop in 2019
IAB3,Brent Hits Three-Month High as Global Supply Gets Cut
IAB3,CEO of Cloud Software Company Anaplan on Stock's NYSE Debut
IAB3,"The Good, the Bad & the Ugly Commodity Trades for 2018"
IAB3,Yakult Yogurt Sells Out Because of Netflix’s ‘To All the Boys I’ve Loved Before’﻿
IAB3,Adecco CEO Alain Dehaze
IAB3,"Need to See Domestic Credit Flowing Again in China, Says Bocom's Hong"
IAB3,"Global Equities Poised to Do Well in 2019, Kiwoom Strategist Says"
IAB3,"There Is Value in the Market in China, Says UBS's Buehlmann"
IAB3,Más de 3.000 personas participarán en el Foro Económico Mundial de Davos en Suiza
IAB3,Deutsche Bank Is Said to Reduce 2018 Bonus Pool by About 10%
IAB3,"""Gilets jaunes"" : un ""impact sévère et continu"" pour l'économie"
IAB3,Vers une baisse de la production de pétrole
IAB3,"Market Wrap 10/29: Equities, Bonds"
IAB3,"DP World CEO Says Looking to Expand in Africa, Latin America"
IAB3,Malboro Eyes Juul
IAB3,What Amazon's Canceled HQ2 Deal Means for New York's Tech Scene
IAB3,U.S. Homebuilders Face Bear Market Amid Rising Interest Rates
IAB3,"Powell, Trump Discuss Economic Outlook at White House Dinner"
IAB3,Wall Street Is Flat But Industrial Stocks Are Down
IAB3,Amazon Changes Its Holiday Game Plan
IAB3,T-Mobile to Release Free Mobile TV Service in Upcoming Weeks: Source
IAB3,Logitech CEO Says Trade War Might Lead to Higher Prices
IAB3,BNP Paribas Pension Fund Ban
IAB3,Ethanol Producer Wants New Pricing Method
IAB3,"Market Lacks Bear Market Recession Forecasting Element, Kotok Says"
IAB3,Uncertainty Reigns on Wall Street for 2019
IAB3,"Bakhshian, Bennenbroek on Euro-Zone PMI, Outlook"
IAB3,Greenspan Says Nobody Forecast the 2008 Financial Crisis
IAB3,"Expect More Disappointments in U.S. Earnings, Says Wells Capital Management's Patel"
IAB3,Why the Knicks Probably Aren't for Sale
IAB3,Lyft Set For IPO
IAB3,"Tilray's Novartis Partnership Is Encouraging, Analyst Azer Says"
IAB3,Ikea Store In Italy Gives Homeless Dogs Place to Rest
IAB3,Why Brexit Is Only Partly to Blame for London's Housing Woes
IAB3,Stocks Are Up Around The World
IAB3,SpaceX Set To Layoff 10 Percent Of Workforce
IAB3,Oceanic Partners CEO Expects Lyft IPO Valuation in Low-to-Mid $20B Range
IAB3,American Manufacturers Are Seriously Worried
IAB3,"Siemens-Alstom Probe Outcome 'Not a Given,' EU's Vestager Says"
IAB3,"Oil Prices to Remain Under Pressure, Says Panmure Gordon's French"
IAB3,How Agora Financial's Knuckman Is Trading Morgan Stanley
IAB3,Blockchain Announces $125 Million 'Airdrop' of Stellar Tokens
IAB3,EU Tells London: Financiers Are On Their Own Without A Brexit Deal
IAB3,Disney Executive Says Fox Deal Is Finally Nearing Completion
IAB3,Draghi Says Inflation Will Continue Convergence After Buying Ends
IAB3,"Markets Are Showing a General Lack of Confidence, Says Aberdeen's Ritchie"
IAB3,Uber Unveils New Rewards Program
IAB3,Italy’s Conte Rules Out Budget Adjustment as Recession Looms
IAB3,The Phluid Project Clothing Store Is Completely Gender-Free
IAB3,Asia Stocks Hit 5-Week High
IAB3,Netflix's Lowest Close
IAB3,Nasdaq Posting Worst Monthly Decline in a Decade
IAB3,TD Ameritrade CEO Is Confident It Can Score Millennial Customers
IAB3,"Investors Need to Get Used to More Volatility in 2019, Says UBS' Themistocleous"
IAB3,Oil Has First Yearly Drop Since 2015
IAB3,Nissan Charged In EX-CEO Scam
IAB3,Thiam Says Credit Suisse Trading Unit Did `Good Job' Considering Challenges
IAB3,Amazon Is Offering Gift Cards Due To Data Breach
IAB3,Stocks Surge After Fed Says No Change To Interest Rates
IAB3,"The Dollar Chases Expectations About the Fed, Says AXA Investment's Tinker"
IAB3,Rising Fears Pull Down Wall Street
IAB3,Stocks Sink On Fed News
IAB3,"German Carmakers Strengthen the U.S. Economy, Says Mattes"
IAB3,GM Slashes Its Workforce
IAB3,Bad 2018 Extends Into 2019 For Stocks
IAB3,Gift An Audible Gift Subscription For Your Favorite Reader
IAB3,Nintendo Store Opening in Japan
IAB3,U.S. Labor Market Tightening
IAB3,"Trump Must Maintain Brand and Remain Authentic, Says Raj Shah"
IAB3,"Market Selloff and Recovery Are All About the Fed, Dwyer Says"
IAB3,Rabil Says Patience Probably Puts Fed on Hold Through End of the Year
IAB3,BMW May Face Criminal Charges For Handling Of Engine Fires
IAB3,Carlos Ghosn Could Get Over $5 Million From Renault
IAB3,BNP Says a `Harsh Brexit' May Derail Monetary-Policy Normalization
IAB3,'Fortnite' Gaming CEO Now Worth $7 Billion
IAB3,Stocks Fall After Interest Rate Forecast From Federal Reserve
IAB3,Apple Analyst Sees China Tariffs as 'Most Significant Risk'
IAB3,Animal Charities Concerned About Tesla's New 'Dog Mode' Feature
IAB3,A US Senator Demands That Apple and Google Remove An App
IAB3,Snapchat Founder Evan Spiegel Loves Fast-Food Chain Nando's
IAB3,El pulso comercial con Pekín llega a la Feria de electrónica de Las Vegas
IAB3,Stocks Can't Stop Sliding
IAB3,Male Deoderants Aren't Actually Better
IAB3,U.S. Gov't Shutdown Puts National Websites at Risk
IAB3,Oil Prices Jump 3 Percent After US Inventories Fall
IAB3,Fed Frustrates Global Markets
IAB3,Bloomberg Market Wrap 12/10: Volatility and Treasury Yields
IAB3,Apple Stock Sinks On Soft iPhone Sales
IAB3,Corbyn Proposes Motion of No Confidence in May's Government
IAB3,"China's Potential Growth Is Slowing, Says Berenberg Capital's Levy"
IAB3,Zoe Financial CEO Sees More Earnings Pain to Come
IAB3,"Dieselgate, emissioni: FCA paga multe per 305 miliardi di dollari"
IAB3,Paulsen Says Government Shutdown Won't Be a Big Deal
IAB3,Tesla's China Sales Down 70% In October
IAB3,Taco Bell Says Goodbye To Its Dollar Menu
IAB3,The Innovations That Will Drive Smartphone Sales in 2019
IAB3,"May Is Right to Try to Improve Brexit Deal, U.K.'s Fallon Says"
IAB3,Olivia Wilde Is Hitting the Campaign Trail for Her Mom
IAB3,China Said to Offer Path to Eliminate U.S. Trade Imbalance
IAB3,Investec's Stopford Says Turkish Bonds in Short-Term 'Attractive'
IAB3,Democrats Capture House Control as Republicans Hold Senate
IAB3,"Bloomberg Market Wrap 2/6: SOX, GM Debt and Safe Haven Assets"
IAB3,FAO Schwarz Is Coming Back
IAB3,Jeff Bezos Claims National Enquirer Tried to Extort Him
IAB3,Canada's Carr Says Going Through 'Tough Patch' With China
IAB3,"Croissance, UE, populisme : revivez le troisième jour à #Davos2019"
IAB3,"BOE's Carney on Brexit Risks, U.K. Economy, Inflation: Statement"
IAB3,Severstal's Mordashov Likens Sanctions to Preparing for Natural Disaster
IAB3,Shopify Says Day 1 Demand for Cannabis in Canada Outpacing Estimates
IAB3,Bunge's Latest Profit Warning Shows Toll of U.S.-China Trade War
IAB3,Davos : le Brexit au coeur des discussions
IAB3,Goldman Sachs Misses 4Q FICC Trading Revenue Estimates
IAB3,U.S. Urging Allies to Avoid Equipment From Huawei: WSJ
IAB3,Oil Climbs Higher on Shrinking U.S. Inventories
IAB3,Hedge Funds Take Aim at European Telecoms
IAB3,Campbell's Soup Shares Jump 4%
IAB3,"Spain's Economy Growing 'Quite Significantly,' Calvino Says"
IAB3,Starbucks Partnering Up With Ubereats For Delivery Service
IAB3,BOE's Carney Says Jail for Bankers a 'Total Bluff'
IAB3,Irish PM Says Brexit 'Is a Problem Caused by Britain'
IAB3,Royal London's Greetham Sees a Risk-On Tone for Markets in 1H
IAB3,"Amazon Brings Balance to 'Overbuilt' NYC, Thor Equities' Sitt Says"
IAB3,"Milesi-Ferreti: ""El Brexit traerá peores consecuencias a largo plazo para la economía británica"""
IAB3,"Trade Shaved 10% Off U.S. Equities in 2018, BlackRock's Boivin Says"
IAB3,Oil Slips as Post-Christmas Rally Fades
IAB3,"Equities Are in `Wait and See' Mode, Aberdeen Says"
IAB3,GE: What Went Wrong and What Happens Next?
IAB3,"Getting Better Momentum in H-Shares and HSI, Says Chart Partners's Schroeder"
IAB3,Stocks Upended After Fed Increases Interest Rate
IAB3,Alibaba's Jack Ma Sees Singles' Day Record on Way to Retirement
IAB3,Why Google Wants Narrower Protection for Activist Workers
IAB3,Entrepreneurs Like Arianna Huffington Are Threading a Needle on Saudi Investments
IAB3,The Enterprise Future for Voice-Activated AI
IAB3,Yellow Vest Protests in France Send Shoppers Online
IAB3,Ford to Cut Thousands of European Jobs
IAB3,India's Interim Budget: What Investors Will Be Watching
IAB3,"U.S. Inflation Pressures Are Going to Surprise, Plurimi CIO Says"
IAB3,Viacom Sees Very Good Earnings
IAB3,Chinese Airlines' Lunar New Year Demand Could Be a Letdown.
IAB3,#LikeAGirl's Lauren Greenfield Starts Production Company for Women Directors
IAB3,"U.S. Adds 134,000 Jobs in September, Jobless Rate at 48-Year Low"
IAB3,Apollo's Black Warns of 'Bubble Status' in Credit Markets
IAB3,"Sell Europe Buy U.S. Theme Will Be Here for Longer, Says BMO's Gallo"
IAB3,Carlos Ghosn Quits As Renault CEO
IAB3,Sterling Rises to Nearly Two Month High
IAB3,What Crypto Exchange Founder's Death Illustrates About Bitcoin
IAB3,Deutsche Bank Said to Prep for Potential Merger by Mid-Year
IAB3,Conte Says Debt Is ‘Not Scary’ as Italy Races to Pass Budget Law
IAB3,NBCUniversal to Launch Streaming Service In 2020
IAB3,FAANG Stocks Drag On S&P And Nasdaq
IAB3,Apple's Awful Week Continues With New iPhone Cut
IAB3,Inside Chipotle's Turnaround Strategy
IAB3,Under Armour CEO on Signing Top Athletes
IAB3,Amazon Still on Buy List for Synovus Trust
IAB3,Tesla Is Ending Its Popular Referral Program
IAB3,Bloomberg Intelligence 2019  Auto Industry Outlook
IAB3,Comcast Has Movie-Aided Strong Earnings
IAB3,UBS at Early Stage of Succession Planning
IAB3,How Tech Is Changing Philanthropy at the Gates Foundation
IAB3,"JPM's Santos: Stark Economic Difference Between Investment, Consumers"
IAB3,ETF Flow Volatility Rises in Oct. as Risk Assets Under Pressure
IAB3,MSCI’s World Stock Index Sags As Oil Prices Fall
IAB3,Papa John's Hopeful With New Deal
IAB3,Would You Like Some Rubber Chicken Nuggets
IAB3,"Dollar Is Still the Best of a Bad Bunch, Says HSBC's Bloom"
IAB3,Lyft's New Hire Shows The Company Is Expanding Beyond Cars
IAB3,26 super-ricchi possiedono la ricchezza di metà dei poveri del pianeta
IAB3,"Klarna Courts U.S. Customers with Flashy Ads, New Shareholder Snoop"
IAB3,Why Goldman Sachs Is Set to Lead M&A in 2018
IAB3,"ECB's Draghi on Rates, Inflation, `Downside' Risks: Opening Statement"
IAB3,Tim Cook On iPhone Sales: We Need To Talk About Facebook
IAB3,World Stocks Have Best January Ever
IAB3,McDonald's Overseas Strength Helps Counter U.S. Sales Poor Growth
IAB3,BI Predicts 2019: Asia's Tech Giants
IAB3,A Royal Caribbean Passenger Banned For Jumping Off Ship
IAB3,"Goldman Must Bear Responsibility in 1MDB Scandal, Malaysia's Ibrahim Says"
IAB3,Fable Shifts from Virtual Reality to 'Virtual Beings'
IAB3,Equity Markets Trade Lower Around World
IAB3,EU Considers Proposals to Exclude Chinese Firms From 5G Networks
IAB3,Government Shutdown Triggers Extension For US Farmers Requiring Aid
IAB3,SocGen CEO Says Prop Trading Unit Is Under Review Amid Cuts
IAB3,NEC's Kudlow Calls U.S. 'Hottest Economy in the World'
IAB3,One Of AMD's Biggest Shareholders Just Unloaded Stock
IAB3,Trump's Trade War With China Could Mean More Pain for Tech
IAB3,"EY CEO Weinberger on Immigration, Tariffs, Hiring"
IAB3,Is Toys “R” Us Back?
IAB3,Allianz X Boosts Size of Tech Investment Fund
IAB3,Trade Uncertainty Trumps the Fed for Janis Henderson's Maris
IAB3,"GM Says 2018 Earnings To Top Prior Forecast, Shares Jump 7 Percent"
IAB3,"Italia, en recesión técnica"
IAB3,"Airbus to `Ramp Up' Other Products After Axing A380, Faury Says"
IAB3,"We Remain Constructive on Emerging Markets, Says JPMorgan’s Tsang"
IAB3,"EU's Barnier Seeks U.K. Brexit Clarity, Won’t Re-Open Agreement"
IAB3,Amazon Scraps HQ 2 Plans On Long Island
IAB3,Cardiologist Says FDA Is 'Late to the Show' on Teen Vaping Crisis
IAB3,"We've Seen the Best of Global Growth, Says HSBC's Henry"
IAB3,Exclusive With Chevron CEO: Big Oil Cost Revolution
IAB3,Protestas contra la 'hipocresía' de Davos
IAB3,"OPEC Output Dropped By 800,000 Barrels A Day In January"
IAB3,YouTube Trying to Stop Dislike Mobs
IAB3,RBNZ Leaves Key Rates on Hold
IAB3,Will Instagram Have Direct Messages On Webpage?
IAB3,Delta Is Having A Monthly Sale
IAB3,Who Benefits and Who Loses From Amazon's Decision to Pull Out of NYC
IAB3,AT&T 5G Rolls Out In New U.S. Cities
IAB3,SurveyMonkey CEO Zander Lurie Sees Plenty of 'Green Field' to Compete in 'Massive'  Market
IAB3,Trade Uncertainty Trumps the Fed for Janus Henderson's Maris
IAB3,Moelis CEO Sees a Potential 70% U.S. Tax Rate as 'Disastrous'
IAB3,The War Between Active and Passive Investing
IAB3,Apple To Reopen Iconic Glass Cube In New York
IAB3,Yahoo Finance Launches On Apple TV
IAB3,Why Jeff Bezos Is Trump Era's Biggest Winner
IAB3,Stephen Curry on the Value of Twitter: 'It's About Showing Who You Are'
IAB3,"BlackRock `Neutral' on Spain, Says Election Poses `Temporary' Risk"
IAB3,Warren to Propose Universal Child Care Plan
IAB3,Apple iPhone Shipments to China Plummet
IAB3,Apple Takes Away Key License From Facebook
IAB3,"Move Out of U.S. Assets and Rotate Overseas, Morgan Stanley Says"
IAB3,Ares Management CEO Arougheti on Private Markets and Concerns for 2019
IAB3,Hyundai Has First Loss In 8 Years
IAB3,Super League Gaming CEO says NASDAQ Debut Is 'a Long Game' for the Company
IAB3,Discovery CFO Says He's 'Very Confident' About Prospects for 2019
IAB3,U.S. Housing Hits Lowest Since 2017
IAB3,"ThirdLove's CEO Says Strength Is in Digital Model, but Doesn't Rule Out Brick-and-Mortar"
IAB3,Home Depot Drops After Earnings Miss
IAB3,"Amazon Now Sells Its Own Super Affordable, Bed-In-A-Box Mattress"
IAB3,AngloGold Ashanti CEO Discusses M&A Possibilities
IAB3,Musk Faces U.S. SEC Contempt Claim Over Two Tweets
IAB3,"5G Will Change Form Factors, Qualcomm President Amon Says"
IAB3,S&P's Three Day Rally May Come To End
IAB3,"Fed's Powell Says U.S. Economy Is in a 'Good Place,' Can Grow Faster"
IAB3,"Stocks Decline With Bonds, Yen To Rally"
IAB3,The Dow Rallies More Than 350 Points
IAB3,"Ball Remains in China's Court, Says Milken's Chin"
IAB3,Dow Jones Makes Gains While S&P And Nasdaq Retreat
IAB3,UBS Thinks Lowe's Can Turn Things Around
IAB3,SoftBank IPO Banks Said to Commit to $9 Billion Vision Fund Loan
IAB3,"PayPal Profit Beats Estimates, an Encouraging Sign for Venmo"
IAB3,Etsy Is Growing Its Ecommerce Presence By Focusing On Diversity
IAB3,Chipmakers Rally Following US And China Trade Talks
IAB3,Bespoke Fund 'WOMN' Invests in Women's Empowerment
IAB3,US Stocks Stage Rally Day After Christmas
IAB3,"Portugal Finance Minister on Euro-Area Slowdown, Brexit, EU Banking Union"
IAB3,Tech Stocks Hammer Nasdaq And S&P
IAB3,Breaking Down UBS' 3Q Earnings
IAB3,Oil Retreats From Short-Lived Iran Sanctions Spike
IAB3,BlackRock Miss Profit Mark
IAB3,Wyndham CEO Says Vacation Occupancies 'Extremely Strong'
IAB3,Budget : Rome persiste et signe
IAB3,Amazon To Hire Less Season Staff
IAB3,"Draghi on Weaker Data, Inflation, Risks: Opening Statement"
IAB3,Gloomy Economic Forecast Dampens Wall Street Rally
IAB3,Umicore Shares Tumble on 2019 Growth Warning
IAB3,"China Equities Are Cheap, State Street CIO Says"
IAB3,Nomura Doesn't See U.S. Recession Until 2020 or Beyond
IAB3,Sears Declares Bankruptcy
IAB3,"Fed’s Next Move Will Be a Cut, Says Bianco Research’s President"
IAB3,Los fabricantes de automóviles alertan contra el brexit
IAB3,"SocGen Says It's Prepared to Move 300 Staff to Paris, Post Brexit"
IAB3,Facebook Launches Standalone Video App
IAB3,"Trade Tensions Will Have Temporary Impact on China Tourism, Ctrip's Liang Says"
IAB3,Ford Canada CEO Says Firm Has No Plans For GM-Style Auto Plant Shutdown
IAB3,Choyleva Says U.S.-China Trade War Is Morphing Into Tech War
IAB3,"Art Hogan on Markets Post Earnings Season, Trade"
IAB3,Breaking Down Tesla's Money-Making Third Quarter
IAB3,BMW Agrees to Pay $4.1B to Raise Brilliance China Stake
IAB3,Emerging-Market ETFs See a Feeding Frenzy as the Fed Turns Dovish
IAB3,Greenspan Says U.S. Is Losing Its `Creative Destruction' Edge
IAB3,Nissan Falls After CEO Arrested
IAB3,"Maersk CEO on Rising Freight Rates, Profit Forecast, Divestments"
IAB3,"Corteva Will Be a Growth Company, Future CEO Collins Says"
IAB3,Australia Toes the Line Between Washington and Beijing
IAB3,Trump's Economic Stimulus Is Fading
IAB3,Oil Jumps Most Since June
IAB3,Cargill CEO Says 'Not a Good Moment' for Agriculture Economy
IAB3,"Instagram a 'Beast' for Facebook, BTIG's Greenfield Says"
IAB3,Fidelity's No-Fee Funds Unleash the Power of Free
IAB3,"Bitcoin Scalability to Power Next Bull Run, Pantera's Krug Says"
IAB3,"Fed's 'Mixed Message,' Trump and Brexit to Blame for Selloff, Peter Tchir Says"
IAB3,Credit Suisse's Golub Says He'd 'Absolutely' Buy the Dip in U.S. Stocks
IAB3,Venezuela's Refinery Woes Send Fuel Imports Soaring
IAB3,Janus Henderson Says Stay Away From Europe
IAB3,U.S. December Retail Sales Suffer Biggest Drop in Nine Years
IAB3,"Hard to Call End of Business Cycle Anytime Soon, Kantor Says"
IAB3,Why Goldman Alumni Still Think They Can Fix Wall Street With Crypto
IAB3,Altria Shares Jump on Reports of Juul Stake Interest
IAB3,"This Company Wants to Pay You $60,000 to Spend 6 Months ‘Living Your Best Life’"
IAB3,Brown Says More Pressure on China Than U.S. for Trade Talks
IAB3,"Tencent Starting to Crack the Code on Music Streaming, Lead Edge's Green Says"
IAB3,US Stocks Are Trading Up Over Trade Optimism
IAB3,"Starwood's Sternlicht on Rising Rates, Europe, Expansion"
IAB3,À la rencontre du musicien qui anime les soirées de Davos
IAB3,Qualtrics CEO Ryan Smith on SAP Deal: 'It's Literally a Match Made in Heaven'
IAB3,"Mizuho's MiFID Plans Include Flight Attendants, TV Producers"
IAB3,"Sentiment Remains Very Poor in Chinese Markets, Says SocGen's Benzimra"
IAB3,Tech Stocks Trip Wall Street
IAB3,"Apple Selloff a 'Buying Window' for Investors, Loup's Munster Says"
IAB3,Ford And Walmart Teaming Up
IAB3,Jeff Bezos Reports Amazon Sold More Echo Dot's Than Anything Else In 2018
IAB3,"MARKET MELTDOWN: Global Markets Reel, But Dow Turns Positive"
IAB3,SoftBank Telco Unit IPO to Make History
IAB3,"Microsoft, Google Back Paris Cyber Pledge on Hacks"
IAB3,"""Black Friday"" : une frénésie d'achats aussi en Europe"
IAB3,"Barclays Sees Years of Complex, Confrontational Trade for U.S., China"
IAB3,Amazon Lost $250 Billion In Value
IAB3,China Will Stop U.S. Car Tariffs
IAB3,"GM CFO on 3Q Beat, $1 Billion Commodities Headwind"
IAB3,Brexit Committee Chair Says U.K. Should Join European Economic Area
IAB3,Washington Crossing's Caron Sees Market Selloff as a Buying Opportunity
IAB3,Dollar Nears Weekly High
IAB3,May Defends Brexit Deal Amid Jeers in Parliament
IAB3,RBC's Calvasina Is 'Not Breathing Easy' in Markets
IAB3,Why Goldman Sachs Is Set to Lead M&A in 2019
IAB3,PGIM's Tipp Sees Potential for 'Very Good' Credit Cycle
IAB3,"China's Pain to Spread Through EM, Warns BNY Mellon's Young"
IAB3,RBC Europe Says Selloff Just an Overdue Correction
IAB3,Amazon Finds New Consumer Base
IAB3,Glencore Said to Plan to Cap Coal Output in Climate Shift
IAB3,Sen Sees `Substantial' Oil Price Rally If More Clarity on Trade
IAB3,Sock Company Replaces Lost Socks for Free
IAB3,Saudi Investment Conference Brings In $50 Billion
IAB3,"Francia: l'impatto economico a seguito delle proteste dei ""gilet gialli"""
IAB3,Lyft Removes Split Pay Options
IAB3,Three U.K. MPs Resign From Conservative Party
IAB3,May Delays Brexit Vote to Avoid Huge Defeat
IAB3,DoSomething.org Wants to Make Voting Cool Again
IAB3,How Declining Oil Prices Are Impacting the Credit Market
IAB3,Asia y Europa apuestan por el multilateralismo frente al Brexit
IAB3,Dow Plunges Over 700 Points as Investors Flee Tech
IAB3,Microsoft CEO Nadella Says He Backs National Privacy Law
IAB3,New VVW Passat Unveiled At Detroit Auto Show
IAB3,"Markets Give U.S. Most to Gain in China Trade Truce, UBS's Donovan Says"
IAB3,How Does Italian Sovereign Risk Impact the Nation's Banks?
IAB3,China's Stock Rally Fizzles Despite More Support
IAB3,Londres pacta con Bruselas el papel de la City tras el brexit
IAB3,Why Cadillac Edged Tesla In Consumer Reports' Semi-Automated Driving Test
IAB3,Low Job Claim= Strong Labor Market
IAB3,You Could Be Wasting Money Every Day Doing These Surprising Things
IAB3,Wall Street Up On Excellent Earnings News
IAB3,Elliott Takes Stake in Pernod Ricard
IAB3,Eagle Point Founder Makes the Case for CLOs
IAB3,"Madoff Was a Sociopath Who Wouldn't Succeed Today, SIPC CEO Says"
IAB3,"Toyota's van Zyl on USMCA Deal, Brexit, Electric Vehicles"
IAB3,Watch 'Eighth Grade' On Amazon Prime
IAB3,"Ferrari Has Strong Earnings, Still Slips"
IAB3,"Tesla To Lay Off 3,000 Employees"
IAB3,"Turkey in Much Better Position After Khashoggi Death, Ian Bremmer Says"
IAB3,Wagner Sees Recession Triggering Marketwide Distressed Debt Opportunity
IAB3,"Bezos, National Enquirer Story Raises Cybersecurity Questions"
IAB3,Kroszner Says Fed Likely to Pause After December Hike
IAB3,Medtronic Unit Owns Up To DOJ's Corruption Charges
IAB3,Guggenheim's Minerd Says Credit Markets Are 'Overloaded'
IAB3,Apple Slides Below $200
IAB3,"Bardin Hill CEO on Firm's Evolution, Casino Short"
IAB3,Steph Curry Bets on Toronto Startup SnapTravel
IAB3,"Switch to an Underweight Position in U.S. Equities, Says Saxo Bank's Creagh"
IAB3,Mario Gabelli on New Book 'Merger Masters: Tales of Arbitrage'
IAB3,"Trump Could Have Subtle Effects on Fed Policy, Stanley Fischer Says"
IAB3,How Is Trader Joe's So Cheap?
IAB3,U.S. Oct. Consumer Prices Offer Mixed Signals on Inflation
IAB3,Tesla Posts Profit For Third Quarter Of 2018
IAB3,Bank of Singapore CIO Says 'Bad Tone' Crept Into Trade Conversation
IAB3,Dillow Says Lack of Liquidity Creates Investment Opportunities
IAB3,China's Financial Institutions Outlook
IAB3,Economist Choyleva Warns of the Start of a Digital Cold War
IAB3,PBOC to Offer More Funds to Private Companies
IAB3,Fed's Powell Says Longer-Term Fiscal Path Isn't Sustainable
IAB3,Top Three Wall Street Markets Are Down On The Year
IAB3,India Vows Liquidity Support to IL&FS
IAB3,Elon Musk On Tesla Updates
IAB3,Budweiser May Spend Over $50 Million On Super Bowl Commercialis
IAB3,"Brexit Prompts a Cautious Approach to Lending, Zopa CEO Says"
IAB3,"1MDB Poses Reputational Risk to Goldman, Livermore's Neuhauser Says"
IAB3,Elon Musk Speaks Of His Time On Trump's White House Council
IAB3,"SEC Commissioner Stein on Corporate Earnings Reports, Crypto Fund Proposals"
IAB3,Gender Diversity ETF Brings Principle to Your Portfolio
IAB3,"Alphabet Will Be Successful for a 'Number of Quarters,' CFRA's Kessler Says"
IAB3,Out Sick? Let Siri Do Your Tedious Rescheduling For You
IAB3,"McElligott, Murphy on Possible Drivers for U.S. Equities"
IAB3,Bezos and Trump Proxy War Intensifies
IAB3,"How Google Aims to Take on iPhone, Amazon Echo"
IAB3,How To Get Your Boss To Notice You
IAB3,Taking a Tactical Approach to the 2019 Muni Market
IAB3,Disney Could Vanish From Verizon FiOS
IAB3,Sen. Kamala Harris' Acknowledgement of Pot Use Is 'Huge Step': Cannabis Advocate
IAB3,What Warren Buffett Had to Say About Apple and Kraft Heinz
IAB3,"BOK Likely to Move in November, Says Credit Agricole's Kowalczyk"
IAB3,The Free Self-Driving Ride-Hailing Service
IAB3,WeWork CEO Draws Concern From Investors Over Potential Conflict Of Interest
IAB3,"Renault-Nissan-Mitsubishi to partner with Waymo on self-driving cars, report says"
IAB3,Delta Says It's Planning To Offer Free WiFi On All Flights
IAB3,Nissan Deals Brexit Blow as May Starts Work on Plan B
IAB3,Tesla's New Shanghai Factory Will Produce Two Models
IAB3,"FPA's Atteberry: Investors Should Think Long Term, Avoid Shutdown Noise"
IAB3,IEA's Birol Says Full Impact of Shale Hasn't Yet Been Seen
