Category,Title
IAB3,China Aims to Stimulate Car Sales
IAB3,Signs A Job Offer Is Too Good To Be True
IAB3,Fitch's Asia-Pacific Sector Outlook for 2019
IAB3,"Shell Is Committed to $25B Buybacks By 2020, Says CFO"
IAB3,McEwen Says Gold Market Confidence Is Coming Back
IAB3,Wall Street Dips Down 1 Percent
IAB3,Alinma Bank CEO Sees Mergers in Banks Continuing in Saudi Arabia
IAB3,Trump Says All Three Countries to 'Benefit Greatly' From USMCA
IAB3,Pimco Says Bar for a Fed Hike Is `Somewhat High'
IAB3,Mester Says There's No Need to Reconsider Fed Balance Sheet Runoff
IAB3,"SocGen CEO Oudea on Cost Cuts, 2019 Outlook, Disposals"
IAB3,Tilray Is Gaining Ground After Announcing Plans To Acquire Marijuana Cultivator
IAB3,Arconic Announces Plans to Split Into Two Companies
IAB3,Barrick CEO Expects Costs to Rise This Year From Pre-Merger Levels
IAB3,Mattel Soars After 4Q Results Beat Estimates
IAB3,"Amazon Acted Like a 'Petulant Child' in HQ2 Decision, NY State Senator Gianaris Says"
IAB3,What's Next for Trump If Mueller's Report Isn't Made Public?
IAB3,How DHgate.com Is Shaking Up China's E-Commerce Sector
IAB3,General Electric Sees Strong Profit
IAB3,Looking Back at CES 2019: Dreadful Yet Delightful
IAB3,How Salesforce Is Growing Its EMEA Business
IAB3,Live: First Results Come In on East Coast
IAB3,New Spider Man Themed Jordans to be Released
IAB3,Why Apple's Tim Cook Is Slamming Silicon Valley Rivals Over Use of Data
IAB3,"Fatherhood, Elon Musk, and Some Earbuds Made Ray J a Brand New Man"
IAB3,Dollar General Has Become One Of The Biggest US Retailers
IAB3,Zingales Sees 20% Chance of Italy Leaving Euro in Five Years
IAB3,"U.S. Adds 155,000 Jobs in November, Jobless Rate Holds Steady at 3.7%"
IAB3,From Buffy to Betty Crocker: Sarah Michelle Gellar Launches Baking Start-Up
IAB3,"NFL Head Coach Opportunities Narrow for African Americans, Huyghue Says"
IAB3,BofA's Moynihan Ramps Up Investment Bank
IAB3,"Powell's Fed Messaging Is 'Pathetic,' Economist Lee Says"
IAB3,Soybeans Rebound as Heavy Rain Dampens U.S. Yields
IAB3,Chinese Stocks Have Best Day In Years
IAB3,BlackRock Is Making Big Moves
IAB3,Starbucks Indonesia Launching Pink Drinks for Breast Cancer Awareness Month
IAB3,Brexit : Trump craint pour le commerce avec les Etats-Unis
IAB3,The British Royal Family Is Looking for a New Sous Chef at Buckingham Palace
IAB3,How the Midterm Election Can Impact Health Care
IAB3,El-Erian Says the Fed Isn't Likely to Pause on Rate Hikes
IAB3,"U.S. Debt Ceiling Is a Risk, Says Fitch's McCormack"
IAB3,"Tech and Retail Stocks Plunge, Erasing Market Gains in 2018"
IAB3,Deutsche Bank Questions Multiply as Raid Extends to a Second Day
IAB3,Cumberland's Kotok Sees a Need to Expand Uncertainty Premium
IAB3,"Oil to Push Towards $95 in Mid-2019, Morgan Stanley's Sheets Says"
IAB3,"Huawei, Russia Gas Pipeline on U.S. Agenda at Munich Conference"
IAB3,How Much Money Does Amazon CEO Jeff Bezos Make?
IAB3,"Tech Is at the Heart of ThirdLove's Success, Co-CEO Heidi Zak Says"
IAB3,Social Media Is Helping Consumerism
IAB3,Voters Wait for First Midterm Election Results as Polls Close on the East Coast
IAB3,Google Board Sued for Hushing Claims of Executive Misconduct
IAB3,Commodities Edge Roundtable: The Year Ahead for Commodities in 2019
IAB3,PGIM's Tipp Says Investors Shouldn't Be 'Nervous' About Investment-Grade
IAB3,Option Pit's Bullish Trade on Square
IAB3,Morgan Stanley's Graseck on Big Bank Price Target Cuts
IAB3,Race to Watch: Ohio's 1st District
IAB3,"Bloomberg Market Wrap 12/6: Chip Stocks, Nasdaq 100 Volatility and Banks"
IAB3,"After Criticism, Amazon Raises Minimum Wage To $15"
IAB3,Ex-Fed Governor Tarullo Sees Fed Close to Autopilot in Last Year
IAB3,The Tactics Behind Amazon's HQ2 Choice
IAB3,"Need 2 Know: El Chapo Guilty, Whole Foods Price Hikes"
IAB3,"It’s Been a Good Quarter and Year for BP, Says CEO"
IAB3,Denmark's PM Says Danske Scandal Boosts Case to Join EU Banking Union
IAB3,Amazon's Bid for Regional Sports Networks is Plan to Boost Prime Members
IAB3,Esports Bringing People Up Close and Personal With Virtual Reality Tech
IAB3,Pakistan Faces Demotion to Frontier
IAB3,Top Safest Banks In The World
IAB3,Standard Life Aberdeen's Gilbert Welcomes the Return of Volatility
IAB3,Obamacare Becomes a GOP Midterm Focus With a Twist
IAB3,Staffing Shortage Forces Halt To Arriving Flights At New York Airport
IAB3,"DUP Calls May's Belfast Visit `Waste of Time,' Says Brexit Deal Won't Pass"
IAB3,Stocks Plunge Amid Gathering Storm of Economic Concerns
IAB3,Ghosn Defends Himself in Court Saying He Was 'Wrongly Accused'
IAB3,Alibaba Records The Biggest Online Shopping Day Of All Time
IAB3,UBS' Gordon Sees Crude Prices Near $80 a Barrel in 1Q 2019
IAB3,Norwegian Air Offers Heavily Discounted Shares to Shore Up Balance Sheet
IAB3,La economía mundial desaceleró su crecimiento por la guerra comercial de Donald Trump
IAB3,"Bloomberg Market Wrap 12/20: Treasuries, Bearish Technicals and Volatility"
IAB3,L'Espagne et le Portugal liées par le textile
IAB3,Why Investors Are Worried About Square
IAB3,This Chart Has Predicted The Last Three Recessions: Cheddar Explains
IAB3,"U.S. Dollar Will Remain Strong for Coming Year, Says Barclays's Pepper"
IAB3,Uber's Deliveroo Purchase Stalls
IAB3,How Wall Street Views the U.S. December Jobs Report
IAB3,Jeff Bezos Ushers In New Year By Riding Horse Into Store
IAB3,"Browne, Pascualy on Bank Earnings and the U.S. Economy"
IAB3,"You Can Stay Long U.S. Stocks, Says Oanda’s Halley"
IAB3,Reasons to Rethink Fed Rate Hikes in 2019
IAB3,Why Wisconsin’s $4.5B Deal With Foxconn Is a Disaster
IAB3,Lending Startup Affirm to Test High-Interest Savings Accounts
IAB3,Nissan Ends Ghosn's 17 Year Reign
IAB3,"Oil Prices Set to Rise in First Quarter, Gulf Research Center Says"
IAB3,Millennials Make These Mistakes When Buying Their First Home
IAB3,"Fortescue's CEO on Iron Ore Demand, China, Consolidation, Diversification"
IAB3,'Bad Seeds' Lead Eurasia Group's Top Risks for 2019
IAB3,"Italy Exiting Eurozone Unlikely at This Point, Shepherdson Says"
IAB3,Carl's Jr Adds Beyond Meat Burgers To Menu
IAB3,Taking Stock of China’s Economy
IAB3,BNEF Brief: Shell CEO Pledges to Spend Billions on New Energies
IAB3,"U.S. Labor Market Remains Strong, But ..."
IAB3,Signals That Suggest Bearish Conditions Are Ahead for the S&P 500
IAB3,"Bloomberg Market Wrap 2/15: S&P 500 Resistance, TriNet Group, Walmart"
IAB3,Could Amazon Squash UPS And FedEx?
IAB3,"Election 2018: Dems Pick Up House Seats, But GOP Looks to Hold Senate"
IAB3,Managing the Emotions of a Dead Cat Bounce
IAB3,How Brands Build Customer Loyalty Through Shared Values
IAB3,Super Bowl ARatings Lowest In A Decade
IAB3,Spirit Airlines CEO: Low Fares Driving Extremely High Demand
IAB3,"Need 2 Know: Border Deal, Insect Extinction"
IAB3,"Need 2 Know: Jussie Smollett in Custody, Duke Superstar Injured"
IAB3,Verizon Cuts Media Jobs
IAB3,"Brexit, sale la media dei salari. Quale l'impatto sui mercati?"
IAB3,"Correction Won't Turn to Prolonged Bear Market, OppenheimerFunds Says"
IAB3,Theresa May Looks to Delay Brexit Vote
IAB3,Uber Is Said to File Confidentially for IPO
IAB3,"Kingdom Holding May Spin Off Part of Real Estate Business, CEO Says"
IAB3,The Big Business of Legalized Cannabis in Canada
IAB3,Wild FX Moves Baffle Markets
IAB3,"Trump Is a Lot of Show But Doesn't Always Have the Substance, Carly Fiorina Says"
IAB3,"Could See More Weakness in Yuan, Says Taurus Wealth's Preiss"
IAB3,UPS CEO: Online Shopping 'A Lot More Than Just Amazon'
IAB3,British Columbia Company Takes You Glacier Kayaking
IAB3,Danske Investors Need Nerves of Steel
IAB3,"We Feel Comfortable About High-Yield in Credit Space, Says JPMorgan's Craig"
IAB3,Budget italien : jusqu'au bout du bras de fer entre Rome et Bruxelles
IAB3,"Goldman Sachs, Banker to the Rich, Offers Savings Accounts for the Rest of Us"
IAB3,"Oil Has Not Found a Floor Yet, CIBC's Babin Says"
IAB3,Trump Said Tax Cuts Would Be 'Rocket Fuel' For the US Economy
IAB3,"VIX Shows Markets in 'Wait and See Mode' for Now, Curnutt Says"
IAB3,Vangst CEO Has Snoop Dogg's Backing in Quest to Staff Up the Cannabis Industry
IAB3,What MLB Can Do to Juice Playoff Ratings
IAB3,Sears Wants To Liquidate Assets
IAB3,Equity Markets Are Up Around The World
IAB3,"Amazon's HQ2 Decision Won't Impact NYC Real Estate, Redfin's Fairweather Says"
IAB3,"Snap Taps Big Execs to Boost Morale, Business"
IAB3,ECB Confirms It Will Halt Its Asset-Purchase Program
IAB3,"Tech Protests 'New Ground' for Silicon Valley, Maynard Webb Says"
IAB3,Nissan's Auditor Had Questions About Ghosn
IAB3,Morgan Stanley Sees MSCI EM at 1050 by End of 2019
IAB3,Latest Facebook Scandals Could Make It Harder To Hire
IAB3,"Growth in India Has Peaked, Says IDFC Asset Management's Choudhary"
IAB3,New App from Ex-NFL Player Makes Politics Easy and Simple
IAB3,Alison Brie 'Glows' in Netflix Original Series
IAB3,PwC Sees M&A Decoupling From U.S. Economy in 2019
IAB3,U.S. Job Openings Hit Record High
IAB3,"Accordo tra Italia e UE, niente procedura di infrazione"
IAB3,Cannabis Entrepreneur Wants to Build the Amazon of Weed
IAB3,Apple's Tim Cook Plays Offense on Data Privacy
IAB3,Why German Automakers Benefit From China-U.S. Trade Truce
IAB3,Snap Makes 2 Big Hires as Stock Struggles
IAB3,Alibaba’s Singles’ Day Breaks $1 Billion In 85 Seconds
IAB3,Enel CEO Starace Is Confident in Company's Strategy
IAB3,"Randstad Says Labor Market Tightening, Trade Spat Hurting Autos Staffing"
IAB3,Tencent Is Said to Slash Game Marketing Budget
IAB3,Uber Follows Lyft With IPO Plan
IAB3,Amazon Reports Record-Breaking Holiday Sales
IAB3,Budget italien : Rome échappe de peu à des sanctions
IAB3,Mindbody to Be Bought by Vista Equity
IAB3,Tech And Industrial Shares Drag on Wall Street
IAB3,"Rolls-Royce Coming Out With Autonomous ""Ship'"
IAB3,Stocks Up On Holiday Optimism
IAB3,"Amazon, l'entreprise la plus chère au monde"
IAB3,Kudlow to Cheddar: We're Not Going Back to a 'War on Business'
IAB3,GE Stars New Year With Huge Rally
IAB3,US Equity Markets Are Up After Strong December Jobs Report
IAB3,"2019 Will Be Year of Sustainable Investing, Says Northern Trust's Dzanis"
IAB3,Will the Dec. Jobs Report Impact the Federal Reserve?
IAB3,Italy Said to Reduce Budget Deficit Targets
IAB3,Tech And Industrial Stocks Boost Wall Street
IAB3,"Now Is a Good Time to Buy Bitcoin, Blockchain Capital's Bogart Says"
IAB3,Ex-BlueCrest Manager to Start $800M Hedge Fund Focusing on Asia
IAB3,BNEF Brief: Solar Projects Shielded From Rising U.S. Interest Rates
IAB3,"Moody's Managing Director on Bank Upgrades, Investment Bank Outlook"
IAB3,"Volatility Makes It Feel Even Worse Than a Bear Market, Tchir Says"
IAB3,Fed Board Nominee Nellie Liang Withdraws From Consideration
IAB3,Pepsi and Frito-Lay CMOs Going Long on Super Bowl Campaigns
IAB3,How Does PG&E Impact California's Municipal Bond Outlook?
IAB3,'PAWZ' Kills the ETF Industry With Cuteness
IAB3,Samira Wiley Doesn't Know Why a Poussey-Taystee Spin-Off Hasn't Happened Yet
IAB3,Job Growth Has Strong Month
IAB3,Learn2Play Teaches People How To Make Money On Esports
IAB3,Viacom Has Disappointing Earnings
IAB3,"Italy Bond Sale Shows 'Bit of Desperation,' Merian's Nash Says"
IAB3,Bill de Blasio Slams Amazon For Cancelling New York City Plans For HQ2
IAB3,Adam Levine Fears Losing His Shirt to Sears
IAB3,Why Huawei's CFO Was Arrested in Canada
IAB3,World Bank CEO Sees 'Stepped Up' Climate Action Everywhere
IAB3,CBS to Sell Television City Studio in LA
IAB3,Apple Shares Drop As Suppliers Warn Of Lower iPhone Sales
IAB3,"Mobius on Commodities Growth, Strong Dollar, 'Cheap' Emerging Markets"
IAB3,Africa's Resources in Focus for U.S. and China
IAB3,Damac Properties Posts 68% Profit Drop
IAB3,Merkel to Quit as CDU Head After Nearly Two Decades
IAB3,Disney and Verizon Make A Deal For 2019
IAB3,Oil's Slide Deepens as Demand Destruction Fears Build
IAB3,U.S. Treasury Secretary Mnuchin's Blame Game
IAB3,Rudd Pushes People's Vote 'Now That We Know What Leave Means'
IAB3,The Next Recession ...
IAB3,Roku CEO: All T.V. Will Be Streamed
IAB3,A $72 billion Canadian Investor Has Eyes On Silicon Valley
IAB3,Pimco's Frieda Says Strategy Has Been Very Little Changed From Political 'Noise'
IAB3,What to Watch for in Tesla's Fourth-Quarter Results
IAB3,"As Box Scales Cloud Services, Its CEO Thinks Small"
IAB3,"Lucid's VP for Design Jenkins on EV Plans, Saudi Investment"
IAB3,Eaton Vance's Patel Sees Infrastructure Optimism in Muni Market
IAB3,Ford Receives Tax Break For New Detroit Campus
IAB3,"BBDO CEO Sees More Fun, Less Politics in Super Bowl Ads"
IAB3,"Future of Crypto Is Brighter Than Ever, Says Bitcoin.com's Ver"
IAB3,Elon Musk Says Tesla Could Have Prototype Pickup Truck In 2019
IAB3,"May's Brexit Deal 'Isn’t Going Anywhere at the Moment,' Adonis Says"
IAB3,Fitbit Releases 3.0 Operating System
IAB3,Two Visions of America Compete as America Votes
IAB3,Man Accused of Stealing Wine From Goldman CEO Commits Suicide
IAB3,Canadian Job Growth in November Blows Past Estimates
IAB3,How Interactive Brokers' Steve Sosnick Is Playing the SPY
IAB3,"Caterpillar Misses 4Q Estimates, Sees 'Modest Sales Increase' in 2019"
IAB3,House Foreign Affairs Committee Vice Chair Castro Says Huawei Poses a National Security Threat
IAB3,"Pimco Says Invest Like It's Late Cycle, Not End of Cycle"
IAB3,Harvard's Reinhart Issues an EM Warning for 2019
IAB3,Google Shareholders Worry About a Potential China Search Engine
IAB3,"Pepsi Not Impacted by Trade War, CFO Johnston Says"
IAB3,Why China Might Delay 'Made in China 2025' Initiative
IAB3,How to Protect Your Portfolio Amid Rising Risk
IAB3,Caso-Huwei: la guerra commerciale Usa-Cina travolge il Canada
IAB3,Ford CFO Sees Signs of Stabilization From 'Tough' Second Quarter
IAB3,Facebook Is Going After TV Ad Dollars with Brand-Safe Shows
IAB3,U.K. Minister for Children and Families Hopes Deal Gets Through Parliament
IAB3,BofA's Meyer Says Now Is Not the Right Time for Fed to Be Hawkish
IAB3,ECB's Draghi Says Data Weaker Than Expected: Statement
IAB3,"Italy Should Expect at Least One Downgrade, Unicredit's Nielsen Says"
IAB3,"Mann: Would Like to See More Robustness in Labor Market, Wage Growth in Europe"
IAB3,Which Major Fast Food Chain Has The Best French Fries?
IAB3,"Komileva, Todd on the Future of Brexit"
IAB3,Here’s How Rihanna Went From Singer To Fashion Empress
IAB3,'Crazy Rich Asians' Star Hopes Film's Success Will Bring More Diversity to Hollywood
IAB3,BOE Looking at Brexit Scenarios Based on Smooth Transition
IAB3,EU's Moscovici Urges Italy to Get 'Closer' to Spending Rules
IAB3,"KFC Will Give Parents $11,000 to Name Their Baby After Colonel Sanders"
IAB3,U.S. Budget Deficit Reaches $319 Billion as Spending Outpaces Revenue
IAB3,"Homebuilding Up, But Not Single Family Homes"
IAB3,Madeleine Albright: Trump Is the 'Least Democratic President' in Modern U.S. History
IAB3,Airlines Having Major Black Friday Sales
IAB3,Biggest Billionaire Winners and Losers of 2018
IAB3,Indonesia's Warjiyo Says Clarity on Fed Hike Was Key Bali Meeting Outcome
IAB3,Job Growth Slowed In January
IAB3,"Alibaba Beats 3Q Estimates, Revenue Climbs 41%"
IAB3,CPS Energy CEO Says Disconnecting From the Grid Is 'Not That Easy'
IAB3,Judge Dismisses Class-Action Lawsuit Against Ford Motors
IAB3,"The Fed Is Caught in a Bit of a Trap, JPMorgan Strategist Hannah Anderson Says"
IAB3,Buffett's Questionable Track Record in Tech
IAB3,Fed's Powell Says He Would Not Resign If Trump Asked Him To
IAB3,"California Wildfires Intensify as Blazes Spread Over 196,000 Acres"
IAB3,Ghosn's Lawyers Ask Court to Explain Why He's Still Being Held
IAB3,Top Chinese Retailers Slash iPhone Prices
IAB3,US Stocks End 2018 Trading Lower
IAB3,DUP MP Campbell Sees Many in Parliament Voting Against Brexit Deal
IAB3,"Zuckerberg Pushes Back, Defends Sandberg in CNN Sit-Down"
IAB3,Netflix Helps Wall Street Rally With A Big Night At The Golden Globes
IAB3,Petrie on U.S. Oil Output Forecast
IAB3,Adecco's Lee Is Cautiously Optimistic on Asia's Labor Market
IAB3,Kamala Harris Joins a Crowded Democratic Field
IAB3,U.S. Dollar Strengthens Ahead of U.K. Parliament's Brexit Vote
IAB3,BOE's Van Steenis on the Future of Digital Banking
IAB3,Sony Plunges on Cloudy Growth Prospects
IAB3,US Prime Membership Breaks 100 Million Subscribers
IAB3,Rep. Jackie Speier: Cohen's Testimony Should Have Americans Concerned About Their Safety
IAB3,612-Pound Tuna Sold For $3 million
IAB3,Stocks Are Up After December Jobs Report Releases
IAB3,Fed Raises Borrowing Costs While Dialing Back Projections
IAB3,The New York Times To Raise Prices Following Heavy Discounts
IAB3,Dow Jones Snaps Two Day Losing Streak
IAB3,Venezuelan Political Crisis Threatens Global Oil Supply
IAB3,How Would The Economic Slowdown Affect China's Luxury Spending?
IAB3,Lyft Investor Reacts to Report of Possible IPO
IAB3,How Much Did The Government Shutdown Cost The U.S.?
IAB3,"Bahrain Received Part of Saudi-Led Financial Support, Al-Maraj Says"
IAB3,The U.S. Cost Guard Is About To Miss Its 2nd Paycheck
IAB3,Tesla's Head Of Global Recruiting Is Leaving
IAB3,Where the Dollar Rally and Oil's Roller Coaster Ride Head From Here
IAB3,Breaking Down Cisco's Upbeat 2nd-Qtr Earnings
IAB3,SurveyMonkey CEO on Amazon's NYC Exit and Facebook
IAB3,Uber Profitable Ahead Of IPO
IAB3,"Amazon Scrapping HQ2 Is a Victory for New York City, Council Member Van Bramer Says"
IAB3,Apple Shares Hit by Slowing IPhone Demand Concerns
IAB3,Rathbones' Chillingworth Sees 'More of the Same' for 2019 Markets
IAB3,Amazon Scouting Airport Locations For Amazon Go stores
IAB3,Obamacare Ruling Leaves Health Stocks Bracing for a Jolt
IAB3,"Rep. Hensarling on Maxine Waters, Trade, Fed Independence"
IAB3,May Says Best for Everyone to Get Brexit Deal 'Over the Line'
IAB3,Southwest Shares Drop Due To Spike In Cancellations
IAB3,Is Europe's Economy Back on Track?
IAB3,"Pmi, motore dell'economia europea"
IAB3,Portfolio Manager Urges Caution with Equities Amid Trade War Negotiations
IAB3,Nintendo President Says Company May Move Away From Consoles
IAB3,"Need 2 Know: Turkey’s President Calls for Saudi Action, Trump Christens Ted Cruz ‘Beautiful Ted’"
IAB3,Huawei 'Heiress' Arrested
IAB3,Ex-Amb. Jordan on Disappearance of Journalist Jamal Khashoggi
IAB3,Gauge of Money Managers Plunged 29% in 2018
IAB3,WWE And WrestleMania 34 Bring New Orleans A Big Payday
IAB3,Zuckerberg Hits Back at Scathing Report About Response to Russian Meddling
IAB3,Trivago CEO: Social Media Turning Travel Into 'Unifying Experience'
IAB3,Abbie 2.0: The Robot Who Knows How to Trade Bonds Better Than You
IAB3,Tesla's Model 3 Loses Consumer Reports Recommendation
IAB3,Global Markets Rallying Worldwide
IAB3,Antofagasta CEO Says `Outlook for Copper Is Very Positive'
IAB3,"New Trade Deal Is a Win for Trump, BridgePark's Selig Says"
IAB3,Here's What's in Store for Fintech in 2019
IAB3,China's Crackdown on Luxury Goods Spooks Markets
IAB3,Wayfair Tanks After Posting A Bigger-Than-Expected Loss
IAB3,IHOP Might Be Changing Its Name To IHOB
IAB3,US Dollar Hits 16 Month High
IAB3,Investors Locked Out Of Crypto Exchange After CEO Death
IAB3,Starbucks Adds Purple Sweet Potato Latte in South Korea
IAB3,Hyundai Announces Interim President
IAB3,"Bloomberg Market Wrap 12/12: REITs, Verizon and Under Armour"
IAB3,"Citigroup Isn't Changing New York Headcount for Amazon Move, CEO Corbat Says"
IAB3,IVP's Sandy Miller Sees Stronger Year Ahead for Tech in 2019
IAB3,Broadcom Says It's Victim of Fraudulent Memo on CA Deal Risk
IAB3,Wall Street's Lax Bros: The Real Life Brothers Bringing Lacrosse to the Masses
IAB3,"Why Activision, Alphabet, Amazon Are Baird's Picks for Rebound "
IAB3,How Appropriate Is Federal Reserve Policy?
IAB3,Schwab's Liz Ann Sonders: Reading into US-China Trade Developments is 'A Fool's Errand'
IAB3,"Ex-U.K. PM Blair on Brexit Vote, Second Referendum"
IAB3,Plurimi’s CIO Sees Gold as an Alternative to U.S. Dollar
IAB3,Shares Bounce Back As Awful October Ends
IAB3,Amazon To Send Physical Toy Catalogs This Holiday Season
IAB3,Will Elon Musk's Tweets Hurt Tesla In the Long Run?
IAB3,Italy Resists EU Budget Pressure on 'Necessary' Breach of Rules
IAB3,Rand Tumbles as South African Budget Includes Eskom Bailout
IAB3,Ukraine's Poroshenko Says Danger of Populism 'Extremely High'
IAB3,Marriott Claims Up To 500 Million Guests Have Been Hacked
IAB3,U.S. Business Orders Decline for Second-Straight Month
IAB3,"Ahold Delhaize Plans to Expand Digital Business, CEO Says"
IAB3,'Bloomberg Real Yield' Roundup: We Like Loans Despite Signs of Sputtering
IAB3,Coca Cola Slides After Disappointing Growth Forecast
IAB3,"Saudi Sanctions Depend on a Credible Probe Outcome, Hormats Says"
IAB3,Sony Electronics President Says Aibo Robo-Pup Shares Tech With Self-Driving Cars
IAB3,Lawyers Plan Appeal After Ghosn Makes First Appearance Since Arrest
IAB3,BNP Paribas Is Trading Around Three Key Risks for 2019
IAB3,"SAP CEO on Qualtrics Acquisition, China, Brexit"
IAB3,"Reach for Yield Is Back in Vogue, PGIM's Collins Says"
IAB3,"Sec. Ross on Enterprise Zones, Space, China Trade"
IAB3,Tesla’s Model 3 Sedan Is 'Biblical Simplicity'
IAB3,Moderna Therapeutics May Double In 2019
IAB3,"Amazon Bails on Queens, Leaving Real Estate Speculators Holding the Bag"
IAB3,"Fed Could Go Faster Than Priced Despite Inversion, RBC's Lignos Says"
IAB3,Facebook Shares Fall
IAB3,Boeing Boosts Value For Embraer's Commercial Business to $5.26 Billion
IAB3,"La Deutsche Bank, en Allemagne rattrapée par les Panama Papers"
IAB3,Ford Wants Its Cars And Trucks To Talk
IAB3,The Road to Public Markets for Uber and Lyft
IAB3,Nissan Delays Decision on Ghosn Successor
IAB3,Première comparution de Carlos Ghosn devant un juge japonais
IAB3,"CDPQ CEO Sabia on Global Trade, Credit and Bombardier Relationship"
IAB3,Mexican Finance Minister on Peso and Growth
IAB3,Facebook Faces Fresh Allegations of Allowing Access to Data
IAB3,Ford Invests $1 Billion in Chicago Plants Building SUV Models
IAB3,"Apple 'at Least Trying' to Protect User Data, Anchorfree CEO Says"
IAB3,Apple’s Biggest Product Flops&#x2028;
IAB3,Why Black & Decker Shares Are Tumbling
IAB3,Continental AG Paints Bleak Picture of Global Auto Market
IAB3,VC Perspective on the U.S. Gov't Shutdown
IAB3,Stocks Still Down After Fed Increases Interest Rate
IAB3,Première comparution de Carlos Ghosn face à un juge japonais
IAB3,"Brexit Vote Means BOE Is on Hold, Voya's Reinhard Says"
IAB3,Musk Hits Send Too Soon on Tesla Forecast
IAB3,EPA Exempts Exxon Mobil Refinery From Fuel Standard Laws
IAB3,Craft Beer Feeling Shutdown Impact
IAB3,"BofAML's Fund Manager Survey Sees Global GDP, Earnings Concerns"
IAB3,Trump Signs Order Prioritizing Artificial Intelligence Research
IAB3,"Riverfront CEO Doesn't Expect a Recession, Sees Markets Going Higher"
IAB3,Soho China CEO Says All Eyes Are on U.S.-China Trade Talks
IAB3,'GULF' Helps Investors Find Value Outside the U.S.
IAB3,Wall Street Ends Day About Flat After Early Morning Rout
IAB3,"Ford Recalls 3,500 Rangers"
IAB3,Twitter Slides After Beating Wall Street Expectations
IAB3,Deutsche Bank Said to Mull Shake-Up in Top Ranks
IAB3,What's Behind the CBD Crackdown in New York City
IAB3,"State Street's Kassam Favors U.S. Equities, EM Debt"
IAB3,"We Are Well Positioned to Move Forward, Says Nordea Bank's CEO"
IAB3,"March Is a Key Month for Markets, BlueBay's Riley Says"
IAB3,Chiavarone: Don't See Any Recession in 2019
IAB3,"U.S. Stocks Selloff to Continue Amid Trump's Fed Criticism, ThinkMarkets Says"
IAB3,SurveyMonkey CEO on Amazon's NYC Exit and Facebook
IAB3,Nestle Cutting Lunch-Meat in a Bid to Spur Growth
IAB3,Why Virgin Trains Decided to Sidetrack IPO
IAB3,Let the Sunshine In: 'TAN' ETF Outshines the S&P in 2019
IAB3,Facebook Looks to Beef Up Cybersecurity With Big Acquisition: Report
IAB3,EHarmony CEO on What Makes People Happy in Love
IAB3,Cardiologist Says FDA Is 'Late the the Show' on Teen Vaping Crisis
IAB3,Junk ETF Flows Feel the Pain of Oil’s Collapse
IAB3,Asian Stocks Sink Deeper Into a Bear Market
IAB3,Sears Takes Heat Fo Massive Bonuses
IAB3,U.S. Returns to Top of WEF's Global Competitiveness Rankings
IAB3,NYT Removes ‘Poorly Framed’ Tweet Regarding Pelosi’s ‘Hot Pink Dress’
IAB3,"Venezuela Sanctions to Prompt a Wave of Oil Selling, Baruch Says"
IAB3,"GM to Close Factories, Cut Jobs as Consumer Tastes Change"
IAB3,"IHOP, Applebee's to Introduce 'Guest-Facing' Technology to Make Dining Experience Easier"
IAB3,May Says Blocking Brexit Deal Could Thwart Divorce
IAB3,Uber Finds Secret Debt Sale Success With Ex-Goldman Bankers
IAB3,"U.K. 'Uninvestable,' but Pound May Be an Opportunity, Morilla-Giner Says"
IAB3,China Said to Halt Game Approval Process
IAB3,"UPS Profit Up From Tax Bill, Online Shopping"
IAB3,"U.S. Is Only Robust Market This Year, Bernstein's Fisher Says"
IAB3,BitGo CEO Says There's 'No Doubt' the Crypto Market Will Turn Around
IAB3,Cheddar Awards: Sophia Amoruso Is 2018's Best Comeback
IAB3,Why Central Bank Easing Could Be an Emerging Market Opportunity
IAB3,"Going to See a Lot More Volatility in Markets, Says Statewide Super's CIO"
IAB3,Lyft's New Subscription Plan Seems Like a Legendary Ripoff
IAB3,"Current Account Deficit Putting Pressure on Rupee, Says State Bank of India's Kumar"
IAB3,Cohen Testimony Won't Alter Public Opinion on Trump: Chatham House
IAB3,BofAML's Tanners Says Investors Don't See Trump Tariffs 'Sticking'
IAB3,"BNY Mellon Sees Weaker Euro, Wider Yield Spreads on Italy"
IAB3,"Bloomberg Market Wrap 11/28: Chico's, Bond Offerings and S&P 500"
