Category,Title
IAB3,"Oil Demand Has Been Driving the Prices Lower, Says Fat Prophets' Lennox"
IAB3,"Oando of Nigeria Plans Substantial Increase in Production, Says CEO"
IAB3,Abu Dhabi Approves $132 Billion Energy Budget
IAB3,Snap-On CEO on the Misconceptions of U.S. Manufacturing
IAB3,"Lukoil CEO on Succession Plans, Women in Oil Industry"
IAB3,Loews CEO Tish Sees Oil Back at $75 in Two Years
IAB3,Sentinel to Purchase Strike in $850 Million Pipeline Deal
IAB3,Musk Hits Send Too Soon on Tesla Production Forecast
IAB3,"Demand for Oil Relatively Robust, Says JPMorgan's Darling"
IAB3,Bitmain VP: Future of Crypto Is Everyday Transactions
IAB3,Knotch CEO Wants to Build a One-Stop Shop for Digital Ad Intelligence
IAB3,Former White House Photographer Remembers President George H.W. Bush as 'A Man of Honor'
IAB3,One CEO's Bet That Colorado Is the 'Permian for Water'
IAB3,List of Those Missing in Camp Fire Skyrockets
IAB3,Schwab's Sonders Says 2018 Likely Peak for Buybacks
IAB3,Oil Prices Hit Their Lowest Prices In 14 Months
IAB3,"U.S. and China Stocks Are on the Road to Recovery, Oppenheimer's Wald Says"
IAB3,"Need 2 Know: Chicago Hospital Shooting, California Mudslide Danger"
IAB3,Guggenheim's Minerd Expects High-Yield and Stock Rally to Be Sustained
IAB3,Alaska Pipeline Shut After Magnitude 7 Earthquake
IAB3,Tech Start-Up 'Say' is Looking to Bring Corporate Earnings Calls to the 21st Century
IAB3,T. Rowe Price's Page on Investing Ahead of the Brexit Deadline
IAB3,Dignitaries Pay Final Respects to President George H.W. Bush
IAB3,Now You'll Get Ads From ATT And Hulu When You Pause Your Videos
IAB3,"December Sell-Off Has Set Up Stocks for a Rally, Alger CEO Says"
IAB3,Cyber Monday On Pace To Break U.S. Sales Records
IAB3,Al Dhabi Capital's Ali Yasin Sees Money Waiting on Sidelines In Saudi Markets
IAB3,Barclays CEO Jes Staley on Brexit
IAB3,Rakuten CEO Mikitani Says He's Happy He Shunned Huawei and ZTE
IAB3,"Google's Top Searches of 2018: Dead Celebrities, World Cup, and Meghan Markle"
IAB3,Celebrities Making Millions From Instagram
IAB3,IMF's Lipton Calls for De-Escalation of Trade Tensions
IAB3,"Fed's Clarida on U.S. Economy, Powell Put, 2% Inflation Target"
IAB3,Taking Back Sunday Celebrates 20 Years with Grown Up Anniversary Album
IAB3,"Looming Government Shutdown, Fed Hikes Deepen Markets Losses"
IAB3,Netflix Reports Earnings Drop In 4th Quarter
IAB3,Securly CEO Uses Artificial Intelligence to Keep Kids Safe Online
IAB3,Uber Raised $2 Billion In Its First-Ever Bond-Offering
IAB3,Walmart Rolling Out Faster Checkout And Black Friday Deals
IAB3,"Apple to Build $1 Billion Campus in Austin, Add Jobs Around Country"
IAB3,Cheddar Awards: What Millennials Killed in 2018
IAB3,Actress Ivana De Maria Aims to Restore Empathy to Social Media with StoryPlace
IAB3,One Fund Seeking to Be the 'CURE' to Market Volatility
IAB3,Google Parent Alphabet Sinks Despite Earnings Beat
IAB3,Chase Wants to Take the Stress Out of Holiday Shopping
IAB3,Adam Bonnett to Exit Disney Channel as Head of Original Programming
IAB3,Record-Breaking Online Sales Expected Cyber Monday
IAB3,"Trump, China, and the Chaos of Foreign Policy"
IAB3,Cheddar's Treat Yo' Self 2018 Holiday Gift Guide
IAB3,Government Shutdown Is a Life or Death Issue for Native Americans: Tribe Chairman
IAB3,Black Friday's Going Green With Deals on Cannabis
IAB3,OECD's Boone Says Global Growth Has Peaked
IAB3,Marijuana and Criminal Justice Reform Advance in Key States
IAB3,Nike's Huge Post-Holiday Sale
IAB3,The Way of the Rising Influencer: Post Fake Sponsored Content
IAB3,This Startup Is Making Men’s Health Products Cheaper And More Accessible
IAB3,Research Points to Public Trust Gap in Social Media
IAB3,"Stock Markets, Federal Agencies to Close Wednesday for Day of Mourning"
IAB3,How to Stretch Your Travel Budget When Costs Rise in 2019
IAB3,"Maoyan Entertainment CEO on IPO, Growth Drivers, Industry Outlook"
IAB3,"Exclusive: Vancouver Film School Launches Program for Augmented Reality, Virtual Reality"
IAB3,The January Jobs Report Blows Away Estimates
IAB3,"Deutsche Bank, BofA, JPM Are Said to Be Questioned in Danske Probe"
IAB3,"Need 2 Know: Facebook Bombshell, Penny Marshall"
IAB3,Dignitaries Gather to Pay Final Respects to President George H.W. Bush
IAB3,American Airlines Shares Fall on Weaker Fare Forecast
IAB3,Our Favorite Moments From Michelle Obama's Memoir
IAB3,"CBI Is Wrong About Brexit's Business Impact, Forte Says"
IAB3,AGL Energy CEO Hopeful For Energy Policy By New Government
IAB3,What Options Trading Activity Signals About the Broader Market
IAB3,Weather Company CEO Unveils IBM Tools to Help Utilities Deal with Erratic Weather
IAB3,IEA Cuts Oil Demand Forecast as Prices Remain High
IAB3,"Ryanair Will Continue to Prioritize Increasing Market Share, Says CFO"
IAB3,"Forget Tom Brady: Mr. Peanut, Verizon Win Big During the SuperBowl"
IAB3,Fintech Start-Up Domuso Wants to Disrupt the Process of Paying Rent
IAB3,CEO Chris Urmson Says Aurora Is 'Building the Driver' for Driverless Cars
IAB3,Bitcoin Drops To Lowest In 2018
IAB3,"Apple to Invest $1 Billion for Austin, Texas Expansion Plan"
IAB3,Oil Prices Slip As US Output Pressures Globle Market
IAB3,How Giving Tuesday Evolved From 92nd Street Y Idea to Global Event
IAB3,Investors Try to Make Sense of Trade Confusion
IAB3,"Markets Have Become Less Negative, Says Tribeca's Liu"
IAB3,Walmart Had Good Holiday Season
IAB3,One Government Worker's Furlough Struggle: 'We Don't Know When It's Going to End'
IAB3,Google Maps Is Adding Many Alerts For Drivers
IAB3,Does Political Noise Matter to the Markets?
IAB3,Google Clarifies Rumor On Messaging App
IAB3,"Peak in Earnings Was a Year Ago, Says Pictet’s Paolini"
IAB3,Big Banks On Wall Street Post Third Quarter Earnings
IAB3,Danske's Money Laundering Scandal Won't Hurt Bonuses
IAB3,"The Bad News Has Evaporated From Markets, Says Horatius Fund's CEO"
IAB3,"Brexit Could Spur U.K. Housing Market, Says Rightmove's Shipside"
IAB3,Scottish Nationalist Leader Says U.K. Must Extend Article 50
IAB3,Office Depot's Bold Move Into Services is Paying Off
IAB3,Marlboro Is Going To Pot: Literally
IAB3,GM Cuts Jobs And Is Moving To Self Driving Cars
IAB3,The Mom Project Works to Help Get Mothers Back to Work
IAB3,"China's Slowdown Will Last for a While, Says Guangfa Securities's Shen"
IAB3,Lucid Takes On Tesla With New Electric Vehicle
IAB3,George W. Bush Delivers Stirring Tribute to Father at State Funeral
IAB3,Cheddar's Crystal Ball: The Smart Cities of the Future Are Already Here
IAB3,Death Toll From California Wildfires Rises as New Fires Form
IAB3,May Outlines Plan to Secure Parliamentary Consensus on Brexit
IAB3,UBS’s Haefele Is Overweight Global and Emerging Market Equities
IAB3,Cheddar Awards: Jeff Bezos is 2018's Biggest Flirt
IAB3,"Even the Healthiest People Indulge in Candy at the Holidays, Hershey Says"
IAB3,"Deals Report: Starboard's Investments, Gannett Rejects MNG's Bid"
IAB3,Prenup Generation: Millennials Drive Surge in Prenuptial Agreements
IAB3,Cigna CEO Sees Amazon as a Potential Future Partner
IAB3,"U.S. Rhetoric Is Hurting Trade, Sentiment, UniCredit Says"
IAB3,IMF Says U.S. Has to Address Its Large Fiscal Deficit
IAB3,"Impending Default Cycle Makes Corporate Bonds High Risk, Newton Says"
IAB3,"Software Was Sticking Point in Apple-Qualcomm Spat, Executive Emails Suggest"
IAB3,"Texas Obamacare Ruling Was Predictable, Ex-HHS Sec. Price Says"
IAB3,How Virginia State Delegate Chris Hurst Turned Tragedy Into Triumph
IAB3,Employee Ghosting Is Causing Headaches For Employers
IAB3,U.S. Files Charges in 1MDB Scandal
IAB3,Neighborhood Goods Is Reding the Department Store
IAB3,Missing Tally More Than Doubles in Deadliest Fire in California History
IAB3,"Lower-Growth World May Prevent a Return to Normal, KPMG's Hunter Says"
IAB3,Are Markets Wrong to Price Out 2019 Fed Rate Hikes?
IAB3,Analysts Split on China Rate Cuts
IAB3,"Ford CEO on Possible VW Partnership, U.S. Economy, Europe"
IAB3,SeatGeek Partners with Snapchat to Make Digital Ticket Stubs Shareable
IAB3,Remembering George H.W. Bush and His Legacy
IAB3,"Bloomberg Market Wrap 1/18: Bond Funds, S&P 500 Whipsaw and Financials"
IAB3,"Black Friday, Cyber Monday Sales Don’t Come Close To Alibaba Record"
IAB3,"Ex-Trump Lawyer Cohen Pleads Guilty, Agrees to Mueller Cooperation Deal"
IAB3,"Really No Reason for the Fed to Tighten, Says FTN Financial's Low"
IAB3,"Xi Is Under Pressure to Strike a Deal With the U.S., Oxford's Magnus Says"
IAB3,U.S. Said to Prepare Trump Order to Restrict Chinese Telecoms
IAB3,"Stocks Appear Vulnerable to a Pullback, Tom DeMark Says"
IAB3,Investors Look to Earnings Amid Market Confusion
IAB3,"Stocks Appear Vulnerable to a Pullback, Tom DeMark Says"
IAB3,Australia Defense Minister Pyne on U.S.-China Trade War
IAB3,"John Bogle Believed in Index Funds and His Legacy Will Live On, Vanguard CEO Says"
IAB3,What Does New Wisconsin Governor Mean for Proposed Foxconn Plant?
IAB3,IEA Sees 1Q Oil Supply and Demand 'Closely Matched'
IAB3,'Real Yield' Roundup: Should You Fade the January Comeback in Credit?
IAB3,"Need 2 Know: Kevin Hart's Out as Oscars Host, Bush Laid to Rest"
IAB3,Year Ahead Market Predictions From a Top Economist
IAB3,SparkCharge Gears Up to Bring Electric Vehicles On-Demand Charging
IAB3,GE's Ability to Offload Businesses
IAB3,FDA Cracks Down on Flavored E-Cigarettes
IAB3,The Key Takeaways From Alphabet's Earnings Report
IAB3,"Fed's Risk Management Underpins the Market, Curnutt Says"
IAB3,"Masdar's Al Lamki on Renewable Investments, Opportuntities"
IAB3,The Tax Changes That Are About to Sneak Up on You
IAB3,"Ohio to Allow Bitcoin for Tax Payments, Lending Legitimacy to Beleaguered Cryptocurrency"
IAB3,Surviving the Longest Flight in the World
IAB3,What Are Employers Looking For? Job Candidates with Good Communications Skills.
IAB3,Is the Restaurant Wine List Dead?
IAB3,"U.S. Dollar Likely to Hold Its Own Against G10, Says Rabobank's Foley"
IAB3,US Dollar Rises For Third Consecutive Session
IAB3,"Standard Life Aberdeen's Future Is Active Management, Skeoch Says"
IAB3,Colorado Drilling Clash Lands on the U.S. Midterm Ballot
IAB3,What to Watch for in Disney's First-Quarter Results
IAB3,Where Does Trump's Economy Rank Against His Predecessors?
IAB3,"Our Daily 1.2 Million Barrel Cut Will Take Care of the Market, Says U.A.E.'s Energy Minister"
IAB3,"Tips on How to Save Money (Even When You're Broke), by Father-Daughter Investor Duo"
IAB3,Target Grows Loyalty Program
IAB3,"How Does Geopolitical Fragility Impact Investments, Post-Munich?"
IAB3,"Florida, Florida, Florida! Why the Swing State Is Such a Battleground"
IAB3,Trump Digs In on Border Wall as Government Shutdown Looms
IAB3,What Books Billionaires Read
IAB3,Comcast Cable SVP Says Xfinity Stores Showcase the Future of Retail
IAB3,How UCLA Fosters Diversity in Its Law School
IAB3,"Evercore ISI's Hyman Watches Copper, Doesn’t Invest in Gold"
IAB3,How to Buy a Home If You're Disabled
IAB3,Chevron and PayPal Team Up to Make Getting Gas Exciting
IAB3,"Two Studies Show Dramatic Increase in Teen Vaping, and Its Related Health Risks"
IAB3,Cisco CEO Robbins Sees 'High Degree of Optimism' Among CEOs
IAB3,Roger Stone's Career as 'Dirty Trickster' Culminates with Arrest
IAB3,Sakakibara Sees Slow Yen Appreciation
IAB3,Nordstrom Customers Ditch Stores For Nordstrom Online
IAB3,"Siemens CEO Sticks to Alstom Rail Deal, Says 'We're Going to Make This Work'"
IAB3,The Hotel That Lets You Book a Room Based on Feelings
IAB3,The Latest On New Amazon HQ-2
IAB3,Cannabis Producers From Canada Looking To Enter US CBD Market
IAB3,"'Blockbuster' Jobs Data Makes Fed Rate Hike Argument, Greene Says"
IAB3,"Carlyle's Youngkin Sees Economic Growth Slowing, But Not Stalling"
IAB3,'Angry Uncle Bot' Will Make Your Thanksgiving Less Tense
IAB3,How to Avoid the Capital Gains Tax When You Sell Your Home
IAB3,Bank of Canada's Poloz Sees Future Policy as Data-Dependent
IAB3,"NEC's Kudlow on Jobs Report, U.S.-China Trade Talks"
IAB3,GE's Aviation Business Soars in Strong Market for Jetliners
IAB3,Take a Look Inside Paris’ Most Expensive Hotels
IAB3,Will Amazon's NY Warehouse Become Unionized
IAB3,Sapphire Ventures' New $115 Million Fund Draws Big Sports Backers
IAB3,"Lyft Activates 'Relief Rides' for Wildfires Victims, Announces 'Round Up & Donate' Milestone"
IAB3,"Trump Taking Pre-WWI Approach to Venezuela, CFR's Patrick Says"
IAB3,"Trade a 'Mixed Message' for U.S. Economy, Rep. Hill Says"
IAB3,"Publicis's Levy on Ad Industry, M&A, Tech Challenges, Brexit"
IAB3,Color of Change: The Civil Rights Thorn in Facebook's Side
IAB3,Intesa CEO Says Carige Is 'No Problem' for Italian Banking System
IAB3,New York Times Offers Metro Section Buyouts
IAB3,"Bridgewater, RenTech Make $13 Billion in Grim Hedge-Fund Year"
IAB3,Which Airlines Allow Puppies?
IAB3,UPS CEO Says Investments Paid Off in 'Smooth' Fourth-Quarter
IAB3,"Need 2 Know: Election Day, Amazon HQ2 Twist"
IAB3,"We Would Not Be Overweight European Equities, Says JPMorgan's Bell"
IAB3,Tech Startup Say is Looking to Bring Corporate Earnings Calls to the 21st Century
IAB3,Aurora Cannabis to Open for Trading on NYSE
IAB3,Microsoft Sales Meet Estimates But Cloud Concerns Hit Shares
IAB3,Advertisers Vie for Titles of Their Own in Twitter's #BrandBowl53
IAB3,Are College Students Getting Ripped Off By Banks
IAB3,Yanis Varoufakis Says France's Macron Is a `Spent Force'
IAB3,Mizuho's Reade Says Asian Credit Rally Has Further to Go in 1H
IAB3,"U.S. Equities May See a Decent Pullback From Here, Says AMP Capital's Oliver"
IAB3,Trump Makes Case for Border Wall as Shutdown Reaches Day 19
IAB3,"Chance of Hard Brexit Very Concerning, Says Finsbury's Rudd"
IAB3,Cannabis Sales Set to Light Up New Year's Eve
IAB3,"Asia’s Export Growth Outlook Remains Challenging, Says Oxford’s Fenner"
IAB3,"Ford Executive Chairman on Restructuring, EV Future"
IAB3,NBA Legend Earl 'the Pearl' Monroe: Why Basketball Still Resonates with Young People
IAB3,Nissan Said to Face Executive Pay Probe in U.S.
IAB3,"U.S., China Set for Long-Term Antagonistic Relations, Haitong's Carr Says"
IAB3,IBM's Greg Land Says Mobile Data Is Key to the Future of Travel
IAB3,China's October Exports Topped Estimates
IAB3,"May's Deal to Pass Without Substantial Changes, Schick Says"
IAB3,Epoch CEO Priest Sees a Global Struggle to 2% Growth
IAB3,"Oil Prices Poised to Move Higher, Vitol CEO Says"
IAB3,Moscovici: Growth Prospects Robust for Euro Zone
IAB3,Deutsche Bank to Get Qatari Commitment for More Funds
IAB3,"Global Economy Slowing Faster Than People Think, PGIM's Hunt Says"
IAB3,McConnell Seen Under Pressure to Act on Shutdown Impasse
IAB3,New York Gov. Cuomo Calls for a Fast Timeline to Legalization
IAB3,"CPPIB CEO on Davos, Sustainability, Investment Themes"
IAB3,RHB Securities's Zhuang Sees Negative Growth for China Auto Sales in 2019
IAB3,"Markets Expect a Brexit Extension, Says Ark Capital’s Abukarsh"
IAB3,"How To Prepare For Tax Season, Early"
IAB3,Millennials Need To Budget Because Of Massive Debt And Expenses
IAB3,How Apple Benefited From Last Year's Tax Cuts
IAB3,"U.S. Trade Tactics Hold Potential for Global Good, El-Erian Says"
IAB3,"MIT, Stanford Academics Design Cryptocurrency to Better Bitcoin"
IAB3,Swedbank Faces Allegations It Was Used to Launder Money
IAB3,"We Remain Reasonably Cautious on China, Says DWS' Taylor"
IAB3,Netherlands PM Rutte Wants to See Reforms From Italy
IAB3,"It’s in China’s Interest to Ensure Some Stability, Says Credit Suisse’s Woods"
IAB3,Why Davidson Lowered Apple Price Target
IAB3,Marijuana Earnings Reveal Troubling Trend in Canadian Cannabis
IAB3,Vanguard's Wang Expects More Monetary and Fiscal Stimulus From China
IAB3,"Powell Says Extended Shutdown Will Hurt Economy, Doesn't See Recession"
IAB3,What Activate CEO Wolf Sees for Tech in 2019
IAB3,"BMW Investing Heavily in Electric Vehicles, CEO Krueger Says"
IAB3,Why Microsoft Opened Its Wallet for Seattle Housing
IAB3,Intel's Swan Sees 'Natural Digestion' Behind Sales Slowdown
IAB3,What the Dollar Rally May Signal for Copper and Gold Prices
IAB3,"Who is Jeff Bezos' Protector, Gavin De Becker?"
IAB3,Palladium ETF Rides the Metal's Record Rally to Outshine Its Peers
IAB3,Melco CEO Says Japan Casino Resort Bidding Could Begin in 2019
IAB3,"Global Corporate Earnings May Fall to -5% in 2019, CCLA Says"
IAB3,How Activision Uses 'Call of Duty' to Raise Funds for Vets
IAB3,"U.S. Housing Starts Rise on Apartments, Multi-Family Housing"
IAB3,Toy Brand Little Passports Says It Has the Ticket to Success In a Post-Toys 'R' Us Market
IAB3,"Hard Brexit Chance Underappreciated by Market, Hildebrand Says"
IAB3,Fed's Rosengren Doesn't See Substantial Liquidity Issues With Balance-Sheet Runoff
IAB3,"More People Buying Homes Without Seeing Them First, Thanks to the Internet"
IAB3,The State of Workplace Savings on the 40th Anniversary of the 401(k)
IAB3,Cadillac President Discusses Future of Company and New XT6
IAB3,"You're Seeing a Bottom in Oil Prices Right Now, Says Tribeca's Fenton"
IAB3,Walmart Targets 'Middle America' With Streaming Content
IAB3,"Forecasts of Slower Growth Will Impact Fed Policy, CIBC Says"
IAB3,Why Is H&M Struggling?
IAB3,Jordin Sparks Shares Her Post-Baby Workout Tips and Playlist
IAB3,How Drones Can Plant and Protect Trees After Wildfires
IAB3,"FanDuel Strikes Deal With New Jersey Devils and NHL for Branding, Data"
IAB3,Wall Street Is About Flat After 4 Days Of Trading Up
IAB3,How To Avoid Bad Christmas Debt
IAB3,Bath & Body Works Looks Towards The Holiday Season
IAB3,Why Student Housing Is Attracting Institutional Investors
IAB3,"BB&T, SunTrust and the Need for Scale in Banking"
IAB3,"Markets Are Relying on Earnings to Spark Next Leg Up, Hunt Says"
IAB3,Zell Calls WeWork a Negative Example of Creating Unicorns
IAB3,StanChart's Investors Offer Muted Response to Three-Year Plan
IAB3,"Powell's Fed Took First Independent Steps, JPM's Kasman Says"
IAB3,"Powell Put Is in Full Force, Neuberger Berman's Kantor Says"
IAB3,Brokers Battle Inconsistencies in Employee Record Contents
IAB3,Qatar Will Leave OPEC to Focus on Natural Gas
IAB3,Ex-NFL Star Ricky Williams Says New Football League Will Update Old-School Ownership Structure
IAB3,Declaring a National Emergency to End the Shutdown Will Come Back to Haunt GOP: Erick Erickson
IAB3,"NYC Will Bounce Back and Fill Void Left by Amazon, Rudin Says"
IAB3,PG&E Files for Bankruptcy
IAB3,Melissa Rivers Opens Up About Suicide Prevention
IAB3,NJ Gov. Murphy Says Newark Still Has Welcome Mat Out for Amazon
IAB3,American Center for Mobility Is Where Rubber Meets the Road for Self-Driving Technology
IAB3,Another E.Coli Outbreak Shows Limits of U.S. Food Safety
IAB3,"Sibanye Stillwater CEO on Restructuring, M&A, South Africa Mine Strike"
IAB3,"Grais-Targow, Koesterich on Political Strife in Venezuela, Oil"
IAB3,Palm Makes a Comeback With New Mini Smartphone
IAB3,"FOMC Minutes Show a More Dovish Fed, Vanguard Economist Davis Says"
IAB3,State of the Union: What to Watch
IAB3,Feldstein Says China Stealing Technology Is Key U.S. Trade Issue
IAB3,Citi's Fordham Sees Article 50 Extension as Best Brexit Option
IAB3,Labour's McDonnell Says There's Been No Approach From May for Brexit Talks
IAB3,"Axel Weber Says Fed on Pause, ECB Likely to Delay Tightening"
IAB3,Disney Parks Announces New 'Avengers' Feature
IAB3,"Fed Will Allow Inflation to Run Above 2%, Evercore ISI's Hyman Says"
IAB3,Herro Says He's Not Adding to Positions in European Banks
IAB3,"Oil Climbs Higher Amid U.S.-China Trade, OPEC Concerns"
IAB3,Lime Offering Free Scooter Rides to the Polls
IAB3,"NYC Will Bounce Back Without Amazon, Rudin Says"
IAB3,Wells Fargo Lays Off Thousands Of U.S. Workers While Hiring Overseas
IAB3,Allianz GI CEO Says Markets Should Worry `Strategically' About Trade
IAB3,EU's Moscovici Says Up to U.K. to Say How to Avoid No-Deal Brexit
IAB3,Foxconn Reverses on Wisconsin Plant After Trump Talks
IAB3,AGL CEO Says Bipartisan Energy Policy for Australia Would Be Helpful
IAB3,NYSE President Sees 'Crunch Time' for IPOs From U.S. Shutdown
IAB3,Mom and Pop Shops Look for Holiday Boost on Small Business Saturday
IAB3,Netflix Announces New Roald Dahl series
IAB3,"Sen. Cardin on Venezuela, China, Trump Treaty Withdrawal"
IAB3,China's Digital Silk Road
IAB3,HSBC Revises Inflow Forecast for Chinese Bond Market
IAB3,Why It Might Be a Good Time to Buy European Equities
IAB3,"Bloomberg Market Wrap 2/11: Dollar, Commodities and S&P 500"
IAB3,"ACWA Power CEO Expects Renewable Growth in U.A.E., Egypt"
IAB3,Saudi Finance Minister Expects 2.6% GDP Growth in 2019
IAB3,"Uber to Benefit From Governance After IPO, General Atlantic CEO Says"
IAB3,"Value ETFs Ditched for Low-Vol, Multi-Factor Funds to Start 2019"
IAB3,Your New Year's Guide to a 30-Day Money Cleanse
IAB3,Bernie Sanders' Former Campaign Manager Says 2016 Lessons Would Inform 2020 Run
IAB3,"GM CEO Barra Faces Pushback From Trump on Plant Closures, Job Cuts"
IAB3,How KKM's Dan Deming Is Playing Gold Miners
IAB3,Credit Card Start-up Brex Launches Rewards Program for Tech Start-ups
IAB3,Under Armour Stomps on Nike's College Football Turf
IAB3,"Politics Driving Economics Isn't Ideal, L&G CEO Says"
IAB3,What New Pet Owners Can Expect to Spend on Their Animal Over a Lifetime
IAB3,Jes Staley Likes Capital Markets
IAB3,Can 'Red Dead Redemption 2' Overtake 'Grand Theft Auto'?
IAB3,A Southwest Passenger Was Forced To Leave Behind Her Fish
IAB3,Behind the Scenes of the Documentary Celebrating the Life of Justice Ginsburg
IAB3,Papa John Stock Tumbles
IAB3,"Sterling Traders Unprepared for No-Deal Brexit, Foley Says"
IAB3,House Majority Leader Hoyer Says Democrats Won't Negotiate with Hostage-Taker Trump
IAB3,"Markets Pointing to a Pause in U.S.-China Trade Tensions, Says SocGen’s Agbo-Bloua"
IAB3,"Apple-Goldman Credit Card 'Nothing Unusual,' Ellis Says"
IAB3,"JPMorgan’s Ebrahim Sees Asia as a Long-Term, Structural Growth Story"
IAB3,"Stocks Given `Healthy Dose of Reality' by Trade Fears, UBS Says"
IAB3,"Need 2 Know: Michael Cohen Bombshell, Blizzard Warnings"
IAB3,VW of America CEO Aims to Bring Brand 'Back to Life'
IAB3,A Florida Bank Robber Shoots Bank Employees And Customers
IAB3,Vanguard Holds Half of PG&E's $920M Municipal Bonds
IAB3,Trump Sets Tone for New Negotiations With Congress
IAB3,U.S. Third-quarter Growth And Business Spending Slowing
IAB3,Supply Shock: Vale's Dam Burst Sends Iron Ore Prices Surging
IAB3,"Credible, the Student Loan Marketplace, Gets Into Mortgages"
IAB3,Returning Toyota NA to Record Profitability
IAB3,Pollster Curtice Says May Risks Losing Control of Brexit Agenda
IAB3,Bob Diamond Steps Down as Atlas Executive Chairman
IAB3,Amazon's Biggest Bull Thinks Nixing HQ2 May Be a Bluff
IAB3,Busy Beauty COO Says Its Dry Products Target Millennials with No Time to Shower
IAB3,"BlueScope Steel’s CEO on Earnings, China Demand, Iron Ore"
IAB3,"Size Does Matter for Ride-Hailing IPOs, as Unicorns Rush to the Public Markets"
IAB3,New Report Finds It's Cheaper To Rent Than Buy In Most US Citiies
IAB3,Countdown to More U.S. Tariffs as Data Shows Grim Economic Picture
IAB3,BNY Mellon's Derrick Sees Euro a Little Higher By Year End
IAB3,US Auto Sales Slump During November
IAB3,Target Has A Two-Day Holiday Shipping Option
IAB3,The Markets' Obsession With 'Quality' ETFs
IAB3,UBS Fined $5.1 Billion in French Tax Trial
IAB3,"Chick-fil-A To Give Away 200,000 Free Sandwiches"
IAB3,Black Friday Online Sales Set Records
IAB3,Cheddar Awards: Stacey Cunningham Is 2018's Most Likely to Succeed
IAB3,UBS CEO Ermotti Says 'Too Early' to Call Q1 Performance
IAB3,Ryvicker: Going to Need Very Little Marketing for Disney Plus
IAB3,Congo Opposition Leader Is Surprise Winner of Presidential Votes
IAB3,BNP Reports 70% Plunge in Stock-Trading Revenue
IAB3,Does the U.S. Stock Market Rally Have Legs? Here's What to Watch
IAB3,Oil Prices Are Down To Lowest Prices Since Late 2017
IAB3,Netflix Is The First Streaming Media Company To Join Powerful MPAA
IAB3,"Charting Facebook, Microsoft and Watch the Micro-Caps"
IAB3,Apple Says China Ruling Will Force Qualcomm Settlement
IAB3,"Market Sentiment Conditions Are 'Washed Out,' MKM's J.C. O'Hara Says"
IAB3,Vera Bradley Ventures Into Men's Accessories
IAB3,Wilderness Adventurer Coyote Peterson Takes on the World's Most Painful Stings
IAB3,Southwest Air Says U.S. Shutdown Cost $60 Million in 1Q Revenue
IAB3,U.S. Consumer Comfort Falls to Lowest Level in Four Months
IAB3,What We Know About Middle East Earnings Season So Far
IAB3,Bain Capital's Cotton Sees Irreversible Dislocation in Retail
IAB3,Rich Millennials Are Hoping To Retire On Inheritance Money
IAB3,"Lyft Activates 'Relief Rides' for Wildfire Victims, Announces 'Round Up & Donate' Milestone"
IAB3,George Clooney And Rande Gerber Have A Third Partner In Their Billion Dollar Tequila Empire
IAB3,Ship Giants to Join Forces to Fend Off China Threat
IAB3,"Zurich Insurance Boosts Dividend, Targets EM Growth, CEO Says"
IAB3,China’s 5G Stock Trade Gets Crowded
IAB3,"BB&T, SunTrust to Combine in $66 Billion All-Stock Deal"
IAB3,Powell Says Fed Wants to Return Balance Sheet to Normal Level
IAB3,Mark Zuckerberg Has Lost Billions of Dollars: So What's Left
IAB3,How A Qatari Royal Plans to Lift Women in Her Country
IAB3,Kitchen Toke Tackles Cooking for the 'Cannabis Curious'
IAB3,Monica Lewinsky Talks New Anti-Bullying Initiative
IAB3,Oklahoma Sits on Shaky Ground Thanks to Oil & Gas Production
IAB3,Pot Glut Creates Gathering Economic Crisis in Oregon
IAB3,The Eye-Opening Whipsaw in Natural Gas Prices
IAB3,American Eagle And Abecrombie Try To Make Comeback
