Category,Title
IAB3,Buiter Says Socialist-Type Measures Would Do Well in America
IAB3,"Southwest's 'Operational Emergency' Is Actually a Labor Dispute, Skift Editor Says"
IAB3,Oprah Makes Money in Her Sleep Then Gives it Away
IAB3,Alienware and Riot Games Announce 'League of Legends' Partnership
IAB3,Why the Venezuela Crisis Might Not Be So Bullish for Oil
IAB3,Is UBS Delivering Enough for Shareholders?
IAB3,You Can Buy Hugh Hefner's Stuff at Auction - and Some of it Is Cheap
IAB3,Toyota Expands Role Of North American Execs
IAB3,Wall Street Doubts Trade War Truce And Opens Lower
IAB3,Lyft and Uber Locked in Race Toward IPO
IAB3,Why Wealthfront Is Offering Free Financial Planning
IAB3,Ways To Pay Your Student Loans Off Faster
IAB3,Laura Ling Champions Everyday Heroes in New Podcast
IAB3,Green Growth Brands Is Preparing Formal Offer for Aphria: CEO Peter Horvath
IAB3,HQ And Vine Founder Is Found Dead
IAB3,Southwest Cancels Hundreds Of Flights
IAB3,BNEF Brief: Dissecting PG&E's Bankruptcy
IAB3,How China's Crackdown on Scrap Imports Hits Recycling
IAB3,Colony Capital CEO Barrack Says Merger More Complicated Than Expected
IAB3,AllianceBernstein Shuns Developed Market Banks as Long-Term Investment
IAB3,Rubber Meets the Road for Self-Driving Tech at the American Center for Mobility
IAB3,Hurricane Michael Bears Down on Florida Coast
IAB3,Alexandra Pelosi Ventures into 'Trump Country' for New Documentary
IAB3,The Secret to Success for Westminster's Best in Show? Sleep
IAB3,Who Are Forbes Richest Celebrities?
IAB3,Almost Half Of U.S. Families Can’t Afford The Basics
IAB3,Tesla May Need To Raise More Cash In 2019
IAB3,Target Leads a Retail Retreat Ahead of Black Friday
IAB3,"Rapper Travis Scott Gave Fans $100,000 on Twitter"
IAB3,Why the Keto Diet Can Leave You Feeling Hungry
IAB3,Powell's Interest Rate Comments Cheer Wall Street Despite Trump's Attacks
IAB3,Discord Launches 'Netflix of Gaming'
IAB3,Dutch Finance Minister Doubts Italy's Budget Figures Add Up
IAB3,Banks Drive Wall Street Higher
IAB3,March Capital's Montgomery Sees Market Selloff as 'Blip'
IAB3,Amazon Receiving Lots Of Tax Incentives For Second HQ
IAB3,Obamacare Stocks Are Getting Whacked After A Federal Judge Says Health Care Law Unconstitutional
IAB3,This Is How 1040 Tax Form Is Changing For 2019
IAB3,Markets Search for Leadership in the Wake of a Selloff
IAB3,SoftBank Prices Telecom Unit IPO
IAB3,The New Startup Banking on Big Data to Identify Future Sports Stars
IAB3,GAM Said to Hold Talks With Potential Buyers as it Explores Options
IAB3,Star of Shyamalan's 'Glass' Spencer Treat Clark on How the Superhero Trilogy was Ahead of Its Time
IAB3,"Sen. Mark Warner Is Willing to Give Trump Border Security Funds, But for a Price"
IAB3,Comedian Dane Cook Says His Comeback Tour Isn't a Comeback Tour
IAB3,Nas Does Another Little Deal With Viacom For 340 Million
IAB3,Walmart Decides To Remove Products From Google's Retail Initiatives
IAB3,"If You're in the Path of Michael, Leave Now"
IAB3,The Chinese Startup Taking on Tesla at Home
IAB3,Online TV Streamer Locast Has an Ambitious Plan to Help Broadcasters
IAB3,Tesla To Slash China's Model 3 Prices
IAB3,Border Wall Stalemate Stretches Government Shutdown to 24 Days
IAB3,ASUS USA CMO Wants to Make Gaming More Inclusive for Women
IAB3,"PGIM Targeting Real Assets and Private Credit Deals, CEO Hunt Says"
IAB3,Credit Suisse Is Telling Client To Move Their Money Before Brexit
IAB3,The Worst Product Failures of All Time
IAB3,"Juul Pulls Products, Abandons Social Media Feeds Under Pressure Over Teen Vaping"
IAB3,How Abra's CEO Plans to Make the WhatsApp for Money
IAB3,Prepaid Card Transactions To Reach Nearly $400 Billion By 2022
IAB3,"Saudis Are Overtightening the Oil Market Again, Says Vanda Insights’s Hari"
IAB3,American CEOs Make 312 Times The Average Worker
IAB3,Truth Initiative CEO Says FDA Action on E-Cigarettes is Not Enough
IAB3,EXCLUSIVE: Facebook's Global Politics Director Unveils Tools for Ad Transparency
IAB3,Fed Sounds the Alarm Bell on Risky Corporate Debt
IAB3,NRF CEO Expects 'Exceptional' 2018 Holiday Shopping Season
IAB3,How Gen X and Gen Z Spend Money Differently
IAB3,What's Behind the Bitcoin Drop?
IAB3,Twitter Soars After Earnings Smash
IAB3,New Technology Brings Automation To Grocery Stores
IAB3,Chase Auto Offers Payment Relief For U.S. Workers Due To Shutdown
IAB3,27 Percent Of Netflix Users May Cancel After Price Hikes
IAB3,George H.W. Bush's Legacy in the Republican Party
IAB3,Questions Swirl Over Incentives Tied to Amazon's Reported HQ2 Decision
IAB3,Deloitte CTO on the Tech Trends Shaping Business Strategies
IAB3,Goldman Promotes Husband and Wife in New Partner Class
IAB3,ESG Flows: ETFs Play Catch-Up With Mutual Funds
IAB3,The VC Outlook for Asia
IAB3,"Rolls-Royce Takes Luxury Off-Road in a $325,000 SUV"
IAB3,Reports of Amazon's HQ2 Split Raise Questions about Financial Incentives
IAB3,Check Out The New Features On Spotify
IAB3,GAM Said to Offer Retention Bonus to Keep Star Fund Managers
IAB3,"Cresco Labs Begins Trading on CSE, but CEO Says U.S. Cannabis Market Is Still Its Focus"
IAB3,How Benchmark's Kevin Kelly Is Using Prologis to Hide From the Selloff
IAB3,Markets Soar After Fed Chairman Powell's Reassuring Comments on the Economy
IAB3,Starbucks Brings In The Holiday Early
IAB3,Jay-Z Company 'Tidal' Has an Issue With False Streaming Numbers
IAB3,An ETF That Wants to Grow 'OLD' With You
IAB3,Developing Indonesia's Financial Market
IAB3,How AlphaShark's Keene Is Trading the VIX
IAB3,Affirm Debuts Products to Help Consumers with Holiday Spending
IAB3,Leveraged ETF Issuer Targets Advisers With Arbitrage Portfolios
IAB3,Nike's Creative Director Says Nike's No-Lace $350 Shoes May Be the Future
IAB3,"U.S. Banks Are `Fantastically Well-Positioned,' Latitude CIO Says"
IAB3,5G Steals the Spotlight at CES 2019
IAB3,Brookfield Renewable CEO Sees Investment Opportunities in India and China
IAB3,Ontario Minister Says Province Can't Change GM's Mind
IAB3,"Bitcoin's Slide Deepens as Price Approaches $4,000"
IAB3,"May Taking Very Important Step on Brexit in EU, Germany's Zimmer Says"
IAB3,"Impossible Foods Wants to 'Serve the World,' Expands Meatless Burger to Stores"
IAB3,China Announces Punishments for Intellectual-Property Theft
IAB3,Markets Surge After Fed Leaves Interest Rates Unchanged
IAB3,CommonBond Acquires NextGenVest to Help Gen Z Navigate College
IAB3,Starbucks Teams With Alibaba on China Delivery Service
IAB3,Siri Co-Founder Says Steve Jobs Was 'Relentless'
IAB3,Deutsche Bank Headquarters Searched as Part of Panama Papers Probe
IAB3,"Pipeline Setbacks Are a 'New Normal,' Former TransCanada EVP Says"
IAB3,OPEC Announces Another Round Of Production Cuts
IAB3,Trump Blames 'Crazy' Federal Reserve for Stock Selloff
IAB3,"Dr. Phil Talks Up Oprah for President, But Says He Doesn't Think She Plans to Run"
IAB3,Sears Files for Bankruptcy
IAB3,How Prosper Trading Academy's CEO Is Trading JPMorgan
IAB3,Staffer Says Amazon Workers Were Fired ViaText Last Christmas
IAB3,SoftBank Invests Additional $2 Billion in WeWork
IAB3,China Said to Plan Major Expansion of Too-Big-to-Fail
IAB3,Sophia Robot Creator: We'll Achieve Singularity in Five to 10 years
IAB3,"Sell-Off Extends, Dow Sheds 700 Points After Huawei Exec Arrested"
IAB3,Intel Says it Wants to Be Known for More than Just PCs
IAB3,Nintendo's 'Smashing' Christmas?
IAB3,Microsoft President Calls for Facial Recognition Regulations
IAB3,"Dirty Lemon Pulls CBD Drink From Shelves, But Says It's Not Slowing Down"
IAB3,What Exactly Is 'Crowdsourced Delivery'?
IAB3,The Voice Assistant Revolution
IAB3,Elon Musk Talks About Plans For The Boring Company
IAB3,The Benefits of Adopting a Digital ID
IAB3,Why the World Bank Cut Its Global Economic Forecast
IAB3,Los Angeles Might Become The Biggest U.S. City To Ban Fur
IAB3,Constance Wu Hopes 'Crazy Rich Asians' Success Means More Diversity in Hollywood
IAB3,IPOs and Non-Emergency SEC Matters in Limbo as Shutdown Drags On
IAB3,The Explosive Growth of Airbnb's 'Wellness Experience' Travel Trend
IAB3,AT&T's Earnings Suggests It Needs Better Offerings
IAB3,Trump attacks GM in Ohio After Shutdowns
IAB3,Netflix Sued Over 'Bandersnatch'
IAB3,Orangetheory empowers fitness buffs with data
IAB3,Macau Casinos Face a Bleak Outlook
IAB3,Snap Slumps After Second CFO Departure in a Year
IAB3,GM To Make Major Car Cuts
IAB3,Billionaires Face Off After Former Starbucks CEO Considers White House Bid
IAB3,Nutrisystem CEO Says It's Expanding its Holistic Approach to Weight Loss Post-Acquisition
IAB3,How Marijuana May Mobilize More Voters to Go to the Polls
IAB3,'Vice' and 'The Assassination of Gianni Versace' Lead Golden Globe Nominations
IAB3,Viacom CFO Wade Davis Sees Strong Future in 'Free Price Point' TV Bundles
IAB3,Starbucks And Uber Eats Team Up For Delivery Service
IAB3,States Like Illinois Relying On Sales Tax
IAB3,"BB&T-SunTrust Deal Economics Are 'Phenomenal,' Former BB&T CEO Says"
IAB3,The Long-Term Bullish Case for U.S. Treasuries
IAB3,Hulu Hires Heads For New Ad Sales Units
IAB3,Venture Capitalist Bradley Tusk Wants to Use Blockchain to Get Out the Vote
IAB3,"U.S. Jobless Claims Rise to Four-Week High at 231,000"
IAB3,China Auto Sales Now in Reverse
IAB3,Fed Report Lists Financial System Vulnerabilities
IAB3,Marie Kondo Sparks Joy in Viewers... But Maybe Not Fast Fashion Retailers
IAB3,What to Expect From Alphabet's Fourth-Quarter Results
IAB3,Can Trump's State of the Union Balance Economy With Border Wall?
IAB3,Low-Cost Airlines Struggle to Maintain Budget Prices for Long-Haul Flights
IAB3,May Said to Weigh Delay to Brexit Vote
IAB3,Flooding Major Concern as Tropical Storm Michael Moves Past Florida and Over Storm-Weary Carolinas
IAB3,"May Wins Tory Party Confidence Vote, Stays as Leader"
IAB3,"The Week Ahead: FOMC Minutes, China GDP & U.S. Treasury's Currency Report"
IAB3,Coca-Cola CEO Focusing on Operational Plan for 2019
IAB3,When Is It Time To Find A New Job
IAB3,Tesla Plans $837 Million Auto Lease Bond
IAB3,Trump Nominates Barr to Succeed Sessions as Attorney General
IAB3,Swipe Left: Instagram Reverses 'Test' of New Interface After User Uproar
IAB3,How Amazon Is Protecting Kids Amid Data Breaches
IAB3,Soybean Prices Near Decade-Lows
IAB3,IBM Buys Red Hat in ‘Game Changing’ Cloud Deal Worth $34 Billion
IAB3,Walmart Aquiring Brands In Attempt To Take On Amazon
IAB3,Get 'Star Wars' Toys Monday During Amazon One-Day Sale
IAB3,"There Is Too Much of a Burden on the U.S. Dollar, Says Indonesia Investment Coordinating Board"
IAB3,Desk Items That Make You Look Unprofessional
IAB3,Leveraged Loans Show Credit Conditions Tightening at Increasing Pace
IAB3,"How Consumer Reports Has Kept Trust of Readers, CEOs"
IAB3,Pandora CFO Rules Himself Out From Permanent CEO Race
IAB3,Municipal Bond Market Wraps Up Tough Year of 'Muted' Returns
IAB3,Kansas State Rep Explains How a GOP 'Power Play' Convinced Her to Switch Parties
IAB3,Cost of Raising a Child Is At An All-Time High
IAB3,"U.S. Economy Can Withstand Higher Rates, Says StanChart's Meskin"
IAB3,"Ford, VW In 'Final Discussions' Ahead Of Partnership Announcement"
IAB3,Citigroup Offers Blunt Assessment of Its Gender Pay Gap
IAB3,Nike's Bet on Colin Kaepernick Might Have Paid Off
IAB3,"2019 Will Be a Big Year for Health-Care Deals, Deutsche Bank's Richitt Says"
IAB3,Mr. Musk's Wild Ride: My Trip Through the Boring Company's First Tunnel
IAB3,"Florida Seeing an Uptick in Demand for Million-Dollar Homes, Miller Samuel CEO Says"
IAB3,"Australian Finance Minister on Economy, Property Market, Dollar"
IAB3,"Combative Trump Calls for Bipartisanship, Threatens Democrats After Midterm Losses"
IAB3,Oil Drops To Lowest Prices For 2018
IAB3,Ford's Scooter Acquisition is Actually About Self-Driving Cars
IAB3,Apple Is The World's Most Valuable Company
IAB3,Millennial Women Make Up Increasing Chunk of First-Time Home Buyers
IAB3,Aldar Properties CEO Says Abu Dhabi Property Market at an Inflection Point
IAB3,Nissan Seizing Keys To Ghosn's Homes
IAB3,Barnier Says EU `Profoundly Regrets' Rejection of Brexit Deal
IAB3,"Uber Eats Growing Faster Than Expected, VP Droege Says"
IAB3,Carney Says BOE Ready to Act No Matter the Brexit Outcome
IAB3,Royal Dutch Shell’s Wetselaar Sees LNG Growth Accelerating in 2019
IAB3,$62 Million Manhattan Penthouse Faces Luxury Realty Reality
IAB3,Instagram Is Changing the Fashion Industry. Just Ask Influencer Eva Chen.
IAB3,"Novogratz Sees Bitcoin at $3,000 to $6,000 in the Near Future"
IAB3,"Enterprise Companies Shift Toward Emerging Tech, Oracle Cloud's Steve Daheb Says"
IAB3,Resy CEO Is Taking on OpenTable (and the Telephone) with New Acquisition
IAB3,Amazon Signs Production Deal With Viola Davis's Company
IAB3,"Need 2 Know: Romney Attacks Trump, Government Shutdown Meeting"
IAB3,How Do Retail Stores Get Clothing To Be So Cheap?
IAB3,U.S. And China Having Productive Meetings
IAB3,Target Shares Tumble After Earnings
IAB3,What You Need to Know About Salary Trends in Asia's Finance Sector
IAB3,Netflix’s Global Paid Subscribers Grows Past 130 Million
IAB3,Investors Embracing Real Estate Debt in Asia-Pacific Says CBRE's Chin
IAB3,US Crude Oil Drops Below $70 A Barrel
IAB3,Tesla Revamps Pricing And Naming System For Model S And Model X
IAB3,Want To Be A Wild Business Success Without Being A Workaholic? Here's How One Woman Did It
IAB3,A-Rod on His Next Inning: Becoming a CEO
IAB3,Uber's Growth Slows as It Diversifies Business Ahead of IPO
IAB3,"Fortnite Isn't Just a Fad, Lightspeed Investor Says"
IAB3,InterContinental Hotels Group CEO Aims to Tap into Growing Middle Class in China
IAB3,Buffett Bets on Banks as He Exits 20-Year Walmart Stake
IAB3,"Need 2 Know: Trump Storms Out, Bezos Files for Divorce"
IAB3,"Fed Asset Cap Not Impacting Wells Fargo, CFO Says"
IAB3,Canopy Growth CEO Bruce Linton Hopes to Create Hemp 'Hub' in New York State
IAB3,"Need 2 Know: Trump & Russia Probe, Winter Weather"
IAB3,Amazon's Alexa Crashed On Christmas Day
IAB3,"India Is Becoming Largest Growth Market for Energy, BP Says"
IAB3,Facebook's Advertising Spree
IAB3,Jackie Joyner-Kersee's Tackles STEM with Help From Alexa
IAB3,CBRE CEO Breaks Down the Commercial Real Estate Market
IAB3,"Very Difficult for Nigeria to Reduce Oil Production, Says Oil Minister"
IAB3,PayPal Launches Employee Blockchain Experiment
IAB3,CBI Says `Vast Majority' of Firms Aren't Ready for No-Deal Brexit
IAB3,"Microsoft President Calls for End to Government Shutdown, Citing International Concerns"
IAB3,Congressman Reed: Raising Interest Rates Could Have 'Devastating Consequences'
IAB3,"Need 2 Know: Super Bowl Snoozer, Virginia Governor Scandal"
IAB3,China Releases Personal Income Tax Cut Plan
IAB3,What Luxury Retail Looks Like in 2019: Data Break
IAB3,"Bloomberg Market Wrap 2/19: S&P 500 200 DMA, Gold and Pound"
IAB3,"Ohanian Says Facebook's Future is WhatsApp, Instagram, and Sandberg Should Stay"
IAB3,La economía alemana se contrae en el tercer trimestre de 2018
IAB3,Arrest of Huawei Executive Prompts Sell-Off on Fears of Escalating U.S.-China Tensions
IAB3,Facebook's Mixed Earnings Point to Slowing Growth Ahead
IAB3,Thousands Of GM Engineers Are Being Reassigned To Work On Electric Vehicles
IAB3,Tesla Senior Director Leaves Company For AirBnB
IAB3,"Wall Street Is Focusing Too Much on Tesla's Production, Analyst Keeney Says"
IAB3,Amazon Will Deliver a Live Christmas Tree
IAB3,Is Macron's Gas Tax Concession Enough to Satisfy Paris Protesters?
IAB3,"Trend Toward Cashless Retail Raises Concerns about Classism, Racism"
IAB3,Costco May Launch A Streaming Service In The Future
IAB3,"Envoy Air Employees Feel Overworked, Found Faulty Equipment"
IAB3,Fat Brands CEO Andrew Wiederhorn Says Government Shutdown Hurts Franchisees
IAB3,"Guy Hands on Europe Risks, Fundraising Climate, Entrepreneurialism"
IAB3,Bombas Makes Socks That Feel Good and Do Good for the Homeless
IAB3,Stocks Continue to Plunge as Weak Earnings Guidance Rattles Investors
IAB3,Three Ways to Approach Impact Investing in Africa
IAB3,"Bond Issue Would Make Sense for Canopy Growth, CEO Says"
IAB3,"Look for Companies That Are Cash Rich, Low Debt, Says Seven Stars Cloud's Parpart"
IAB3,Trump Coal Rescue Plan Not Backed by Study
IAB3,"What U.S. Inventory, Production Mean to Global Oil Market"
IAB3,Fed Expected to Hold Rates Steady
IAB3,Netflix's Latest Canadian Import 'Workin' Moms' Isn't Afraid to Tackle Difficult Topics
IAB3,"Toyota To Replace 65,000 Takata Airbags"
IAB3,"Gwyneth Paltrow on the Feminine Culture of Goop, Start-Ups"
IAB3,Amazon Picks Location For New Offices
IAB3,Buffett's Bad Week Tallies Billions in Losses
IAB3,Facebook Wants to Beef Up Cybersecurity With Big Acquisition: Report
IAB3,"Renewable Energy Is Mainstream Now, Masdar CEO Says"
IAB3,How PayPal is Quietly Teaching Employees About Blockchain
IAB3,IKEA President Retires After 36 Years With The Company
IAB3,Sears Is Still Alive In Last Minute Deal
IAB3,Macy's Is Closing Eight Stores Early This Year
IAB3,"We Affirmed China's A+ Rating With Stable Outlook, Says Fitch Ratings's Schwartz"
IAB3,Pizza Hut Is Also Becoming Beer Hut
IAB3,Credit Card Provider Brex to Expand Beyond Startup Customers in 2019
IAB3,Rep. Judy Chu: Republicans 'Made False Claims' About Tax Reform
IAB3,NFL Alum Goes From Gridiron to Taking on Partisan Gridlock
IAB3,Aaron Eckhart Is Part of TV's Newest Royal Family
IAB3,"Tech Reckoning Already Happened, Amazon & Google Are Oversold, RBC's Mahaney Says"
IAB3,"Swiss Franc `Flash Crash' Caused by Fat-Finger Trade, Nomura Says"
IAB3,Green Plains CEO Says Gasoline Demand Remains Good
IAB3,San Fran Politician Want To Remove Mark Zuckerberg From Hospital
IAB3,Acreage CEO Kevin Murphy Doesn't 'Begrudge' CBS for Killing His Cannabis Commercial
IAB3,Why Activision Is Slashing Costs Across the Board
IAB3,How DoorDash Is Taking On Uber Eats and GrubHub
IAB3,"BofA Brings Back Special Cash, Stock Bonuses for a Second Year"
IAB3,Dow Jones Struggles To Keep Gains Made During 2018
IAB3,George Steinbrenner IV  Takes Yankees' 'Winning' Brand to IndyCar Track
IAB3,This Swiss Village Is Testing Out Universal Basic Income
IAB3,Pepsi SnackBot Lets College Students Order Late-Night Snacks Via Robot
IAB3,Rep. Frankel Says a 'Pink Wave' is Coming: Trump Is 'Best Recruiter' Democrats Have
IAB3,How Chef Judy Joo Went From the Trading Floor to Trading Recipes
IAB3,PropertyFinder's CEO Confident in Dubai Property Market
IAB3,SAP Diversity Lead Says Representation Starts with Transparency
IAB3,November Movie Preview: 'Netflix Wants to Win Oscars'
IAB3,Long-Term Charts Bullish for Equity Futures
IAB3,There Is A New Base Price For Tesla's Model S And Model X
IAB3,"We Hope to Make Progress on Banking Union Today, Says Dombrovskis"
IAB3,Italy Offers 2.04% Budget Deficit Target
IAB3,Waymo Launches Self Driving Shuttle Service
IAB3,U.S. Dominates Ranking of Top Global Business Schools
IAB3,Skidelsky Says Would Have Been a Brexit Deal Without Irish Issue
IAB3,Why New Street's Ferragu Upgraded Apple to Neutral
IAB3,"Reddit Cofounder Says He's ""Learning"" How To Be Wealthy"
IAB3,"Stance on Venezuela Is One of the 'Bright Spots' in Trump's Foreign Policy, Ex-Diplomat Says"
IAB3,Young Entrepreneurs Enlist Benioff and Kutcher to Help Workers Achieve Financial Wellness
IAB3,NASA Launches Experiment in Space With Help of Michael J. Fox
IAB3,Bitcoin Bumps Up 6 Percent
IAB3,Airbnb Is Giving Away a Stay on the Great Wall of China
IAB3,"There Are More Women Entrepreneurs Now, But The Reason Is Bad"
IAB3,Blackstone's Jon Gray Says He's Bullish on U.S. Housing
IAB3,Plank on the State of Under Armour
IAB3,"Trump Shutdown Talks 'Not Really a Negotiation,' Rep. Hoyer  Says"
IAB3,'Xperience' the Most Coveted Golf Clubs in the Game
IAB3,Bitcoin Market Capitalization Takes Sharp Plunge
IAB3,Trump Unleashed: 'Master of All Media' Becomes His Own Spokesman
IAB3,"Need 2 Know: Virginia is for Scandals, Instacart's Tip Reversal"
IAB3,NJ Gov. Murphy Says Newark Still Has Welcome Mat Out for Amazon
IAB3,Brookfield CEO Sees London as Great Place to Invest for a Long Time
IAB3,"Semiconductor Fundamentals Haven't Reached a Bottom, Says CLSA's Hou"
IAB3,"S&P 500's Next Move Will Be Lower, Sierra Alpha's Keller Says"
IAB3,Walmart Makes Improvements For Holiday Season
IAB3,Why Business Cards Are A Good Investment...
IAB3,Swiss Young People Reveal Their Salaries to Fight Inequality
IAB3,Netflix Tumbles after Reporting Mixed Earnings and Revenue
IAB3,How Tribeca Trade Group's CEO Is Trading ServiceNow Ahead of Earnings
IAB3,Retail Sales Suffer Sharpest Decline In A Decade
IAB3,How About Drinking Vitamin Water And Ditching Your Phone For Cash
IAB3,How Trump Tariffs Are Hitting Online Shipping
IAB3,The US Will No Longer Be the World's Most Powerful Economy Next Year
IAB3,Lowe's Scores Massive NFL Deal And Takes Direct Aim At Home Depot's Core Customers
IAB3,"Supply Chain, Cyber Threats Among Key Risks for Businesses in 2019"
IAB3,There Would Be No Amazon Without MacKenzie Bezos
IAB3,Amazon Is Trying To Expand Its Reach In India's Soon-To-Be $200 Billion E-Commerce Market
IAB3,"Need 2 Know: Snowstorm Snarls Commutes, Assange Charged"
IAB3,Forget The Foosball: Startup Wants Companies To Help Employees With A Far Better Perk
IAB3,Tech Industry Leads the List of Top-Growing Jobs: PayScale Report
IAB3,Walmart Builds Town Centers
IAB3,Lilly Pulitzer CEO Celebrates 60 Years of 'Making People Happy'
IAB3,Abu Dhabi Oks $132B Energy Budget
IAB3,Did Someone Say The Richest Asian Billionaire Is A Communist
IAB3,"Koesterich, Sutherland on Outlook for the Industrial Sector"
IAB3,Dell Returns To NYSE As Publicly Traded Company
IAB3,How Do You Ask A Coworker How Much They Make?
IAB3,IBM Buys Red Hat in 'Game Changing' Cloud Deal
IAB3,"Tim Cook is No Steve Jobs, Jobs' Ex-Publicist Says"
IAB3,UPS Expands In-Home Delivery Service To Take On Amazon Key
IAB3,Weather Trumps Economic Indicators for Columbia Sportswear
IAB3,Taco Bell Giving Away a Platinum Limited Edition Xbox One X Bundle
IAB3,"Apple Blocks Facebook Over Covert Market Research Program, Escalating Tensions"
IAB3,Pizza Hut Wants To Deliver Pies In Autonomous Cars
IAB3,"For Cuomo, Legalizing Pot in N.Y. Would Be Political Win, Not Economic Silver Bullet"
IAB3,Court Rejects Ghosn Jail Extension
IAB3,$1.3 Trillion Is US Debt In 2018
IAB3,Bitcoin's Steep Fall Returns to Jamie Dimon's 'Fraud' Level
IAB3,What If the Fed Is Getting It Right?
IAB3,The Government Shutdown Is Making Life Worse For U.S. Farmers
IAB3,"Renewable Energy Is Growing Off the Charts, BP Chief Economist Says"
IAB3,Tesla To Ramp Up Model 3 Production Over Holiday Season
IAB3,Apple and Goldman Said to Develop Credit Card
IAB3,Where's the Pound Headed as May Leads Last Ditch Diplomatic Drive?
IAB3,Renault Finds No Evidence of Wrongdoing on Ghosn's Compensation
IAB3,"Oil Is Close to Bottoming Out, Says St. James's Place's Ralph"
IAB3,"Sedans May be Dying Here, But They Sell Big in China, Lincoln Motor President Says"
IAB3,Kardashian-Fashion Nova Feud Spotlights Conflict Between Influencers and Fast Fashion
IAB3,Report: Slack Planning To Go Public Through Direct Listing
IAB3,"Tech-Savvy South Korea Nixes Airbnb, Ridesharing Startups"
IAB3,New Climate Change Report Sounds Global Alarm ー Is Anyone Listening?
IAB3,NBA Embraces Technology to Deliver Game to Fans
IAB3,Floyd Mayweather And DJ Khaled Are In Trouble With The Law Over Crypto Deals
IAB3,Tina Brown: Facebook Is a 'Vulture' That Should Be Regulated
IAB3,New Fitness Streaming Company FightCamp Turns Your Living Room Into a Boxing Ring
IAB3,"A New Baby, Elon Musk, and Some Earbuds Made Ray J a New Man"
IAB3,Selling in Tech and Retail Stocks Erases Market Gains
IAB3,"Volkswagen Bids Farewell to Iconic Beetle, Hello to Future"
IAB3,How the Rent the Runway Founders Changed Shopping
IAB3,"Emerging Markets Could See Rally Into 2019, Says Jefferies Darby"
IAB3,Chipotle Rolls Out Diet-Friendly Bowl Options
IAB3,Fund Managers Betting On Emerging Markets
IAB3,UN Ambassador Nikki Haley to Resign- Report
IAB3,One of Wall Street's Biggest Moneymakers Ramps Up Again
IAB3,Why Paint Nite Isn't Just About Artwork
IAB3,Companies Leave The UK As Brexit Approaches
IAB3,Did Renault Pay For Ghosn's Wedding?
IAB3,Facebook Says 14 Million Users Had Intimate Data Hacked
IAB3,EXCLUSIVE: How Facebook is Fighting Midterms Fake News Around the Clock in its 'War Room'
IAB3,Cheddar Crystal Ball: Where Artificial Intelligence Is Heading in 2019
IAB3,Renault's Board Said Preparing to Replace Ghosn With New Leadership
IAB3,"After Canceled IPO, Volvo Fixes Gaze on Future"
IAB3,Nela Richardson on Inflation and the Fed
IAB3,"Vintage Fashion Collector Offers 20,000 Dresses for Sale"
IAB3,"Balance Sheet Normalization and Trade Are Biggest 2019 Risks, Says Invesco's Hooper"
IAB3,Company Behind 'Pooey Puitton' Defends Right To Sell Its Product
IAB3,Wells Fargo Sees Revenue Drop
IAB3,"Need 2 Know: Russian Meddling Report, Moonves Loses Severance"
IAB3,Soros Is Said to Reduce Macro Trades as Opportunities Disappear
IAB3,Ex-NFL Player Tiki Barber Turns Cannabis 'Opportunist' with Latest Management Venture
IAB3,"Interactive Brokers Listing Is a Sign of Confidence, IEX CEO Says"
IAB3,City National Bank's Goldsmith Stepping Aside as CEO
IAB3,Former Commerce Sec. Gutierrez on George H.W. Bush and Trade Truce
IAB3,"Royal Caribbean CFO Says Cruisers Are Spending on Experiences, Not 'Stuff'"
IAB3,"Nasdaq, Citi Invest in $20 Million Fund Raise for Smart Contracts"
IAB3,Deutsche Bank-Commerzbank Merger Talks Intensify
IAB3,Navarro Warns Wall Street to Stay Out of China Trade Talks
